id;id_str;screen_name;location;description;url;followers_count;friends_count;listedcount;created_at;favourites_count;verified;statuses_count;lang;status;default_profile;default_profile_image;has_extended_profile;name;bot
5932462;5932462;samdownie;Always on-location somewhere;Acclaimed Neurodiverse #Actor #VoiceActor #Presenter #Host #filmmaker @BFINetwork backed . #ActuallyAutistic & #Epilepsy . #FrontlineKeyWorker;https://www.dsoundz.co.uk/;4185;4999;223;Thu May 10 16:21:23 BST 2007;110787;false;84839;en;RT @JoeMayo: #BotFramework v4.8 Released: https://t.co/zH9ZFNCHCK #Chatbots;false;false;false;Sam Downie ♿️ #ActuallyAutistic Presenter / Actor;0;2020-04-28;
2718802341;2718802341;UnervingJoltik;null;“Nice berry ya got there.” [Joltik/Gijinka|Single];null;303;179;7;Sun Jul 20 16:40:34 BST 2014;3;false;24763;en;"Yes  that's right Batteries are useless." #Bot;true;false;true;Amy [H];0;2020-04-28;
2593935008;2593935008;JaakkoTheRipper;null;Hey Guys an girls go follow @BelowTheButler and @YoullLoveIt;null;175;190;7;Sun Jun 29 01:47:37 BST 2014;732;false;105198;en;Tears are words that need to be written. #Bot;false;false;false;;0;2020-04-28;
625501257;625501257;iCedric_Diggory;Hogwart;RP Account of Cedric Diggory from Harry Potter :);null;249;32;12;Tue Jul 03 10:41:17 BST 2012;0;false;132483;en;Cedric grew up near Ottery St. Catchpole [1] and started attending Hogwarts School of Witchcraft and Wizardry on September 1st  1989. #bot;true;false;true;Cedric Diggory;0;2020-04-28;
1023136825680916480;1023136825680916480;Bot10119;null;TestBot No.101 http://Data.20005.xxx;null;2;2;0;Sat Jul 28 10:23:23 BST 2018;0;false;1248;en;Hey Hello Test ##bot;true;false;true;Bot101;0;2020-04-28;
1401014629;1401014629;ReaperRebellion;Probably with @ForbiddenIgnis;《 ソウルイーター》~ SӨЦL ΣΛŦΣЯ {#BBRP} {#MV} {Parody/Serious} {AU};http://awakeningwings.wikia.com/wiki/Ragna_the_Bloodedge;803;1712;7;Sat May 04 00:50:42 BST 2013;443;false;40788;en;"Restriction 666 released  dimensional interference field deployed! Now engaging the Idea Engine! Blazblue  Activate!" #bot;true;false;true;ラグナブラッドエッジ;0;2020-04-28;
738532622;738532622;Sakaki_Kouichi;Yomiyama  japan.;The first RolePlayer of Kouichi Sakakibara. Official #Anotherfamily. INA-ENG-JAP. @Misakiimeii_'s Fiancee♥ | HIDUP DUO CUCOKK!! (ʃƪ´▽`);null;295;82;5;Sun Aug 05 13:49:27 BST 2012;2;false;73718;en;hello   Kouchi-kun is not here  may i help you ? #BOT;true;false;true;Sakakibara Kouichi;0;2020-04-28;
569533095;569533095;JWCforAmerica;California;#ProudAmerican;null;3265;3125;7;Wed May 02 22:47:57 BST 2012;136495;false;36958;en;@Dodog04 @Honey_Luxe @Shem_Infinite @hunterw @realDonaldTrump Are all 6 of your followers helping you put these sentences together? #Bot;true;false;true;JillianC. 🇺🇸⭐️⭐️⭐️;0;2020-04-28;
2448983641;2448983641;DatSadisticGirl;Tokyo Area;Jaa ne  minna~ Miss me? Find me here  @ApatheicCalm~;http://blackbullet.wikia.com/wiki/Kohina_Hiruko;40;35;6;Thu Apr 17 06:13:53 BST 2014;3;false;32744;en;"I just wanna kill you~ Did you have any problem with that?" #bot;false;false;false;Hiruko [DEACT];0;2020-04-28;
30550356;30550356;zuuliebullie;california;I’m a first gen from the land Donald hates & a pissed off GenXer! Joe Strummer trained me for this!!! I pin the truth. Follow at your own risk.;null;1990;2291;0;Sun Apr 12 00:25:53 BST 2009;53747;false;23186;en;@ahsokatano2018 @DantelloNYC @JeffreyGuterman @HillaryClinton @JoeBiden Just report it. It’s a bot & all it does is tweet that. #Bots #FakeAccounts;false;false;false;Zuul 🌊 🇺🇸There is no tRUMP, only Zuul;0;2020-04-28;
2312894072;2312894072;KashimaYuu_;null;#AutisFams | Handsome girl from class 2-G . |Prev: JOID_Chihiro. |IC/OOC []Mun!Talk Followback ? Just mention ! !;http://gekkan-shoujo-nozakikun.wikia.com/wiki/Yuu_Kashima;187;275;6;Mon Jan 27 02:56:44 GMT 2014;3;false;33279;en;i will store my feelings far  far away #BOT;false;false;false;鹿島 遊 Kashima Yū;0;2020-04-28;
35488933;35488933;kev_n_r;Sudbury  Ontario  Canada;Verify your 💩. Being disrespectful is not an opinion  it's assholery. Open your mind. #humanrights 🏳️‍🌈 #globalissues 🌎 #cdnpoli 🇨🇦  #onpoli   #puppies 🐶;http://instagram.com/kevrayner;588;1670;4;Sun Apr 26 16:37:26 BST 2009;21428;false;9730;en;I can't believe the #trolls  #bots  and #dummies believing the first headline. Expect more #BS like this for 2020...;false;false;false;Kèv 🇨🇦;0;2020-04-28;
2769983561;2769983561;BerserkAragaki;Iwatodai Dorm;Tch  I don't have time for this shit...[#P3P] [#Multiverse];http://megamitensei.wikia.com/wiki/Shinjiro_Aragaki;331;425;6;Sun Sep 14 13:35:39 BST 2014;114;false;33287;en;"It's your call." #bot;true;false;true;Shinjiro Aragaki;0;2020-04-28;
2319655728;2319655728;SheEvaSekuNatsu;null;🇨🇦 🏳️‍🌈 Autistic  transgender writer  #OpenRP #OpenDM #AnyRP #SeriousRP #FreeThinker #AntiTheist  character bio is pinned tweet  don't own pics  #RP account;null;269;793;31;Thu Jan 30 22:16:02 GMT 2014;14193;false;187239;en;Read my damn bio BEFORE talking to me #bot;false;false;false;Shelby/Evalyn/Sekushi/Natsume🏳️‍🌈;0;2020-04-28;
810276072;810276072;IbLonelyRedRose;Guertena Gallery;I want to escape from this place... please don't leave me alone... please.. #RP #IbKingdom [mention for followback];http://ibgame.wikia.com/wiki/Ib_(person);41;11;9;Sat Sep 08 06:49:51 BST 2012;1;false;96248;en;She visits Guertena's museum with her parents #bot;false;false;false;Ib the Red Rose;0;2020-04-28;
431246924;431246924;iHaruhiFujioka;America ;Currently studying abroad in America. [OHSHC RP  ran by @kodokubaka];null;550;21;10;Thu Dec 08 02:37:04 GMT 2011;3;false;77365;en;A person can change  at the moment when the person wishes to change #Haruhi #bot;false;false;false;Fujioka Haruhi 藤岡ハルヒ;0;2020-04-28;
30550356;30550356;zuuliebullie;california;I’m a first gen from the land Donald hates & a pissed off GenXer! Joe Strummer trained me for this!!! I pin the truth. Follow at your own risk.;null;1990;2291;0;Sun Apr 12 00:25:53 BST 2009;53747;false;23187;en;@Bjames68 @davidmweissman @HillaryClinton @JoeBiden There are ways to remove #bot/#fake accounts like yours... https://t.co/bYmJdv4WCz;false;false;false;Zuul 🌊 🇺🇸There is no tRUMP, only Zuul;0;2020-04-28;
1934512382;1934512382;Aono_Tsukune_;Yokai Academy;A Shinso-class Vampire  also a Ghoul. A former human. Studies at Yokai Academy. My nickname is Tsuki but I advice you not to call me that. | #RP #Multiverse;null;424;420;7;Fri Oct 04 15:56:12 BST 2013;47;false;47009;en;(cont. prev tweet)  want to be your friend Moka-san  even if you are a vampire  I like you Moka-san." #bot;false;false;false;Tsukune Aono;0;2020-04-28;
869695520;869695520;AnR_Taiga;null;Violent loli tsundere with a flat chest complex | Palmtop Tiger | VRP of @AnRworld;null;153;191;4;Tue Oct 09 12:17:20 BST 2012;9;false;39206;en;I dreamed that you were a dog. And the dog was my husband. Anyway  it was the worst dream ever. ##bot;false;false;false;Aisaka Taiga;0;2020-04-28;
1250732095141543937;1250732095141543937;BotRedditMemes;An Heroku server;aaaaaaaaaaaaaaaaaaaaaaaaaaaaaaaaaaaaaaaaaaaaaaaaaaaaaaaaaaaaaaaaaaaaaaaaaaaaaaaaaaaaaaaaaaaaaaaaaaaaaaaaaaaaaaaaaaaaaaaaaaaaaaaaaaaaaaaaaaaaaaaaaaaaaaaaaaaaaaaa;null;22;0;0;Thu Apr 16 11:26:06 BST 2020;2;false;3486;en;Warning: May lead to abstinence https://t.co/MPU1IqW7lz  #memes #meme #reddit #bot #dankmemes by @BotRedditMemes https://t.co/Fmvup7aMJV;true;false;true;Reddit Memes Bot;0;2020-04-28;
2408637672;2408637672;SadisticMedic_;Purification in Progress.;''...Advisories purified.. [The Baetter];null;21;31;5;Mon Mar 24 08:57:10 GMT 2014;9;false;20115;en;Scarlet decided to be a part of the Shane Gang for she was stated to be lonely by her slug  Zapper. (#Bot);false;false;false;Ｂａｔｔｅｒ．;0;2020-04-28;
967706647;967706647;Kotomi_OD;School Library;[Verified by @OD_RP||Famous Genius Girl||Kotomi Ichinose. Spell with 3 hiragana. Ko-to-mi. When speak to me. Call me kotomi-chan.||love playing violin;null;75;25;4;Sat Nov 24 09:34:59 GMT 2012;0;false;10564;en;The day before yesterday  i saw a rabbit. yesterday i saw a deer. and today  i saw you... #bot;false;false;false;Kotomi-chan;0;2020-04-28;
1684228230;1684228230;Yuukiiine;  Yato's Regalia ;“Why do I still have these physiological responses... Even though I'm already dead...?” ⠀⠀⠀⠀⠀⠀⠀⠀⠀⠀⠀⠀⠀⠀⠀⠀⠀⠀⠀⠀⠀⠀⠀⠀⠀⠀⠀⠀⠀⠀❄ (= ◉ ㅅ ◉=) ❄⠀⠀⠀⠀⠀⠀⠀⠀⠀⠀⠀⠀;https://www.twitter.com/geiwajima;569;255;13;Mon Aug 19 22:51:03 BST 2013;466;false;21392;en;In shinki form  he turns into a long silver katana with the handle wrapped in white bandages. #bot;false;false;false;『 Yukine 』;0;2020-04-28;
925131158;925131158;Vai_Oliver;English;[V] @Vai_RolePlay ☀ #Engloid #YoungBoy #Vocaloid3 #VocaTone #PowerFX #Cody #James #OOC ☀ Yoroshiku~;null;92;12;8;Sun Nov 04 11:02:26 GMT 2012;2;false;87417;en;Unlike Kagamine Len and Ryuto  which are also "young boy" voice types  he was voiced by a provider that actually was the same gender and intended age. #bot;false;false;false;Oliver-Chan;0;2020-04-28;
2724969743;2724969743;TheWindDragon;null;I'm Shiron  the dragon of the wind! I'll always protect those who I love.Taken by my lovely @CharizardCherie   #RP and #RL #followback;null;284;246;8;Sat Jul 26 08:25:07 BST 2014;103;false;25341;en;"My wings are 5 meter long..." #bot;true;false;true;Shiron シロン;0;2020-04-28;
826946779;826946779;AnR_Gakupo;Miku's ♡;{ official anime RP » @AnRworld }Kamui Gakupo from Vocaloid | @AnR_Miku's ma girl ♥ | #AnRVocaloid #VocaloidFamily;http://vocaloid.wikia.com/wiki/Kamui_Gakupo;448;213;5;Sun Sep 16 12:24:34 BST 2012;5;false;106275;en;Love and be loved  to the point of going mad. This sweet and hot kiss is an imitation. #bot;false;false;false;Gakupo (┒•́.•̀♈̷̴);0;2020-04-28;
3072452621;3072452621;yaboiibaymax;Helping those who need help;Hello  I am Baymax  your personal healthcare companion. | #Rp | #single;null;37;14;4;Thu Mar 05 14:09:33 GMT 2015;3;false;10561;en;On a scale of one to ten  how would you rate your pain? #Bot;true;false;true;Baymax;0;2020-04-28;
953399623;953399623;OrekiH_RP;Everywhere;((Hiatus  I'm sorry)) [V] @AniMangaRP - #Hyouka | I'm not lazy i just conserve my energy | @ChitandaEru_RP's since [21.12.2012] | Sometimes OOC | @=Follback;http://myanimelist.net/character/55131/Houtarou_Oreki;145;107;9;Sat Nov 17 11:25:59 GMT 2012;2;false;79754;en;"If I don't have to do it  I won't. If I have to do it  I'll make it quick." #bot;false;false;false;Oreki [H]outarou;0;2020-04-28;
590343061;590343061;SharonRainsW__;Pandora Rainsworth Family;シャロンレインワース| Sharon and Lulu nee-san | @Reo_Eville is mine XD |  Verified by @PandoraHeartsFP #PHFams | @=Follback;http://pandorahearts.wikia.com/wiki/Sharon_Rainsworth;177;75;7;Fri May 25 22:40:42 BST 2012;3;false;38467;en;(To Gil) "Mister Gilbert  if it is fine with you  will you have tea with me after this?" #bot;false;false;false;Sharon [Semi Hiatus];0;2020-04-28;
811307620720119808;811307620720119808;uxlookinassx;null;I'm a bot that creates phrases from the template "you" + "word" + "lookin' ass" + "word".;null;107;22;6;Tue Dec 20 20:29:44 GMT 2016;549;false;38795;en;you engine lookin' ass recipe #ass #bot;false;false;false;"You X Lookin' Ass X" bot;0;2020-04-28;
803338808;803338808;Dontedemonkillr;Leanbox  Gamindustri;Demon killer  rebel  stylish. Not a fan of demonic authorities but I guess my goddess is alright. #NeptuniaRP;http://devilmaycry.wikia.com/wiki/Dante_(DmC);119;98;9;Tue Sep 04 23:27:19 BST 2012;3;false;127402;en;They don't ask  they just drag me down into Limbo for a little chat. #Dante #Bot;true;false;true;Dante;0;2020-04-28;
1250732095141543937;1250732095141543937;BotRedditMemes;An Heroku server;aaaaaaaaaaaaaaaaaaaaaaaaaaaaaaaaaaaaaaaaaaaaaaaaaaaaaaaaaaaaaaaaaaaaaaaaaaaaaaaaaaaaaaaaaaaaaaaaaaaaaaaaaaaaaaaaaaaaaaaaaaaaaaaaaaaaaaaaaaaaaaaaaaaaaaaaaaaaaaaa;null;22;0;0;Thu Apr 16 11:26:06 BST 2020;2;false;3487;en;me_irl https://t.co/l26EaYbjlz  #memes #meme #reddit #bot #meirl by @BotRedditMemes https://t.co/miKlqoDef4;true;false;true;Reddit Memes Bot;0;2020-04-28;
927665138957561856;927665138957561856;inertiabuttocks;A golf course somewhere;The only person from Dakabin on Twitter.   Sunt plures stulti equorum In hoc mundo quam equis.;null;456;1261;0;Mon Nov 06 22:32:59 GMT 2017;25124;false;17070;en;RT @jpuopolo: Retweet and Share if you would like @Twitter to be more aggressive at removing fake accounts and enforcing it's actual Terms…;true;false;true;Cloistered Monk Farts;0;2020-04-28;
2481466878;2481466878;HoennAssassin;Hoenn;Life has a meaning. I have lived up to that meaning. I have seen many different things /#PTRP/#ACRP/I never knew I had these feelings for you @BountyInShadows;https://biol.be/HoennAssassin;1300;442;17;Wed May 07 06:46:10 BST 2014;2823;false;61989;en;"If you fail  try harder. If you dont  you have failed again" #Bot;true;false;true;Garret Helims [Vampire];0;2020-04-28;
888051779199479808;888051779199479808;Quantu_MX;Mexico City;[BETA] https://t.co/knjF6HhsVg is a #robo #advisor for day #trading #robots or #investment #portfolios using #deeplearning on #bitcoin  is free. Tips https://t.co/KHYwFDPRCL :);https://quantu.mx;328;1394;6;Thu Jul 20 16:03:38 BST 2017;155;false;37576;en;[BETA] 📈 The bot WOLFIE has earned a total of $1 745.61 USD SELL $BTC.X on 2020-04-28T22:57:32.753Z with pair $BTCUSD in 792 performed trades with 1 BTC invested since the beginning. More info at https://t.co/Pzba5SyZSh #bitcoin #ai #bot #trading;true;false;true;QuantumX;0;2020-04-28;
1245165680;1245165680;SangoMiroku_;Feudal Area;[V] @ForInuyashaRP • 16 years old|female teenage Yōkai Taijiya #Inuyashazone•Single•Sometimes #OOC :v •RP only•[INA/ENG/JPN];http://inuyasha.wikia.com/wiki/Sango;85;47;4;Wed Mar 06 03:22:32 GMT 2013;5;false;87458;en;sango fact she was youngest and a girl #bot;true;false;true;珊瑚 [HIATUS];0;2020-04-28;
1208779424;1208779424;ShelbyBroBot_;null;Bro bot for @BroFistChu :3;null;1010;1389;8;Fri Feb 22 14:44:03 GMT 2013;1;false;91013;en;IT WAS HIS HAT  MR. KRABS. HE WAS NUMBER ONE! #Bot;true;false;true;Shelby Bot :3;0;2020-04-28;
1212748814;1212748814;CronaTheLona;DWMA  Death City.;I'm Crona.. Um.. I made a T-Twitter account.. B-but I don't know if I can deal with it.. Be nice. I have black blood.. And like pasta.. *frowns* #SERP.. *gulps*;http://souleater.wikia.com/wiki/Crona;414;110;9;Sat Feb 23 16:42:45 GMT 2013;0;false;88147;en;I've never seen a man with a screw sticking out of his head before. I don't know how I'm supposed to deal with a guy like that! #Bot;true;false;true;Crona;0;2020-04-28;
1164520945;1164520945;Benny3rror;In øne øf yøur døwnløads..;THe wØrst viRUs evər wøuld be mƏ.. ||| ¤M@jør GlįŤcH¤ ||| I love Water|| #OpenRp ⭕️|| Yøu Shøuldn't Have D¤ne That~;null;451;86;13;Sun Feb 10 00:45:37 GMT 2013;62;false;76413;en;" I can float  and I float most of the time. Walking is a lot of energy  and makes too much noise. " #Bot;true;false;true;BƏn Đrøwnəđ;0;2020-04-28;
1234689114;1234689114;Anm_MakiNishi;Otonokizaka High School;[V] @FakeAnime_RP | Err.. Hello. Nishikino Maki desu. Composer and one of the member of μ’s  N-nice to meet you. *looks away* | Kirino's elder sister. [Hiatus];http://love-live.wikia.com/wiki/Nishikino_Maki;226;311;11;Sat Mar 02 13:22:36 GMT 2013;4;false;79911;en;Nishikino Maki [西木野真姫]  is one of the nine main characters in Love Live! #bot;false;false;false;Maki [LH];0;2020-04-28;
934710746;934710746;Tamakijinno_;anywhere toshiya might be;conan capture in her eyes. 27 yo. reporter. not fanbase #DConanfamily #tukangMODUS #DCF48 |@= follback;http://www.fanfiction.net/~tamakijinno;249;145;2;Thu Nov 08 15:07:56 GMT 2012;0;false;121019;en;I'm character in Conan captured in her eyes movie #bot;true;false;true;Jinno Tamaki;0;2020-04-28;
1249704535;1249704535;swordsgirl_3;xxxx;The name's Kerri! I'm a Vizard but I keep my abilities to myself. BRO: @GrimmjowUchiha #Healer#LovesWolves#Vizard#Taken ~ @VisoredCaptain;null;57;88;7;Thu Mar 07 18:01:54 GMT 2013;1;false;48301;en;I'll admit that I have a weakness for kittens and puppies. They're just way too cute!! #bot;false;false;false;DEACTIVATED;0;2020-04-28;
