id;id_str;screen_name;location;description;url;followers_count;friends_count;listedcount;created_at;favourites_count;verified;statuses_count;lang;status;default_profile;default_profile_image;has_extended_profile;name;bot
2340092438;2340092438;takumiusui_G;Under Construction;I'm Takumi || 17 Age || from Seika Highschool || Birthday April 27 || my height 186 cm ||;http://www.fanpop.com/clubs/takumi-usui-x-misaki-ayuzawa/articles/153832/title/takumis-biodata;119;32;12;Wed Feb 12 10:08:52 GMT 2014;37;false;94480;en;then I die first  and so my life took place.Unfortunately all is not that easy  hassle at all! "(Shikamaru Nara)#Bot;false;false;false;Takumi Usui;0;2020-04-29;
1232981599802810368;1232981599802810368;SpringbourneD;Springbourne  Bournemouth;Springbourne Digital creates  designs + develops online tutorial learning products. Release #1  http://DigitalFirstTypography.com  a type primer  20.03.2020;null;8;132;0;Thu Feb 27 10:52:06 GMT 2020;31;false;84;en;Once you're comfortable with #type then you might find one of these helpful? Investigate #socialmedia #bots #pm apps #information ops #deepfakes #disinformation #media manipulation. It's complicated out there! ohttps://datajournalism.com/read/handbook/verification-3/;true;false;true;Springbourne Digital;0;2020-04-29;
1224477413549191168;1224477413549191168;StripeyBot;Space;Hourly randomly-generated striped wallpapers.  Made with Raspberry Pi  HTML  CSS  jQuery  Node.js.  Check out my sibling  @GradientBot_;https://imgur.com/a/qpjZEyI;2;1;0;Mon Feb 03 23:39:13 GMT 2020;0;false;2011;en;Full size: https://t.co/H2PBlI4DGG  #stripe #stripes #wallpaper #bot #Stripey https://t.co/kDapHFvCRn;true;false;true;Stripey;0;2020-04-29;
1241698812479049728;1241698812479049728;N2groupL;null;We are a family team creating dreams come true in technology  blockchain  trading...;null;109;843;0;Sun Mar 22 12:10:54 GMT 2020;24;false;336;en;Alyze Sam: Stablecoins are the "gateway to decentralization". GIVE Nation CEO sees stablecoins as a gateway for companies like Facebook and JP Morgan to decentralized assets. #nexfolio #trader #trading #bitcoins #blockchain #arbitrage #n2group #n2security #bot #AI #network https://t.co/2pzCixTgZW;true;false;true;N2GROUP CORPORATION LIMITED;0;2020-04-29;
21461995;21461995;bells110;dc;trump is #WorstPresidentEver! #HillaryWarnedUs! #TheResistance #ProtectRoeVWade #BlueWave2020 #VoteBlueToEndThisNightmare #MAGATs will be blocked!;null;4335;5001;47;Sat Feb 21 04:01:14 GMT 2009;140982;false;161994;en;@paragwinn @joshtpm @Satiristas #BOT⬆️ IGNORE IT.;false;false;false;bells;0;2020-04-29;
796135065289945088;796135065289945088;igent_io;Rio de Janeiro  Brazil;Daily news and articles on #AI  #robotics  #IoT  #blockchain and #conversationalUI Managed by @HumbertoBAranha. Visit http://igent.io form more articles.;https://igent.io;1522;2172;53;Tue Nov 08 23:39:25 GMT 2016;77;false;24304;en;AWS Chatbot – ChatOps for Slack and Amazon Chime | Amazon Web Services #conversationalui #chatbot  https://t.co/mJaJTy3GDW https://t.co/ajz3k8WMXu;true;false;true;igent.io;0;2020-04-29;
3271554085;3271554085;RudrapatiMahesh;Hyderabad  India;Interested in space. Desire to become an artificial intelligence analyst. Building chatbots is my passion.;null;111;551;1;Wed Jul 08 05:04:11 BST 2015;1507;false;702;en;RT @ChatbotNews: Jackpot thanks to Chatbots: automatically generate leads with bots 🎰  👉 Go to https://t.co/TIJxIeC3Tf to read about 5 easy…;true;false;true;Mahesh Babu;0;2020-04-29;
888051779199479808;888051779199479808;Quantu_MX;Mexico City;[BETA] https://t.co/knjF6HhsVg is a #robo #advisor for day #trading #robots or #investment #portfolios using #deeplearning on #bitcoin  is free. Tips https://t.co/KHYwFDPRCL :);https://quantu.mx;329;1394;6;Thu Jul 20 16:03:38 BST 2017;155;false;37650;en;[BETA] 📈 The bot QUOTRON has earned a total of $2 748.22 USD SELL $BTC.X on 2020-04-29T08:46:38.284Z with pair $BTCUSD in 1211 performed trades with 1 BTC invested since the beginning. More info at https://t.co/Pzba5SyZSh #bitcoin #ai #bot #trading;true;false;true;QuantumX;0;2020-04-29;
2593935008;2593935008;JaakkoTheRipper;null;Hey Guys an girls go follow @BelowTheButler and @YoullLoveIt;null;175;190;7;Sun Jun 29 01:47:37 BST 2014;732;false;105214;en;It is better to be hated for what you are than to be loved for what you are not. #Bot;false;false;false;;0;2020-04-29;
1250732095141543937;1250732095141543937;BotRedditMemes;An Heroku server;aaaaaaaaaaaaaaaaaaaaaaaaaaaaaaaaaaaaaaaaaaaaaaaaaaaaaaaaaaaaaaaaaaaaaaaaaaaaaaaaaaaaaaaaaaaaaaaaaaaaaaaaaaaaaaaaaaaaaaaaaaaaaaaaaaaaaaaaaaaaaaaaaaaaaaaaaaaaaaaa;null;22;0;0;Thu Apr 16 11:26:06 BST 2020;2;false;3603;en;Technically the true https://t.co/6WEU7EoJRI  #memes #meme #reddit #bot #dankmemes by @BotRedditMemes https://t.co/1bKJUPuKag;true;false;true;Reddit Memes Bot;0;2020-04-29;
555355344;555355344;Arfoire;Gamindustri;I am Arfoire  the main antagonist of Hyper Dimension Neptunia. I will not stop until the Goddesses are brought down! (RP/PARODY);http://hyperdimensionneptunia.wikia.com/wiki/Arfoire;159;104;5;Mon Apr 16 18:10:15 BST 2012;0;false;37814;en;Brace yourself #Arfoire #Bot;false;false;false;マジェコンヌ;0;2020-04-29;
628131644;628131644;Saane_bot;ｐｃです。;私のbotアカウンートとbotアカウンートじゃない。私はRCLOID(Rimoconloid)の一部です。(languages) 英語(English)と日本語(japan) おＫ。;http://utau.wikia.com/wiki/Saane;86;32;7;Fri Jul 06 08:07:55 BST 2012;1;false;99613;en;I'm a Lonely Girl whos too hard for socialize.. #bot;true;false;true;サア音;0;2020-04-29;
711707318;711707318;Conaners216;null;Offical twitter of Conaners who's school in 216 | We are limited in 216jhs | Admin #Ran #Ai | Mention for follback  D | #DCFamily |;null;83;35;6;Mon Jul 23 04:14:43 BST 2012;10;false;122690;en;"Thurston Principal: 1. Magician must never reveal the trick" -Kaito Kid- #bot;false;false;false;Conaners216;0;2020-04-29;
2448983641;2448983641;DatSadisticGirl;Tokyo Area;Jaa ne  minna~ Miss me? Find me here  @ApatheicCalm~;http://blackbullet.wikia.com/wiki/Kohina_Hiruko;40;35;6;Thu Apr 17 06:13:53 BST 2014;3;false;32747;en;"Hey! Don't run away from me!" #bot;false;false;false;Hiruko [DEACT];0;2020-04-29;
431246924;431246924;iHaruhiFujioka;America ;Currently studying abroad in America. [OHSHC RP  ran by @kodokubaka];null;551;21;10;Thu Dec 08 02:37:04 GMT 2011;3;false;77377;en;Listen Senpai  I don't really care if you guys recognize me as a boy or a girl. In my opinion it's more important for a person #Haruhi #bot;false;false;false;Fujioka Haruhi 藤岡ハルヒ;0;2020-04-29;
1106199022090571778;1106199022090571778;flamescript;19 99$;Supreme SS20 iOS Script - Ready to cop - Easy to customize;https://flamescript.shop/;496;35;1;Thu Mar 14 14:22:53 GMT 2019;38;false;714;en;@dropssupreme Use our Supreme iOS script!  Easiest way to cop from you iPhone 🤓🤑  Purchase our Suprme Script ready for the drop and don’t take another L!  Purchase it at https://t.co/bCVbe9aTIA  Use code: 10OFF to get 10% off your purchase!   #supreme #bogo #script #boxlogo #tnf #hype #bot https://t.co/NbKvhvrvna;false;false;false;Flame Script;0;2020-04-29;
869695520;869695520;AnR_Taiga;null;Violent loli tsundere with a flat chest complex | Palmtop Tiger | VRP of @AnRworld;null;153;191;4;Tue Oct 09 12:17:20 BST 2012;9;false;39211;en;everything was the result of one's own choices  it was a road chosen by oneself. Even if this path is hard. ##bot;false;false;false;Aisaka Taiga;0;2020-04-29;
869996526;869996526;Yui_Goidou;null;i'm drummer  music is my life!;http://kaminomi.wikia.com/wiki/Yui_Goid%C5%8D;30;1;7;Tue Oct 09 15:37:45 BST 2012;0;false;39422;en;mars always by my side... ##bot;false;false;false;五位堂 結 | Yui Goidou;0;2020-04-29;
1066790545119502337;1066790545119502337;SogatecniaI;Spain;null;http://www.sogatecniainnova.com;477;1434;16;Sun Nov 25 20:27:40 GMT 2018;18343;false;18921;en;5 examples how to generate leads automatically with chatbots #Chatbot #chatbots via https://t.co/dk0caya0Oh https://t.co/fwMSFMzCaT;true;false;true;Sogatecnia Innova;0;2020-04-29;
1479997092;1479997092;Lucian2drei;Bucharest;Coordinator #Innovation #Grants @Zitec. |#DigitalTransformation | #Cloud | #Innovation | #Financing | #Startups | #AI | #ML | #AR  and of course geekish stuff.;https://www.linkedin.com/in/lucian-andrei-119a3130/;601;684;24;Mon Jun 03 16:49:14 BST 2013;5711;false;29957;en;10 Most Interesting Chatbots in the World #Chatbots #chatbot via https://t.co/u14WxAYdRI https://t.co/eWgFRYAx7u;false;false;false;Lucian Andrei;0;2020-04-29;
420426784;420426784;penny_for;null;null;null;33;4;0;Thu Nov 24 16:20:20 GMT 2011;1;false;27980;en;"When you become the image of your own imagination  it’s the most powerful thing you could ever do.” -RuPaul #hope #hopebot #bot;false;false;false;Hope Bot;0;2020-04-29;
1013107352017539072;1013107352017539072;Tegeria2;null;Digital Transformation Company. 📍in Europe  operating globally.;https://tegeria.com/;600;674;6;Sat Jun 30 18:09:50 BST 2018;2377;false;2307;en;RT: @HaroldSinnott Building blocks to become a more #AI intelligent #Enterprise #PwC via  @MikeQuindazzi  #RPA #IoT #BigData #Robotics #DataAnalytics #MachineLearning #Chatbots #FutureofWork #Infographics #DigitalTransformation  > https://t.co/y7UPJOvNPl;false;false;false;Tegeria;0;2020-04-29;
1121392724773691393;1121392724773691393;SanjaaySinghJee;India;#HardCore #RSS #BJP #bhakat #mahakaal #supporter  @narendramodi @myogiadityanath RT Not Endorsement   विनम्र निवेदन चमचे कृपया दूर रहे 🙏🏻;http://sanjaysinghit.wopress.com;1246;2090;0;Thu Apr 25 13:37:14 BST 2019;8840;false;3965;en;RT @HaroldSinnott: Building blocks to become a more #AI intelligent #Enterprise #PwC via @MikeQuindazzi #RPA #IoT #BigData #Robotics #DataA…;true;false;true;Sanjay Singh;0;2020-04-29;
1250732095141543937;1250732095141543937;BotRedditMemes;An Heroku server;aaaaaaaaaaaaaaaaaaaaaaaaaaaaaaaaaaaaaaaaaaaaaaaaaaaaaaaaaaaaaaaaaaaaaaaaaaaaaaaaaaaaaaaaaaaaaaaaaaaaaaaaaaaaaaaaaaaaaaaaaaaaaaaaaaaaaaaaaaaaaaaaaaaaaaaaaaaaaaaa;null;22;0;0;Thu Apr 16 11:26:06 BST 2020;2;false;3604;en;I take your entire stock https://t.co/AhzP8Pb4eW  #memes #meme #reddit #bot #dankmemes by @BotRedditMemes https://t.co/8bveet97Nc;true;false;true;Reddit Memes Bot;0;2020-04-29;
2922251470;2922251470;BloodStainedBR;With Oz;I'm scared that I'm not human. I'm scared I'm different from other chains. I fear the things I don't know. I fear things I already knew and at every moment.;http://tl.gd/n_1sj6rqm;350;153;8;Mon Dec 15 00:30:21 GMT 2014;29;false;29681;en;"Even I can tell...that being alone makes you cold. You must be sad that the brat's feeling alone  then?" To Oz #Bot;true;false;true;Alice アリス;0;2020-04-29;
2935571425;2935571425;Little_Athlete_;null;Kon'nichiwa;null;61;50;3;Fri Dec 19 01:33:23 GMT 2014;0;false;16021;en;My mood.....is based off of the people that are around me  #Bot;true;false;true;Chisana;0;2020-04-29;
2909597051;2909597051;hodg3p0dge;null;Hi! I'm Pastiche! Trying to get more in touch with the overseas fandom by speaking English! It is not that good. Have a nice day! (/∇＼*)｡o○♡;null;926;66;4;Sun Dec 07 17:57:08 GMT 2014;89;false;12002;en;Suggestions are always welcome! #BOT;false;false;false;ღ~Pastiche (画像BOT?!);0;2020-04-29;
2616864882;2616864882;CrayForHope;★нope★;~noтнιng вυт pυre тraѕн~ wнy aм ι even ѕтιll нere? |вι| |ѕιngle|;http://youtu.be/BefQeC6UUyo;94;51;5;Fri Jul 11 08:27:56 BST 2014;52;false;30050;en;"As long as there exist seeds of hope  I'll gladly kill a person and gladly die myself" #Bot;false;false;false;(мaιd) ĸøмaeda ホープ;0;2020-04-29;
925131158;925131158;Vai_Oliver;English;[V] @Vai_RolePlay ☀ #Engloid #YoungBoy #Vocaloid3 #VocaTone #PowerFX #Cody #James #OOC ☀ Yoroshiku~;null;92;12;8;Sun Nov 04 11:02:26 GMT 2012;2;false;87427;en;Oliver always wear an White shirt with Black Shorts.He also has an White Captan Hat and an Blue captan coat. #bot;false;false;false;Oliver-Chan;0;2020-04-29;
863912432;863912432;SayaneeNMB48;Namba  Osaka;Captain of NMB48 Team N  Sayanee koto Yamamoto Sayaka desu  yoroshiku! ||山本彩a.k.aさや姉 || [N]MB48 || I'm not the Real Sayanee  but feel free to chat^^ #48FamilyRP;http://stage48.net/wiki/index.php/Yamamoto_Sayaka;267;118;12;Sat Oct 06 01:55:58 BST 2012;61;false;82073;en;Hello~ Sayanee's #bot is here~ :3;false;false;false;Sayaneeさや姉;0;2020-04-29;
2724969743;2724969743;TheWindDragon;null;I'm Shiron  the dragon of the wind! I'll always protect those who I love.Taken by my lovely @CharizardCherie   #RP and #RL #followback;null;284;246;8;Sat Jul 26 08:25:07 BST 2014;103;false;25347;en;"I like taking baths in hot water ^~^" #bot;true;false;true;Shiron シロン;0;2020-04-29;
1015313198;1015313198;KittiaKuroKuro;Kukuroo Mountain;No rain No rainbow.. ^^  | live for peace | love my otouto Killua Z ♥ and my Z family (ゾルディック家);null;36;97;5;Sun Dec 16 14:23:23 GMT 2012;0;false;79490;en;test ##Bot;true;false;true;kurogane kittia;0;2020-04-29;
811307620720119808;811307620720119808;uxlookinassx;null;I'm a bot that creates phrases from the template "you" + "word" + "lookin' ass" + "word".;null;107;22;6;Tue Dec 20 20:29:44 GMT 2016;549;false;38815;en;you role lookin' ass skill #ass #bot;false;false;false;"You X Lookin' Ass X" bot;0;2020-04-29;
16003671;16003671;PredictableData;Austin  Tx;We autocorrect and autocomplete inconsistent and missing information for entire databases.;http://www.predictabledata.com;1136;87;429;Tue Aug 26 23:13:52 BST 2008;14;false;26759;en;Pragmatic Data Science for Marketers:  https://t.co/HYfJcQ9DwK #PredictableData Thanks to @emilieschario #bigdata #chatbots;false;false;false;Dwayne Smurdon;0;2020-04-29;
803338808;803338808;Dontedemonkillr;Leanbox  Gamindustri;Demon killer  rebel  stylish. Not a fan of demonic authorities but I guess my goddess is alright. #NeptuniaRP;http://devilmaycry.wikia.com/wiki/Dante_(DmC);119;98;9;Tue Sep 04 23:27:19 BST 2012;3;false;127419;en;Come on  Round 2. #Dante #Bot;true;false;true;Dante;0;2020-04-29;
2826933096;2826933096;KworkMe;Finland;Finnish startup developing the future of the Internet.;http://www.kwork.fi;1307;10;53;Mon Sep 22 22:10:13 BST 2014;952;false;566;en;And The Winner Is…Champion Hackathon Chatbots:  The event was designed for hackers of all levels to come together  network  team up  and create a unique and powerful chatbot. https://t.co/RgyvZTQETB #hackathon #innovation #bots https://t.co/49wHKBMKmQ;true;false;true;Kwork Innovations;0;2020-04-29;
1167990955;1167990955;Tiro_Finale_;Mitikihara City;Ah  good evening. Would you like some tea? Even better  how about having a spare! (#Multiverse);null;66;26;8;Mon Feb 11 05:57:53 GMT 2013;0;false;58564;en;I'm sorry. It must've hurt being all alone. I'm a failure as your senpai. I should've come rushing to find you right away.. #mami #bot;true;false;true;Mami Tomoe;0;2020-04-29;
3224007001;3224007001;midomidoriin;null;null;null;66;169;4;Sat May 23 07:26:21 BST 2015;17;false;31105;en;"When you hurts me i am not the same anymore"  #bot;true;false;true;deact;0;2020-04-29;
935179116;935179116;Jasadine;England;null;null;2576;2895;1;Thu Nov 08 18:55:12 GMT 2012;48919;false;38673;en;@as_it_is2019 @Max10110199 @carolecadwalla @bbcnickrobinson @afneil @CCHQPress @BorisJohnson @DominicRaab @MattHancock @RishiSunak @michaelgove @10DowningStreet @JamesCleverly @bbclaurak @BBCr4today @bbc5live @nytimes @washingtonpost @MSNBC @NBCNews @ABC @CBSNews 🤔😂 Spike is a DICK #Bot lol do one;true;false;true;TT 💯🌹🌹🌹#IDidNotVoteTory;0;2020-04-29;
1250732095141543937;1250732095141543937;BotRedditMemes;An Heroku server;aaaaaaaaaaaaaaaaaaaaaaaaaaaaaaaaaaaaaaaaaaaaaaaaaaaaaaaaaaaaaaaaaaaaaaaaaaaaaaaaaaaaaaaaaaaaaaaaaaaaaaaaaaaaaaaaaaaaaaaaaaaaaaaaaaaaaaaaaaaaaaaaaaaaaaaaaaaaaaaa;null;22;0;0;Thu Apr 16 11:26:06 BST 2020;2;false;3605;en;90% of my personality https://t.co/Wgghhq2spV  #memes #meme #reddit #bot by @BotRedditMemes https://t.co/9R29rJ1roc;true;false;true;Reddit Memes Bot;0;2020-04-29;
1208779424;1208779424;ShelbyBroBot_;null;Bro bot for @BroFistChu :3;null;1011;1389;8;Fri Feb 22 14:44:03 GMT 2013;1;false;91031;en;Mr. Chair  protect me!! #Bot;true;false;true;Shelby Bot :3;0;2020-04-29;
953837178;953837178;ModelJungSo_MF;  [@MinFamily_Ent♥] ;Why So Serious? @MrKimSJ  He's My Love09♥ [Nana Hyorin Shin Vanesa -Kesayangan] 89L Mom says `I'm beautiful` #KeluargaMINAJ #KFC #24AFC1 #FΔVOR;null;1277;1606;6;Sat Nov 17 16:00:39 GMT 2012;426;false;103712;en;Vote JUNG SO MIN in :: https://t.co/j823tOLWrW :: Thanks ~(˘▾˘~)~(˘▾˘)~(~˘▾˘)~ #BOT;false;false;false;Oh-Hani;0;2020-04-29;
2710162663;2710162663;JeffLeDerp;You Don't Wanna Know...;Go To Sleep || The only way you can Truly smile is if I cut you one  Ear To Ear... || #OpenRP #Smile || More Alive At Night ||;null;1073;226;9;Tue Aug 05 20:34:16 BST 2014;110;false;13887;en;" Go To Sleep! " #Bot;true;false;true;Jeff The Killer;0;2020-04-29;
1164520945;1164520945;Benny3rror;In øne øf yøur døwnløads..;THe wØrst viRUs evər wøuld be mƏ.. ||| ¤M@jør GlįŤcH¤ ||| I love Water|| #OpenRp ⭕️|| Yøu Shøuldn't Have D¤ne That~;null;451;86;13;Sun Feb 10 00:45:37 GMT 2013;62;false;76430;en;" I'm the worst virus you can ever get... " #Bot;true;false;true;BƏn Đrøwnəđ;0;2020-04-29;
1249704535;1249704535;swordsgirl_3;xxxx;The name's Kerri! I'm a Vizard but I keep my abilities to myself. BRO: @GrimmjowUchiha #Healer#LovesWolves#Vizard#Taken ~ @VisoredCaptain;null;57;88;7;Thu Mar 07 18:01:54 GMT 2013;1;false;48308;en;If anyone is in need of medical help  I will do all that I can  even if the person is a stranger. Everyone deserves good health. #bot;false;false;false;DEACTIVATED;0;2020-04-29;
3463725134;3463725134;mango_iscold;not-trash land;sayaka is trash.;null;27;23;6;Sat Sep 05 23:04:56 BST 2015;1;false;36669;en;everybody wake tf up #bot;true;false;true;Mango;0;2020-04-29;
1309262078;1309262078;SharinganVille;Ⓣⓦⓘⓣⓣⓔⓡ;Hey you guys show some love to @BelowTheButler and @YoullLoveIt  );http://www.youtube.com/watch?v=7pzGKW4ZQ2Y;426;270;8;Thu Mar 28 03:07:19 GMT 2013;1010;false;130461;en;The fear of death follows from the fear of life. A man who lives fully is prepared to die at any time. #Bot;false;false;false;Ⓥⓘⓛⓛⓔ;0;2020-04-29;
483812293;483812293;LenKagaminebot;Where we belong ;こんにちは！私は鏡音レンだ！私はあなたをバックに従いましょう私に従ってください。English and Japanese Updates. Master: @xx__Rei;null;90;41;6;Sun Feb 05 12:22:36 GMT 2012;5;false;122465;en;i only follow back who is anime related vocaloids utau bot japanese people and RP #BOT;false;false;false;鏡音レンーショタコン;0;2020-04-29;
350458754;350458754;xenvita_;Hellsalem's Lot (NEW YORK);☆SHE/HER☆中文OK☆[💕OC's  KH & YGO5DXAL💕]☆Please credit when repost works☆Looking for work  contact: xenvita@gmail.com☆CuriousCat: http://curiouscat.me/xenvita☆;https://www.artstation.com/xenvita;5233;510;116;Sun Aug 07 21:19:07 BST 2011;221732;false;305422;en;[#BOT] ☆SUPPORT ME BY BUYING ME A KO-FI! YOU CAN REQUEST A DOODLE FOR JUST $3!★ : https://t.co/7XY8IjqbTD;false;false;false;🔺XΞN🔺;0;2020-04-29;
2834110110;2834110110;MercifulStotch;South Park  Colorado.;Leopold ''Butters'' Stotch  only son of Linda and Stephen Stotch. [pfp credit - N/A sorry][♡: @QMarksAndUndies];http://ask.fm/MercifulPaladin;351;56;8;Sat Sep 27 16:10:26 BST 2014;45;false;49144;en;"This paladin is ready to kick some ass!" #Bot;false;false;false;Stotch.;0;2020-04-29;
737142202481016832;737142202481016832;chidambara09;Mysore  and  BERLIN;Be happy  Be healthy Be smile Be cool Be good human;null;6597;14;4490;Mon May 30 05:42:51 BST 2016;58;false;988468;en;RT @boslerfabian: Learn how to scrape images from Google #Datascience #BigData #DataAnalytics #Pandas #Python #Automation #WebScraping #Bot…;true;false;true;Chidambara .ML.;0;2020-04-29;
1254115932021993472;1254115932021993472;IndiaCovid19Bot;null;A bot HOURLY posting India's Covid 19 numbers. Runs from 9am to 11 30pm IST.  Made by  @SamitShirsat;null;29;2;0;Sat Apr 25 19:32:00 BST 2020;6;false;50;en;COVID 19 cases in India until : 29/04/2020 14:30  Total Cases: 31587 [+227]😅 Active: 22772🖖🏽 Recovered: 7805 [+58]❤ Deaths :1010 [+2]🙏🏼 Total Tests: 770K🧪  Data- @covid19indiaorg #CoronaVirus #COVID19inIndia #India #Bot;true;false;true;Covid 19 Bot 🤖 🇮🇳;0;2020-04-29;
897767754;897767754;Rock2345611;Wherever the road takes me;@RockLordzz Bot... HOW THE FUCK DID YOU FIND ME?!;null;25;24;8;Mon Oct 22 16:04:01 BST 2012;38;false;34969;en;Did you know my last name is Evans? #Bot;true;false;true;Mike マイク;0;2020-04-29;
1399556978;1399556978;Anm_Elfman;null;[V] by @FakeAnime_RP | #FairyTail | Mirajane & Lisana Brother |;http://Fairytail.wikia.com/wiki/Elfman_Strauss;49;74;5;Fri May 03 12:48:39 BST 2013;1;false;31819;en;Some time ago  Elfman was notably shy and weak  with his only real talent being for cooking.#bot;true;false;true;エルフマン・ストラウス;0;2020-04-29;
3297617749;3297617749;deepakagg89;Noida;Program Manager at Times Of India  Noida;null;20;32;0;Mon Jul 27 13:22:00 BST 2015;1;false;12;en;RT @alakananda25: Streamline interactions between people & #services & enhance #CustomerExperience. Join #OnlineMasterclass on Marketing vi…;true;false;true;Deepak Aggarwal;0;2020-04-29;
985425300292022273;985425300292022273;fullNam35087976;Chiyoda-ku  Tokyo;I enjoy programming as a hobby😀This account is a Bot that just do retweets  followback  and like😀It's not a company😀It does't respond to DM or replies😀;https://www.youtube.com/channel/UCF4pe5HDmNbSq7lHgScinow;2052;2058;51;Sun Apr 15 08:51:14 BST 2018;119543;false;123580;en;RT @boslerfabian: Learn how to scrape images from Google #Datascience #BigData #DataAnalytics #Pandas #Python #Automation #WebScraping #Bot…;false;false;false;akasatanahama.com;0;2020-04-29;
1370744011;1370744011;KratosGodOfWar_;With my love @Heavenly_Sword1;Former general of Sparta. Once enslaved to Ares  but I broke free and killed my former master. I am the God of War. None shall defy me. [GOW2/MVerse RP];http://en.m.wikipedia.org/wiki/Kratos_(God_of_War);202;69;5;Sun Apr 21 23:45:26 BST 2013;173;false;17421;en;Hope is for the weak. #Bot;true;false;true;Kratos;0;2020-04-29;
1189187268;1189187268;Legion_Kbot;창조주와 함께라면..;Mass Effect 2~3 비공식 반자동봇   Mass Effect 2 기반   My name is Legion  for we are many.   관심글을 참조해주세요.;null;263;388;11;Sun Feb 17 11:27:19 GMT 2013;8;false;22816;en;"Evenings.Organisms to spoil the evening." #BOT;false;false;false;Legion;0;2020-04-29;
1338734094;1338734094;Karalia_Ofc;Jakarta Capital Region;K.A.R.A!!  KARAlia imnida \(^-^*)/ || Part of BG Ent Jakarta || Andini - Fitri - Sofia - Indah || ♥ 120513 ♥ || more? fav!!;http://youtube.com/karaliaDC;708;470;4;Tue Apr 09 10:34:17 BST 2013;101;false;14495;en;[video] please watch our 3rd perform at YJS event ^-^ thanks~ #BOT https://t.co/X4yvULXES2;false;false;false;★ KARAlia ★;0;2020-04-29;
1207978249;1207978249;Wheatley_bkr;우주 (in the space);포탈2 비공식 동인봇 휘틀리입니다 | 정신없는 트윗 좋아해요! | 지적이나 할말은 조용히! (DM) | 반자동이에요! | 맞팔은 멘션주세요! | 사정상 멘션스루가 있을수도 있어요!;null;72;12;4;Fri Feb 22 11:23:36 GMT 2013;2;false;62804;en;Oh wait! I've got it I've got it I've got it! No  I haven't got it. #Bot;true;false;true;휘틀리 (Wheatley);0;2020-04-29;
1142414488395821056;1142414488395821056;PythonJokeBot;In someones Raspberry Pi;Automated picking and generating jokes based on user feedback with the help of machine learning and python programming language;null;80;1;0;Sat Jun 22 13:50:13 BST 2019;0;false;3228;en;Everclear songs are really easy to play on guitar it's because their dad's weren't around to give them music lessons.  #joke #jokes #fun #funny #humour #bot #machine_learning #python #AI https://t.co/tyDen0c17X;false;false;false;Python Joke Bot;0;2020-04-29;
1249369765933723653;1249369765933723653;Greypool3;null;Market Research & Data Modeling Applied to Cryptocurrency Markets - Automated Trading Strategy Development - Signal Aggregation;https://www.tradingview.com/script/YcqOubiy-VSA-Trading-Assistant-Dashboard/;474;0;0;Sun Apr 12 17:12:34 BST 2020;0;false;121;en;GreyPool AutoTrader Shorting XTZUSDT at 2.7817  #VSA #XTZUSDT #XTZUSD #XTZ #CryptoTraders #TradingView #Tradingbot #Bot #Fintech #CryptoTwitter #CryptoSignals #CryptoBot  Trading Telegram Group - We Educate & Share Signals: https://t.co/xwkOLbb1xZ https://t.co/70zH6txkQE;true;false;true;Greypool;0;2020-04-29;
1250732095141543937;1250732095141543937;BotRedditMemes;An Heroku server;aaaaaaaaaaaaaaaaaaaaaaaaaaaaaaaaaaaaaaaaaaaaaaaaaaaaaaaaaaaaaaaaaaaaaaaaaaaaaaaaaaaaaaaaaaaaaaaaaaaaaaaaaaaaaaaaaaaaaaaaaaaaaaaaaaaaaaaaaaaaaaaaaaaaaaaaaaaaaaaa;null;22;0;0;Thu Apr 16 11:26:06 BST 2020;2;false;3606;en;Not even news https://t.co/sTACPbQ14F  #memes #meme #reddit #bot #dankmemes by @BotRedditMemes https://t.co/Lzqq49Brc3;true;false;true;Reddit Memes Bot;0;2020-04-29;
1529421734;1529421734;Aninuneo;West Java  Indonesia;Don\'t stop  can\'t stop until we reach the top !!;null;7;7;5;Wed Jun 19 03:06:12 BST 2013;2;false;23891;en;You are the only person that can make my heart beat faster and slower at the same time.~ #Bot;false;false;false;KIMI NO KOE!!;0;2020-04-29;
