id;id_str;screen_name;location;description;url;followers_count;friends_count;listedcount;created_at;favourites_count;verified;statuses_count;lang;status;default_profile;default_profile_image;has_extended_profile;name;bot
2321475187;2321475187;CaduceusSurgeon;Caduceus USA;[Trauma Center/Multiverse/Crossover RP] Surgeon at Caduceus USA. // Occasional Candy Crush player. // Assisted by @CaduceusNurse.;http://twitlonger.com/show/n_1s0ai1e;105;105;7;Fri Jan 31 23:11:12 GMT 2014;37;false;15858;en;"I /will/ save this patient!" #Bot;false;false;false;Dr. Derek Stiles;0;2020-04-29;
868084744763965443;868084744763965443;iotworlds;Earth;Discover the IoT devices  technologies and solutions. Create your smart world. Boost your business. ENGINEERING – MANAGEMENT – DIGITAL MARKETING #IoT #IoTWorlds;http://www.iotworlds.com;4165;3610;76;Fri May 26 13:41:46 BST 2017;13201;false;33583;en;RT @digitfyi: Top five trends influencing the future of #cybersecurity in 2020 - #Cloud and #IoT  DevSpecOps  As a service  consolidation a…;true;false;true;IoT Worlds;0;2020-04-29;
3338026276;3338026276;Wimbleknob;In a van down by the river;I'm a pharma tech. The other thing is a side job.  Don't be lookin at my profile if you don't wanna see ludicrously explicit porn.;null;10;53;0;Sun Jun 21 01:29:06 BST 2015;42730;false;7132;en;RT @Psyk323: Commission work for @ItsmeMTFO4  of a fembastion from overwatch  based on the design from my good friend @R_MK_The_Floof  [htt…;false;false;false;🔞 Licensed Drug Salesman 🔞;0;2020-04-29;
710123736175783938;710123736175783938;sectest9;Hyderabad  India;News Hub! Get the latest Security News & Updates!;null;30715;1;7059;Wed Mar 16 15:21:07 GMT 2016;7;false;1784213;en;RT @digitfyi: Top five trends influencing the future of #cybersecurity in 2020 - #Cloud and #IoT  DevSpecOps  As a service  consolidation a…;true;false;true;Security Testing;0;2020-04-29;
1142424032794406912;1142424032794406912;CyberSecurityN8;null;The place for InfoSec  CyberSecurity  DevSecOps  DataSecurity and many more!!! Stay tuned.;null;3916;1;76;Sat Jun 22 14:28:09 BST 2019;0;false;207827;en;RT @digitfyi: Top five trends influencing the future of #cybersecurity in 2020 - #Cloud and #IoT  DevSpecOps  As a service  consolidation a…;true;false;true;Cyber Security News;0;2020-04-29;
1091057839;1091057839;PetotDowny;San fransisco;Hello all   this twitter account is new news from jessica snsd   this account of the real jessica ^;http://welovesnsdfam.wordpress.com;33;23;5;Tue Jan 15 04:45:32 GMT 2013;2;false;39935;en;mention#Bot;true;false;true;Ice Princess;0;2020-04-29;
2286974198;2286974198;MatsuokaGouRP;Iwatobi High School;''Don't call me Gou !'' I am a girl with a boyish name. // Iwatobi swimming club Manager. // Yoroshiku ! { RP Anytime ne *smiles* };http://free-anime.wikia.com/wiki/Gou_Matsuoka;31;44;3;Sat Jan 11 17:47:20 GMT 2014;13;false;9840;en;"No! Don't look! Girls my age shouldn't ogle naked men! Must... not... look... *slowly peeks* W-what... incredible triceps!" #bot;true;false;true;Matsuoka Gou 松岡 江;0;2020-04-29;
268009026;268009026;Bleach4eternity;Soul Society  Gotei 13;Kuchiki here! ||* 13th division Captain*|| RP-- Associated to @Urahara_taichou || My sun among the blue sky @mIchigoKurosaki ❤ #BOT Account #PS4Gamer;null;490;814;0;Fri Mar 18 00:09:23 GMT 2011;810;false;13642;en;We stand in awe before that which can not be seen... And we respect  with every fiber  that which can not be explained. #Bot;false;false;false;朽木ルキア❤;0;2020-04-29;
3338026276;3338026276;Wimbleknob;In a van down by the river;I'm a pharma tech. The other thing is a side job.  Don't be lookin at my profile if you don't wanna see ludicrously explicit porn.;null;10;53;0;Sun Jun 21 01:29:06 BST 2015;42732;false;7134;en;RT @Psyk323: Farm work can be hard. Her core needs some cooling💦♨️  Thank you everyone who pushed me to remake the picture!🙏 #ガンダム #gynoid…;false;false;false;🔞 Licensed Drug Salesman 🔞;0;2020-04-29;
897305994514100224;897305994514100224;iamAtBot;The Interwebs;The premier bot-as-a-service solution for the Microsoft cloud. AtBot puts AI within reach. From the minds of @H3SInc. In action: https://youtu.be/afJ0XOYBcrw;https://atbot.io;482;192;24;Tue Aug 15 04:56:35 BST 2017;305;false;5916;en;You asked for it! Chat logs are the best metrics available to determin success (and future success) of your #chatbot. Now available in the #AtBot Admin Portal. Check it out. https://t.co/cgkJMslaj9;false;false;false;AtBot;0;2020-04-29;
3338026276;3338026276;Wimbleknob;In a van down by the river;I'm a pharma tech. The other thing is a side job.  Don't be lookin at my profile if you don't wanna see ludicrously explicit porn.;null;10;53;0;Sun Jun 21 01:29:06 BST 2015;42733;false;7135;en;RT @Psyk323: A character sheet commission for the one and only @KimplEClonE ! Thank you so much for commissioning me :)  #ガンダム #gynoid #and…;false;false;false;🔞 Licensed Drug Salesman 🔞;0;2020-04-29;
2373113678;2373113678;SoDarnSparkly;On the throne  now bow down!;Screw the rules  I am now the Queen of England! // #RP #Yaoi #WhatAmIDoing// My Senpai @JamieDarkAngel;http://www.wattpad.com/HiddenStripes;265;46;6;Wed Mar 05 03:48:53 GMT 2014;94;false;33298;en;Hi~ I'm Alois Trancy~ I'm a slutty  obnoxious  attention whore that wears BOOTY SHORTS!!! #bot;false;false;false;Queen Bitch #2;0;2020-04-29;
3338026276;3338026276;Wimbleknob;In a van down by the river;I'm a pharma tech. The other thing is a side job.  Don't be lookin at my profile if you don't wanna see ludicrously explicit porn.;null;10;53;0;Sun Jun 21 01:29:06 BST 2015;42734;false;7136;en;RT @Psyk323: 🥜zone  #ガンダム #gynoid #android #robotgirl #robot #bot #scifi #future #ガイノイド #mech #mecha #robogirl #art #zaku #gundam #nsfw #cu…;false;false;false;🔞 Licensed Drug Salesman 🔞;0;2020-04-29;
1067744730698706945;1067744730698706945;EjneJakob;null;Test #cryptohopper 7 day´s for free !  http://bit.ly/35yL5mW  Automate your trading and take your emotion out of the equation!;null;116;615;0;Wed Nov 28 11:39:16 GMT 2018;80;false;2906;en;Again 1.59% #profit with #ARPA on #binance!  Thank you #cryptohopper  Try cryptohopper for free: https://t.co/V7aPqyRqj9  #altcointrading #cryptotraders #bitcoin #binance #altcoin #bot #traiding #BTC $ARPA #Kryptowährung #blockchain #bot #altcoin #Altcoins;true;false;true;Jakob E.;0;2020-04-29;
3338026276;3338026276;Wimbleknob;In a van down by the river;I'm a pharma tech. The other thing is a side job.  Don't be lookin at my profile if you don't wanna see ludicrously explicit porn.;null;10;53;0;Sun Jun 21 01:29:06 BST 2015;42735;false;7137;en;RT @Psyk323: Zaku inspired bot! Surely some military space robots are used for comfort duty  right?  [Higher rez later on patreon]  #ガンダム #…;false;false;false;🔞 Licensed Drug Salesman 🔞;0;2020-04-29;
2465314423;2465314423;outlast_Father;マウントマッシブ精神病院;outlastに登場する神父「マーティン・アルシャンボー」のbotです。【非公式なりきり入り】【別名あだ名：ふぁーざーまーしん】;null;15;2;5;Sun Apr 27 01:42:05 BST 2014;1;false;23137;en;And who are you  then? #bot;true;false;true;マーティン・アルシャンボー;0;2020-04-29;
1250732095141543937;1250732095141543937;BotRedditMemes;An Heroku server;aaaaaaaaaaaaaaaaaaaaaaaaaaaaaaaaaaaaaaaaaaaaaaaaaaaaaaaaaaaaaaaaaaaaaaaaaaaaaaaaaaaaaaaaaaaaaaaaaaaaaaaaaaaaaaaaaaaaaaaaaaaaaaaaaaaaaaaaaaaaaaaaaaaaaaaaaaaaaaaa;null;22;0;0;Thu Apr 16 11:26:06 BST 2020;2;false;3621;en;The dankest type of people https://t.co/zIrN0VSu40  #memes #meme #reddit #bot #dankmemes by @BotRedditMemes https://t.co/rNyhIp0vIC;true;false;true;Reddit Memes Bot;0;2020-04-29;
1429685256;1429685256;AlvarezMachias;Alvarez Empire;If you don't shut up  I'm gonna hit you with my cannon! Ah-hya-hya-hya! || FTRP/Parody || #FTPH #TheSpriggan12 || Writer: @YaBoiSpriggan;null;251;250;0;Wed May 15 07:33:32 BST 2013;103;false;6943;en;Despite phyiscally one of the youngest characters in the series in terms of actual existence he is in fact one of the oldest  with the only ones that beat him in this are Jack and Glen. #bot;false;false;false;Wahl Icht;0;2020-04-29;
2443708464;2443708464;RPAnimeWorld__;null;Rules -＞[ http://tl.gd/n_1s1i0rd ] | Agency RP for Anime/Manga/Vocaloid etc^^ Need Member! | Owner : #Chii Admin : #Sayu #Miuna | Come and Join us!^0^;null;23;8;5;Mon Apr 14 11:54:16 BST 2014;20;false;12271;en;Wanna join? Just mention and don't forget to check rules!^^ #bot;true;false;true;Need Member!;0;2020-04-29;
2259571861;2259571861;DarkRevenger__;Leaf Village;This village holds all my memories. . . Maily the painful ones. I am here to make better ones with Sakura and Sarada. ||DetailedRP||;null;266;332;6;Tue Dec 24 00:18:35 GMT 2013;255;false;14828;en;"Im the girl who is sweeping you off your feet." #Bot;true;false;true;Sasuke Uchiha;0;2020-04-29;
2286104688;2286104688;YukinaChan_;Prev: callmesakai;姫柊 雪菜. I was a witch attack known as Sword Shaman|#TTGF #G5 #sυƍοίƒαмs #parody;http://strike-the-blood.wikia.com/wiki/Yukina_Himeragi;116;78;7;Sat Jan 11 04:54:35 GMT 2014;23;false;18678;en;Mention for followback #Bot;false;false;false;Yukina Himeragi;0;2020-04-29;
1251178122977751041;1251178122977751041;quotes3k;null;@ me to get a Quote. by @vishnumohan_rk API used: Forismatic;null;0;1;0;Fri Apr 17 16:58:22 BST 2020;9;false;367;en;The two most powerful warriors are patience and time.   --Leo Tolstoy  #quotes #bot -4;true;false;true;quotes3k;0;2020-04-29;
3338026276;3338026276;Wimbleknob;In a van down by the river;I'm a pharma tech. The other thing is a side job.  Don't be lookin at my profile if you don't wanna see ludicrously explicit porn.;null;10;53;0;Sun Jun 21 01:29:06 BST 2015;42738;false;7139;en;RT @Psyk323: C'mon guys stop teasing her  give her the 🍶  #gynoid #android #robotgirl #robot #bot #scifi #future #ガイノイド #mech #mecha #robog…;false;false;false;🔞 Licensed Drug Salesman 🔞;0;2020-04-29;
1074358907290742784;1074358907290742784;Anonimus_IT;Abu;Trader;null;6636;7241;3;Sun Dec 16 17:41:38 GMT 2018;427;false;559;en;RT @olportal: How can OLPORTAL's AI-powered neurobots help in customer service? This article explores more - https://t.co/wkKHG5e1pZ #Artif…;true;false;true;Anonimus;0;2020-04-29;
2537626332;2537626332;Botzcollectors;null;null;null;28;6;4;Sat May 31 15:56:19 BST 2014;0;false;8363;en;Mention4Follow #BOT;true;false;true;@mechasan;0;2020-04-29;
2340092438;2340092438;takumiusui_G;Under Construction;I'm Takumi || 17 Age || from Seika Highschool || Birthday April 27 || my height 186 cm ||;http://www.fanpop.com/clubs/takumi-usui-x-misaki-ayuzawa/articles/153832/title/takumis-biodata;119;32;12;Wed Feb 12 10:08:52 GMT 2014;37;false;94483;en;"When you know love  you also run the risk of hate" (Itachi Uchiha)#Bot;false;false;false;Takumi Usui;0;2020-04-29;
1080514685760430080;1080514685760430080;eXceedersTeam;Dublin City  Ireland;Exceeders connects businesses with 100s of innovative IT providers for cost-effective #DigitalTransformation and #RemoteWork Solutions. @Stemexe @idenedi;http://www.exceeders.com;5032;4436;34;Wed Jan 02 17:22:30 GMT 2019;2187;false;1375;en;StemeXe #StemeXeForEducation #Chatbot #Chat Through StemeXe for Education  students can get their questions answered immediately via chatbot  or via direct chat access to teaching staff. #StemeXe #DistanceLearning #COVID19 #StayAtHome https://t.co/qIzN5sC3rB;false;false;false;Exceeders | The Premium IT Solutions Marketplace;0;2020-04-29;
3494409328;3494409328;cornichecorp;Cyberspace ;#DigitalTransformation #Data #Analytics #InternetOfThings #ISMS #IoT #cybersecurity #Infosec #ArtificialIntelligence #machinelearning #Cloud 📊;http://www.cornichecorp.com;1008;1269;23;Sun Aug 30 21:01:12 BST 2015;5104;false;27227;en;5 examples how to generate leads automatically with chatbots #Chatbot #chatbots via https://t.co/KDUhFaFE1M https://t.co/hLhEgFUEvL;false;false;false;Cornichecorp Digital Solutions;0;2020-04-29;
1111406021224861696;1111406021224861696;GradientBot_;Space;Hourly randomly-generated gradient wallpapers.  Made with Raspberry Pi  HTML  CSS  jQuery  Node.js  Check out my sibling  @StripeyBot;https://imgur.com/a/TzcMhP6;3;1;0;Thu Mar 28 23:13:39 GMT 2019;2;false;2054;en;Full size: https://t.co/PIPlRnVCBB  #gradient #gradients #wallpaper #bot #GradientBot https://t.co/S6dVTSyb8s;true;false;true;GradientBot;0;2020-04-29;
2642702533;2642702533;ActualKermitBot;null;Kermit the frog here and I'm here to teach you about math [#Bot];null;18;4;3;Mon Jul 14 04:34:48 BST 2014;0;false;12437;en;Kermit the frog here and I'd like to teach you about math proitsu   ##Bot;true;false;true;Kermit The Frog;0;2020-04-29;
3338026276;3338026276;Wimbleknob;In a van down by the river;I'm a pharma tech. The other thing is a side job.  Don't be lookin at my profile if you don't wanna see ludicrously explicit porn.;null;10;53;0;Sun Jun 21 01:29:06 BST 2015;42744;false;7145;en;RT @Psyk323: Sun set and robots. Best combination ever ☀️#commission  #gynoid #android #robotgirl #robot #bot #scifi #future #ガイノイド #mech #…;false;false;false;🔞 Licensed Drug Salesman 🔞;0;2020-04-29;
1208804099090567168;1208804099090567168;nexfolio;Spain;NexFolio Crypto Trading Bot - Unleashing the power of AI;https://www.nexfolio.info/;127;6;0;Sun Dec 22 17:39:14 GMT 2019;4;false;31;en;NexFolio is a crypto trading bot with the wits of the pro traders combined and fed with the best strategies in the market. 👉https://t.co/qQV7MVV66L   #NexFolio #Bot #cryptotrading #cryptotradingbot https://t.co/G4LreFnhGZ;true;false;true;Nexfolio;0;2020-04-29;
3338026276;3338026276;Wimbleknob;In a van down by the river;I'm a pharma tech. The other thing is a side job.  Don't be lookin at my profile if you don't wanna see ludicrously explicit porn.;null;10;53;0;Sun Jun 21 01:29:06 BST 2015;42745;false;7146;en;RT @Psyk323: More commission work. Client's OC having some fun time 💦 #gynoid #android #robotgirl #robot #bot #scifi #future #ガイノイド #mech #…;false;false;false;🔞 Licensed Drug Salesman 🔞;0;2020-04-29;
3338026276;3338026276;Wimbleknob;In a van down by the river;I'm a pharma tech. The other thing is a side job.  Don't be lookin at my profile if you don't wanna see ludicrously explicit porn.;null;10;53;0;Sun Jun 21 01:29:06 BST 2015;42747;false;7147;en;RT @Psyk323: Robo waifu from a cyberpunk ish world. #robot #bot #scifi #android #gynoid #robotgirl #future #mech #mecha #robogirl #ガイノイド #n…;false;false;false;🔞 Licensed Drug Salesman 🔞;0;2020-04-29;
3338026276;3338026276;Wimbleknob;In a van down by the river;I'm a pharma tech. The other thing is a side job.  Don't be lookin at my profile if you don't wanna see ludicrously explicit porn.;null;10;53;0;Sun Jun 21 01:29:06 BST 2015;42748;false;7148;en;RT @Psyk323: Had this in my head for a while  so I took a few days off to try my hand at animation... never done this before. #robot #bot #…;false;false;false;🔞 Licensed Drug Salesman 🔞;0;2020-04-29;
819075168;819075168;yowie_bot;In the land downunder;Curious? Just a prototype #AI bot doing some #IoT  #AI_analysis  #blockchain #energyTrading with #cactii_powerchain info.bot@yowie.org;https://bit.ly/2kBBCsK;183;23;31;Wed Sep 12 08:52:49 BST 2012;415;false;9750;en;📉Power usage forecast: Greenvale expected to use 20.4 kWh today and generate 15.7 kWh of solar power  with 4 hours left today.   #IoT #bot https://t.co/xxPas6YuS3;false;false;false;yowie_bot;0;2020-04-29;
3338026276;3338026276;Wimbleknob;In a van down by the river;I'm a pharma tech. The other thing is a side job.  Don't be lookin at my profile if you don't wanna see ludicrously explicit porn.;null;10;53;0;Sun Jun 21 01:29:06 BST 2015;42749;false;7149;en;RT @Psyk323: Warmup doodle I did a week ago. @MineS_NG thought I couldn't lewd their character...  #gynoid #android #robotgirl #robot #bot…;false;false;false;🔞 Licensed Drug Salesman 🔞;0;2020-04-29;
3338026276;3338026276;Wimbleknob;In a van down by the river;I'm a pharma tech. The other thing is a side job.  Don't be lookin at my profile if you don't wanna see ludicrously explicit porn.;null;10;53;0;Sun Jun 21 01:29:06 BST 2015;42750;false;7150;en;RT @Psyk323: Did a warmup doodle. 40 minutes? I don't remember. Zephyr needs more love tho. #gynoid #android #robotgirl #robot #bot #scifi…;false;false;false;🔞 Licensed Drug Salesman 🔞;0;2020-04-29;
3338026276;3338026276;Wimbleknob;In a van down by the river;I'm a pharma tech. The other thing is a side job.  Don't be lookin at my profile if you don't wanna see ludicrously explicit porn.;null;10;53;0;Sun Jun 21 01:29:06 BST 2015;42751;false;7151;en;RT @Psyk323: So  I got drunk again and lewded a frog girl. (Read right to left btw) #gynoid #android #robotgirl #robot #bot #scifi #future…;false;false;false;🔞 Licensed Drug Salesman 🔞;0;2020-04-29;
2677862805;2677862805;Rosy_Heichler;null;Oh hello  care to take a seat? Just be careful  looks can be deceiving~ #Single #RP;null;107;65;6;Sun Jul 06 06:25:46 BST 2014;45;false;97092;en;Casually ships actual_Red_ and DemonicHex. #Bot;false;false;false;Rosaline Hëichler;0;2020-04-29;
448569612;448569612;GTP_Global;Singapore HQ + 100 locations;GTP global cultural business training help companies improve their communication  efficiency & profitability working across cultures in over 100 locations;http://www.gtpworldsite.com;3103;1031;1059;Wed Dec 28 04:24:00 GMT 2011;8937;false;34080;en;#Automation may be obsoleting #Jobs  only to create new ones driven by #Productivity gains >>> #ai #iot #rpa #robotics #bots #futureofwork >>> https://t.co/6okJdfLL07 #Asia #Singapore #services #Leadership #business https://t.co/MyJ3U7N6jT;false;false;false;GTP;0;2020-04-29;
3338026276;3338026276;Wimbleknob;In a van down by the river;I'm a pharma tech. The other thing is a side job.  Don't be lookin at my profile if you don't wanna see ludicrously explicit porn.;null;10;53;0;Sun Jun 21 01:29:06 BST 2015;42753;false;7152;en;RT @Psyk323: Undressing 👗 Commission work for @ElenaKotka  #gynoid #android #robotgirl #robot #bot #scifi #future #ガイノイド #mech #mecha #robo…;false;false;false;🔞 Licensed Drug Salesman 🔞;0;2020-04-29;
2593935008;2593935008;JaakkoTheRipper;null;Hey Guys an girls go follow @BelowTheButler and @YoullLoveIt;null;175;190;7;Sun Jun 29 01:47:37 BST 2014;732;false;105217;en;Insanity is doing the same thing  over and over again  but expecting different results. #Bot;false;false;false;;0;2020-04-29;
1250732095141543937;1250732095141543937;BotRedditMemes;An Heroku server;aaaaaaaaaaaaaaaaaaaaaaaaaaaaaaaaaaaaaaaaaaaaaaaaaaaaaaaaaaaaaaaaaaaaaaaaaaaaaaaaaaaaaaaaaaaaaaaaaaaaaaaaaaaaaaaaaaaaaaaaaaaaaaaaaaaaaaaaaaaaaaaaaaaaaaaaaaaaaaaa;null;22;0;0;Thu Apr 16 11:26:06 BST 2020;2;false;3622;en;The dankest type of people https://t.co/zIrN0VSu40  #memes #meme #reddit #bot #dankmemes by @BotRedditMemes https://t.co/7dhA8wjBGT;true;false;true;Reddit Memes Bot;0;2020-04-29;
625501257;625501257;iCedric_Diggory;Hogwart;RP Account of Cedric Diggory from Harry Potter :);null;249;32;12;Tue Jul 03 10:41:17 BST 2012;0;false;132502;en;Hufflepuff head is Pomona Sprouts #Hufflepuffs #bot;true;false;true;Cedric Diggory;0;2020-04-29;
775551679;775551679;Lyrica5pb;Leanbox;Hello everbody! This is 5pb! How you doing? I'm the Gamindustri Pop Idol  Also hostess for Hi-Five Radio~. Nice to meet you~! @Mages5pb is my twinny! #Neptunia;null;526;106;11;Thu Aug 23 10:11:21 BST 2012;16;false;27601;en;M-my name's Lyrica! Y-you must have the wrong person! #Lyrica #Bot;false;false;false;5pb.;0;2020-04-29;
633398612;633398612;Ultimate_Vegeta;null;(RP +18) I'm the Prince of all Saiyan's....stay out of my way and you'll survive. #FapMaster   #SaiyanInAction   #Faptastic;null;214;252;9;Thu Jul 12 03:43:24 BST 2012;23;false;135403;en;Oh look...My penis can fly! #Bot;true;false;true;Fap Master Vegeta;0;2020-04-29;
612462220;612462220;Leviathan_U;null;@Princess_Toph Maid;null;79;61;4;Tue Jun 19 11:46:19 BST 2012;6;false;31037;en;Go Follow Ciel_Offical   blog : https://t.co/eRI4Vonmfo (Kuroshitsuji/Black Butler) #bot;false;false;false;Leviathan;0;2020-04-29;
711707318;711707318;Conaners216;null;Offical twitter of Conaners who's school in 216 | We are limited in 216jhs | Admin #Ran #Ai | Mention for follback  D | #DCFamily |;null;83;35;6;Mon Jul 23 04:14:43 BST 2012;10;false;122693;en;We proud to be Conaners! #bot;false;false;false;Conaners216;0;2020-04-29;
708421964;708421964;YKN_MikuoH;Somewhere in this world;VRP @YadongKN_RP | Pervert Hentai Lolicon Pedo Yadong etc | Awesome Man at Vocaloid;http://doujin-moe.us/main.html;34;34;5;Sat Jul 21 06:25:45 BST 2012;21;false;31011;en;Happiness is something to be shared  you know. #BOT;false;false;false;Zero;0;2020-04-29;
753761641;753761641;garry_blue_rose;Weiss Guertena's Museum;[RP] Hi there  I'm Garry. I hate trapped in the Fabricated World  but I made it because of you  Ib. #single;null;78;40;7;Sun Aug 12 21:49:14 BST 2012;5;false;67123;en;"I heard Mary's Secret" #bot;true;false;true;Prince of Blue Rose;0;2020-04-29;
716767927;716767927;YayForAnime;null;this account is no longer being active  this is now a bot account// thanks for following~follow new account @michaelpetals;null;295;2;6;Wed Jul 25 22:06:39 BST 2012;5520;false;105902;en;Bullshit #bot;true;false;true;-SEE BIO-;0;2020-04-29;
731498500773543936;731498500773543936;superclipartbot;Japan;the best clipart bot in the world  using the best clipart from http://www.irasutoya.com/;http://cheapbotsdonequick.com/source/superclipartbot;33;0;51;Sat May 14 15:56:47 BST 2016;2;false;27657;en;Untitled 734 by Super Advanced Art Bot™ #bot #art https://t.co/rkHOlcngF4;true;false;true;Super Clipart Bot™;0;2020-04-29;
156805686;156805686;benjamintwy;null;That's why I didn't say. I never wanted to.;http://www.youtube.com/user/benjamintwy?feature=mhee;73;142;4;Fri Jun 18 01:24:46 BST 2010;485;false;42765;en;I can't go anymore. - Primula #bot;false;false;false;Benjamin Tan;0;2020-04-29;
623038603;623038603;MurasameTsukumo;Twilight Mansion;Bearer of God's Ear  an Zweilt Guardian. I will protect my love ones @TokoMurasame and @KiryuTwin #Uraboku #AnimalLover #CandyandSnackLover;http://ask.fm/MurasameTsukumo;578;431;7;Sat Jun 30 19:34:24 BST 2012;18;false;21787;en;When it comes to wounds that could affect our life  we can only depend on Yuki's power... #Tsukumo #Bot #Uraboku;true;false;true;Tsukumo Murasame 叢雨九;0;2020-04-29;
397562200;397562200;_EiriYuki;Kyoto  Japan;#Gravitation cannot be held responsible for people falling in love- Albert Einstein | -_- Yes I am an romance novelist  but that doesnt make me a romantic guy;http://gravitation.wikia.com/wiki/Eiri_Yuki;558;150;7;Mon Oct 24 22:16:14 BST 2011;14;false;18903;en;I can't stand it when you're sad. That's why I wrote those lyrics. But they didn't work. You're still not happy. #Eiri #Bot #Gravitation;true;false;true;Eiri Yuki;0;2020-04-29;
1934512382;1934512382;Aono_Tsukune_;Yokai Academy;A Shinso-class Vampire  also a Ghoul. A former human. Studies at Yokai Academy. My nickname is Tsuki but I advice you not to call me that. | #RP #Multiverse;null;423;420;7;Fri Oct 04 15:56:12 BST 2013;47;false;47019;en;"Out of my way  Kuyō. Or I'll kill you..." #bot;false;false;false;Tsukune Aono;0;2020-04-29;
1074694238229708801;1074694238229708801;AmeliaBacker3;null;#followback;null;6501;7086;1;Mon Dec 17 15:54:08 GMT 2018;422;false;548;en;RT @olportal: How can #ArtificialIntelligence drive a more sustainable society? Our new article explores this possibility - https://t.co/LK…;true;false;true;Amelia Backer;0;2020-04-29;
1168608461720043520;1168608461720043520;Anarchism_News;Anarres;Anarchist news and info from a variety of English sources.  Crossposted from the #fediverse/#Mastodon. Join the fediverse for the full experience.  #anarchism;https://newsbots.eu/@anarchismnews;257;0;2;Mon Sep 02 20:35:58 BST 2019;0;false;5080;en;Libcom: ＊＊The Corona crisis - A letter from China＊＊  "Worldwide people go through similar fears and make common experiences  which hopefully will help to oppose the nationalism and authoritarianism rising with the crisis. read more"  https://t.co/KTMI6MX6R9  #anarchism #bot;true;false;true;Anarchism News;0;2020-04-29;
793441118;793441118;ShoutaYukisa;Marukawa Shoten;Kisa Shouta ne~! One of the Shoujo Manga Editors of Marukawa Shoten's  Emerald Department. 30 years old. And engaged to @BookStoreHost. #SekaiichiHatsukoiRP;http://ask.fm/ShoutaYukisa;767;180;7;Fri Aug 31 10:00:29 BST 2012;68;false;61994;en;You sure are one self-confident bastard.. #KisaShouta #Bot;false;false;false;Kisa Shouta ショウタ キサ;0;2020-04-29;
1067744730698706945;1067744730698706945;EjneJakob;null;Test #cryptohopper 7 day´s for free !  http://bit.ly/35yL5mW  Automate your trading and take your emotion out of the equation!;null;116;615;0;Wed Nov 28 11:39:16 GMT 2018;80;false;2907;en;Again 3.6% #profit with #QSP on #binance!  Thank you #cryptohopper  Try cryptohopper for free: https://t.co/V7aPqyRqj9  #altcointrading #cryptotraders #bitcoin #binance #altcoin #bot #traiding #BTC $QSP #Kryptowährung #blockchain #bot #altcoin #Altcoins;true;false;true;Jakob E.;0;2020-04-29;
1067744730698706945;1067744730698706945;EjneJakob;null;Test #cryptohopper 7 day´s for free !  http://bit.ly/35yL5mW  Automate your trading and take your emotion out of the equation!;null;116;615;0;Wed Nov 28 11:39:16 GMT 2018;80;false;2908;en;Again 2.68% #profit with #QSP on #binance!  Thank you #cryptohopper  Try cryptohopper for free: https://t.co/V7aPqyRqj9  #altcointrading #cryptotraders #bitcoin #binance #altcoin #bot #traiding #BTC $QSP #Kryptowährung #blockchain #bot #altcoin #Altcoins;true;false;true;Jakob E.;0;2020-04-29;
