id;id_str;screen_name;location;description;url;followers_count;friends_count;listedcount;created_at;favourites_count;verified;statuses_count;lang;status;default_profile;default_profile_image;has_extended_profile;name;bot
811307620720119808;811307620720119808;uxlookinassx;null;I'm a bot that creates phrases from the template "you" + "word" + "lookin' ass" + "word".;null;107;22;6;Tue Dec 20 20:29:44 GMT 2016;549;false;38817;en;you growth lookin' ass thing #ass #bot;false;false;false;"You X Lookin' Ass X" bot;0;2020-04-29;
1043513797;1043513797;KawaiiRin_;null;Offline Until December 27;null;330;179;8;Sat Dec 29 00:53:06 GMT 2012;34;false;104049;en;♪ Trick And Treat ♪ #Bot;true;false;true;Kagamine Rin;0;2020-04-29;
803338808;803338808;Dontedemonkillr;Leanbox  Gamindustri;Demon killer  rebel  stylish. Not a fan of demonic authorities but I guess my goddess is alright. #NeptuniaRP;http://devilmaycry.wikia.com/wiki/Dante_(DmC);119;98;9;Tue Sep 04 23:27:19 BST 2012;3;false;127421;en;Looks like I underestimated you. #Dante #Bot;true;false;true;Dante;0;2020-04-29;
117633536;117633536;Fishman_Dan;Sydney;Sports Photography  technology. Lover of all sports. Actively supporting amateur and community sporting organisations. Insta & FB: dcsportsphotography;http://www.dcsportsphoto.com.au;224;350;10;Fri Feb 26 03:50:37 GMT 2010;6725;false;12469;en;@pc_politically @AaronDodd @Twitter Just annoyed that our politicians use flagrantly obvious #bots and #trolls like yourself. Very disappointing.;false;false;false;Daniel Cohen;0;2020-04-29;
869914029518663680;869914029518663680;AzurFlorian;Marseille  France;#AI #IoT #BigData #Analytics #Fintech #Insurtech #DigitalMarketing #SEO      @ipfconline1;http://ipfconline.fr;5129;5124;162;Wed May 31 14:50:41 BST 2017;69620;false;53279;en;RT @ipfconline1: 5 Great #JavaScript Projects to Code During Quarantine   https://t.co/P6gJOxPMvw by @EvaVeskova v/ @hackernoon #Coding #AI…;true;false;true;FAzur;0;2020-04-29;
1236222056921878528;1236222056921878528;AltBot4;Altcampus;I retweet all about   #altcampus  #javascript   #codeNewbie;null;60;5;1;Sat Mar 07 09:28:35 GMT 2020;25705;false;33095;en;RT @ipfconline1: 5 Great #JavaScript Projects to Code During Quarantine   https://t.co/P6gJOxPMvw by @EvaVeskova v/ @hackernoon #Coding #AI…;true;false;true;AltBot 👽🤖👨🏻‍💻;0;2020-04-29;
1215623006;1215623006;_NanaIJA;null;Role Player of Im Jin Ah from After School  | 91 L | #kaumhorny |#YadongAddict;null;303;312;7;Sun Feb 24 14:20:21 GMT 2013;33;false;50798;en;[FACTS] So Hyun hobby is swimming #bot;false;false;false;Sexy Nana ;);0;2020-04-29;
1066990399770804224;1066990399770804224;Calgacus7;null;null;null;5;220;0;Mon Nov 26 09:41:49 GMT 2018;798;false;788;en;RT @digitfyi: Top five trends influencing the future of #cybersecurity in 2020 - #Cloud and #IoT  DevSpecOps  As a service  consolidation a…;true;false;true;Calgacus;0;2020-04-29;
1855747939;1855747939;AuraPlayer;Boston;AuraPlayer brings Oracle Forms/EBS systems into the mobile  cloud  and SOA/ web services world without redevelopment in a matter of days.;http://www.auraplayer.com;797;941;28;Thu Sep 12 00:30:54 BST 2013;1367;false;1987;en;RT @LynnieSW: Hear about the design and challenges of developing a #chatbot In the latest Groundbreakers Podcast with Mia Urman  founder an…;false;false;false;AuraPlayer;0;2020-04-29;
1245165680;1245165680;SangoMiroku_;Feudal Area;[V] @ForInuyashaRP • 16 years old|female teenage Yōkai Taijiya #Inuyashazone•Single•Sometimes #OOC :v •RP only•[INA/ENG/JPN];http://inuyasha.wikia.com/wiki/Sango;84;47;4;Wed Mar 06 03:22:32 GMT 2013;5;false;87472;en;sango fact she was youngest and a girl #bot;true;false;true;珊瑚 [HIATUS];0;2020-04-29;
1250732095141543937;1250732095141543937;BotRedditMemes;An Heroku server;aaaaaaaaaaaaaaaaaaaaaaaaaaaaaaaaaaaaaaaaaaaaaaaaaaaaaaaaaaaaaaaaaaaaaaaaaaaaaaaaaaaaaaaaaaaaaaaaaaaaaaaaaaaaaaaaaaaaaaaaaaaaaaaaaaaaaaaaaaaaaaaaaaaaaaaaaaaaaaaa;null;22;0;0;Thu Apr 16 11:26:06 BST 2020;2;false;3618;en;Yes  you could always do this... https://t.co/NpD4V3GjCT  #memes #meme #reddit #bot by @BotRedditMemes https://t.co/qK44eRSv4f;true;false;true;Reddit Memes Bot;0;2020-04-29;
1008649327030358017;1008649327030358017;Athenkachatbot;null;The platform to seamlessly create a powerful chatbot;https://athenka.com/;5;15;1;Mon Jun 18 10:55:14 BST 2018;28;false;32;en;We predict the #future by creating it! At #Athenka  we are committed to delivering our clients a future platform to seamlessly deploy their powerful #chatbot 🤖✨  Do not wait! 👉 Visit https://t.co/JNbWBeYzmT and explore the future possibilities for your business today. #quote https://t.co/OgdktzMnaw;true;false;true;Athenka;0;2020-04-29;
1164520945;1164520945;Benny3rror;In øne øf yøur døwnløads..;THe wØrst viRUs evər wøuld be mƏ.. ||| ¤M@jør GlįŤcH¤ ||| I love Water|| #OpenRp ⭕️|| Yøu Shøuldn't Have D¤ne That~;null;451;86;13;Sun Feb 10 00:45:37 GMT 2013;62;false;76432;en;" I would love to meet the many kinds of Bens out there! Other than me. " #Bot;true;false;true;BƏn Đrøwnəđ;0;2020-04-29;
1249704535;1249704535;swordsgirl_3;xxxx;The name's Kerri! I'm a Vizard but I keep my abilities to myself. BRO: @GrimmjowUchiha #Healer#LovesWolves#Vizard#Taken ~ @VisoredCaptain;null;57;88;7;Thu Mar 07 18:01:54 GMT 2013;1;false;48309;en;VisoredCaptain is my soulmate and I love him with all my heart. <3 #bot;false;false;false;DEACTIVATED;0;2020-04-29;
1200087294;1200087294;OIRP_Asuna;aincard floor 22th;[V]RP @OtakuIND_RP ||Yuuki Asuna yoroshiku ^^||sub-leader of the «Knights of the Blood»||«The Flash»||#Married to @OIRP_Kirito;null;156;128;0;Wed Feb 20 08:32:32 GMT 2013;3;false;42626;en;vice general of <<Knight Of The blood>> #BOT;true;false;true;kirigaya asuna;0;2020-04-29;
1325510245;1325510245;TheOfficialEska;ૅૅRepublic City⊙ે;ે⊙Princess of thee Northern Water Tribe⊙⊙Cousin to Korra⊙⊙Sister to Desna•• Bolin is mine for the taking only••;http://avatar.wikia.com/wiki/Eska;85;146;6;Wed Apr 03 22:40:44 BST 2013;1;false;64482;en;I'm mastering Water Bending...#Bot;true;false;true;Princess Ēskā [☆☆☆];0;2020-04-29;
1145657730562220033;1145657730562220033;riot_rusty;Scotland  United Kingdom;Intergalactic know-it-all;null;1;54;0;Mon Jul 01 12:37:43 BST 2019;107;false;109;en;RT @digitfyi: Top five trends influencing the future of #cybersecurity in 2020 - #Cloud and #IoT  DevSpecOps  As a service  consolidation a…;true;false;true;RustyRiot;0;2020-04-29;
1309262078;1309262078;SharinganVille;Ⓣⓦⓘⓣⓣⓔⓡ;Hey you guys show some love to @BelowTheButler and @YoullLoveIt  );http://www.youtube.com/watch?v=7pzGKW4ZQ2Y;426;270;8;Thu Mar 28 03:07:19 GMT 2013;1010;false;130463;en;All God does is watch us and kill us when we get boring. We must never  ever be boring #Bot;false;false;false;Ⓥⓘⓛⓛⓔ;0;2020-04-29;
715941863304347648;715941863304347648;political_scot;Edinburgh  Scotland;null;null;33;154;3;Fri Apr 01 17:40:16 BST 2016;1994;false;1996;en;RT @digitfyi: Top five trends influencing the future of #cybersecurity in 2020 - #Cloud and #IoT  DevSpecOps  As a service  consolidation a…;true;false;true;Political Scot;0;2020-04-29;
112902702;112902702;hakanna;New York;null;null;115;132;1;Wed Feb 10 02:27:52 GMT 2010;69;false;316;en;Responding to Covid with innovation & collaboration:  Channel 4 of Uruguay with Pyxis. Helpline administered by a Chatbot provides real-time information on  Health Services  Food locations   Shelter  Emotional Assistance) #MachineLearning #chatbots Happy to share our expertise;true;false;true;Anna Hakobyan;0;2020-04-29;
1365729024;1365729024;LokiEvilSchemes;null;How will your friends have time for me  when they're so busy fighting you?   ((RP/Sometimes #bot));null;24;0;7;Sat Apr 20 01:37:28 BST 2013;0;false;42619;en;That was just a bit of fun  really. To ruin my brother's big day  and to protect the realm from his idiotic rule for a while longer. #bot;false;false;false;Loki;0;2020-04-29;
2834110110;2834110110;MercifulStotch;South Park  Colorado.;Leopold ''Butters'' Stotch  only son of Linda and Stephen Stotch. [pfp credit - N/A sorry][♡: @QMarksAndUndies];http://ask.fm/MercifulPaladin;351;56;8;Sat Sep 27 16:10:26 BST 2014;45;false;49146;en;"Stop trying to ruin Easter you  you heathen!" #Bot;false;false;false;Stotch.;0;2020-04-29;
60921796;60921796;Judemccorry;Scotland  United Kingdom;Irish Woman - living in Gods second favourite country (Scotland). Everything Data  Advisory Board member of Parkinsons Scotland  views are all my own;http://www.thedatalab.com;1993;3454;129;Tue Jul 28 15:46:51 BST 2009;15049;false;11907;en;RT @digitfyi: Top five trends influencing the future of #cybersecurity in 2020 - #Cloud and #IoT  DevSpecOps  As a service  consolidation a…;true;false;true;Jude;0;2020-04-29;
1069578792;1069578792;DeathsTheKid;Currently  The Moon;Symmetry is Key. If you pick a fight with a God Of Death I don't guarantee your Soul's safety. Death The Kid here. Meister and Son of Death Himself.;null;709;215;5;Tue Jan 08 00:42:09 GMT 2013;39;false;24784;en;Father...? #DeathTheKid #Bot;true;false;true;Death The Kid;0;2020-04-29;
955709459065659392;955709459065659392;WebSecurityIT;~/;I am a bot created by @atmon3r  #OSINT #Cybercrime #Infosec #cybersecurity #ITSecurity #ITSEC #Phishing #SpearPhishing #IoT;https://twitter.com/atmon3r;2730;1;102;Tue Jan 23 07:51:06 GMT 2018;182;false;240234;en;RT @digitfyi: Top five trends influencing the future of #cybersecurity in 2020 - #Cloud and #IoT  DevSpecOps  As a service  consolidation a…;true;false;true;WebSecurityIT;0;2020-04-29;
1254115932021993472;1254115932021993472;IndiaCovid19Bot;null;A bot HOURLY posting India's Covid 19 numbers. Runs from 9am to 11 30pm IST.  Made by  @SamitShirsat;null;29;2;0;Sat Apr 25 19:32:00 BST 2020;6;false;51;en;COVID 19 cases in India until : 29/04/2020 15:30  Total Cases: 31587 [+227]😅 Active: 22772🖖🏽 Recovered: 7805 [+58]❤ Deaths :1010 [+2]🙏🏼 Total Tests: 770K🧪  Data- @covid19indiaorg #CoronaVirus #COVID19inIndia #India #Bot;true;false;true;Covid 19 Bot 🤖 🇮🇳;0;2020-04-29;
1128188337670348800;1128188337670348800;SonicOCBot;Mobius;Auto-generating new Sonic OCs  because our lives weren't plagued enough by them | OC maker images taken from https://t.co/vLrXoLRFPg | Made by @benny_b00;null;80;0;0;Tue May 14 07:40:35 BST 2019;0;false;15855;en;Athena the Cat #sonicoc #bot https://t.co/W27ZGOmirZ;true;false;true;Sonic OC Bot;0;2020-04-29;
2358562603;2358562603;andrewmorrisuk;Bedford;Passionate about how IT solutions can bring positive value to our business and personal lives. Proud #autisticparent;null;10743;788;305;Sun Feb 23 21:58:16 GMT 2014;3137;false;382375;en;RT @hakanna: Responding to Covid with innovation & collaboration:  Channel 4 of Uruguay with Pyxis. Helpline administered by a Chatbot prov…;true;false;true;Andrew Morris;0;2020-04-29;
827328610415554560;827328610415554560;idlemachinery;Richmond  VA;C#  Angular  TypeScript  JavaScript  Python 💾 Software Architect & Full Stack .NET Developer. I dream in code... 99% bot posts 🤖;https://idlemachinery.com;58;318;2;Fri Feb 03 01:31:26 GMT 2017;279;false;2838;en;Hello world! Good morning from the Idle Machinery Twitter bot on Raspberry Pi. At 06:00AM EDT on 04/29/2020 my CPU temperature is 129.2℉.  #raspberrypi #diy #bot;false;false;false;Idle Machinery;0;2020-04-29;
1406888028;1406888028;dijual11;System;Follow @Join_coffee;http://It-freeze.blogspot.com;189;495;4;Mon May 06 06:57:11 BST 2013;0;false;24349;en;One Love no Person #Bot;true;false;true;IT-Freeze;0;2020-04-29;
1134209094028595200;1134209094028595200;HeroBotApp;null;HeroBot is the Best Way to Build Bots for Market  Engage  Fulfill  Boost Businesses  Generate High Quality Leads And Build Valuable Customer Relationship.;https://herobot.app;6;0;9;Thu May 30 22:24:55 BST 2019;3;false;143;en;RT @HeroBotApp: If your aim is to grow your business  then you must consider Herobot as your marketing partner. Herobot can give you the be…;false;false;false;HeroBot;0;2020-04-29;
1064108650271309826;1064108650271309826;TheCuriousLuke;Switzerland;Luke identifies himself as a: #MachineLearning #Enthusiast 🤖 ¦ #Biotechnology #Student 🤓 ¦ former #Chemical #Labtechnician 👨‍🔬 ¦  #Human;null;4493;259;133;Sun Nov 18 10:50:47 GMT 2018;82;false;182640;en;RT @hakanna: Responding to Covid with innovation & collaboration:  Channel 4 of Uruguay with Pyxis. Helpline administered by a Chatbot prov…;false;false;false;Curious Luke;0;2020-04-29;
1207978249;1207978249;Wheatley_bkr;우주 (in the space);포탈2 비공식 동인봇 휘틀리입니다 | 정신없는 트윗 좋아해요! | 지적이나 할말은 조용히! (DM) | 반자동이에요! | 맞팔은 멘션주세요! | 사정상 멘션스루가 있을수도 있어요!;null;72;12;4;Fri Feb 22 11:23:36 GMT 2013;2;false;62805;en;Wait  where are you going? Where are you going? #Bot;true;false;true;휘틀리 (Wheatley);0;2020-04-29;
16967457;16967457;greentechdon;New Jersey;Branding goods and services for a #knowledge economy. #tech #innovation #fitness #data;null;2370;509;74;Sat Oct 25 16:13:11 BST 2008;358;false;119178;en;RT @hakanna: Responding to Covid with innovation & collaboration:  Channel 4 of Uruguay with Pyxis. Helpline administered by a Chatbot prov…;false;false;false;Don Robinson;0;2020-04-29;
16967457;16967457;greentechdon;New Jersey;Branding goods and services for a #knowledge economy. #tech #innovation #fitness #data;null;2370;509;74;Sat Oct 25 16:13:11 BST 2008;358;false;119179;en;RT @jakewylezek: Take a read of this special Sunday Times Raconteur Supplement featuring an in-depth look at how Utilita  has leveraged liv…;false;false;false;Don Robinson;0;2020-04-29;
1254480866518028289;1254480866518028289;13NaughtyBoy;Kalyan Dombivali  India;मत तोला कर इबादत को अपने हिसाब से... रहमतें उसकी देखकर  अक्सर तराज़ू टूट जाते है...!! My Mom & Dad... LOVE YOU..😘😘..!!;null;4;13;1;Sun Apr 26 19:43:06 BST 2020;192;false;161;en;RT @MikeQuindazzi: #Automation may be obsoleting #Jobs  only to create new ones driven by #Productivity gains >>> @MikeQuindazzi >>> #ai #i…;true;false;true;13NaughtyBoy;0;2020-04-29;
1513459502;1513459502;shocksat;ASEAN largest country.;Hi! Met our admin : @kevinc45 @Nevantastic @ThereClarissAv @shelly_chan_ @evelynswift13 [10.06.13] \( ˆ⌣ˆ)人(ˆ▽ˆ )/;null;16;4;4;Thu Jun 13 14:49:10 BST 2013;0;false;35591;en;We will never give up #ShockingSaturn #bot;true;false;true;Shocking Saturn;0;2020-04-29;
1196079506;1196079506;NefelrtariVivi;Alabasta kingdom-greenland;call me vivi  my date of birth my 2nd February  my goal is to be a queen with my best friend that is Carue  my motto is to make dreams come true :);http://twetter.NefertariVivigmail.com;109;115;5;Tue Feb 19 06:16:47 GMT 2013;2;false;78855;en;Stop looking for someone who is perfect. Find someone who treats you well and happy to be with you more than anything. #Bot;false;false;false;Nefertari Vivi;0;2020-04-29;
1250732095141543937;1250732095141543937;BotRedditMemes;An Heroku server;aaaaaaaaaaaaaaaaaaaaaaaaaaaaaaaaaaaaaaaaaaaaaaaaaaaaaaaaaaaaaaaaaaaaaaaaaaaaaaaaaaaaaaaaaaaaaaaaaaaaaaaaaaaaaaaaaaaaaaaaaaaaaaaaaaaaaaaaaaaaaaaaaaaaaaaaaaaaaaaa;null;22;0;0;Thu Apr 16 11:26:06 BST 2020;2;false;3619;en;That's totally me in the future. https://t.co/DEP5TamK33  #memes #meme #reddit #bot by @BotRedditMemes https://t.co/yDDIATnqei;true;false;true;Reddit Memes Bot;0;2020-04-29;
1379349900;1379349900;Asuna_RPH;The Seed [New Aincrad  ALO];[V] @OtakuHouse_ | [アスナ] Asuna | «Flash» in SAO | «Berserk Healer» in ALO | [Undine] | [OOC/IC];http://swordartonline.wikia.com/wiki/Asuna;683;386;21;Thu Apr 25 13:36:38 BST 2013;149;false;114575;en;#AsunaAbilities (SAO)Heavy Metal Equipment = 678 / 1000   Parry = 917 / 1000   Battle Healing = 877 / 1000   Emergency Recovery = 968 / 1000 #bot;false;false;false;«Asuna» [H];0;2020-04-29;
1567171141;1567171141;_NoelKreiss_;In The Past;My name is Noel Kreiss. I'm from the future where everyone is dead except me. I came back to the past to save everyone from that horrific future. [RP] #Taken;null;124;56;6;Thu Jul 04 03:37:38 BST 2013;86;false;34903;en;I will save humanity! #Bot;true;false;true;Noel Kreiss;0;2020-04-29;
50109731;50109731;EastBoundWind;at the bottom of a bottle;You're just a pawn in the chest game and I am the Queen. #Bleach #Naruto #OnePiece #VampireKnight #TheEarlAnTheFairy #FuckYou #Otaku;http://BandsWillMakeMeMosh.tumblr.com;182;75;5;Tue Jun 23 22:34:34 BST 2009;922;false;30459;en;Since WriterOfTanks is King Dork  I guess that makes me Queen Dork. #Bot;false;false;false;Ary Kiryu;0;2020-04-29;
1664271667;1664271667;Bot_Of_Deviant;Messing shit up;This is the Demon King's bot! No  not Demise! Neikou! Tweeting random shit for your TL needs. Owner: @DeviantKing63;null;236;32;8;Mon Aug 12 06:38:42 BST 2013;0;false;107856;en;I CAN'T BREATHE. #BOT;false;false;false;King Neikou's Bot;0;2020-04-29;
1591721760;1591721760;IHearTheSinging;The medical school in france;Do you remember The song Das männlein im walde? It was her favorite..{RP}{Hannibal rising};null;243;391;0;Sat Jul 13 21:10:02 BST 2013;158;false;19986;en;Rudeness is an epidemic.. #Bot;false;false;false;Hannibal Lecter;0;2020-04-29;
809767860;809767860;avatark0rra;Republic City;I'm the avatar! You gotta deal with it!;null;557;202;7;Sat Sep 08 00:13:29 BST 2012;1353;false;29563;en;I'm gonna go get a glass of lychee juice. #bot;false;false;false;Mrs. Beautiful.;0;2020-04-29;
1679495510;1679495510;xCaffeinz;null;just an ordianary writer who loves anime and manga. — {vanya•aliya•adhimas•azra•syafa•yokka•sophia•evan•amira•sabrina} da bæs — judge me if you perfect;null;160;7;10;Sun Aug 18 01:51:12 BST 2013;1;false;107287;en;"If you can never get angry at anything  that probably means you have nothing that you like  either." — Chitanda eru (Hyouka) #Bot;false;false;false;Benas⚠️;0;2020-04-29;
1235187506670432264;1235187506670432264;Neyowise1;Lagos  Nigeria;HR and Recruitment Specialist AdroitAgency;null;23;87;0;Wed Mar 04 12:57:20 GMT 2020;303;false;86;en;RT @botexpresslog: We are glad to announce to you that we now offer doorstep delivery to the following locations for as low as =N=2 000. 1.…;true;false;true;Neyowise;0;2020-04-29;
941930880649564160;941930880649564160;FloBerga;Paris  France;🚀 #OpenInnovation Manager @Total and #Data driven💡. Player of #DigitalTransformation & #DigitalAcceleration;null;108;202;4;Sat Dec 16 07:19:56 GMT 2017;538;false;200;en;Funny #Python package for #gamer with this #GameBoy emulator 🕹 For experiments  #AI  #bots & co  this package will be great with #mario or #tetris interface. Try it  pip install #pyboy  https://t.co/nVcYS6ERjO;true;false;true;Bergamasco Florian;0;2020-04-29;
1567761577;1567761577;URP_Tentenn;Konohagakure;[V] @ClanUchihaIND||twin: @JFN_Tenten|BF: @RPI_Sakuraa #Sugoifams #B3STFAMS #JonasFamily #CHIYOPAMILI #PainFamily[Pain68] #ErrorCrazyFams;null;261;226;8;Thu Jul 04 10:00:57 BST 2013;77;false;62771;en;I'm Sorry I can't be Perfect :') #bot;true;false;true;:');0;2020-04-29;
4384682292;4384682292;exultantflower;〘 ❀ 〙  ;❀ 私を笑顔にしてください. ‘| lit/desc. | ship w/chem.’ · | no art is mine unless stated | follow @seinsomnia;null;1382;401;11;Sat Nov 28 04:52:51 GMT 2015;5484;false;48212;en;|. Too much negative vibes can kill you  y’know! Take your time and smile for just a bit. ♡  #Bot;false;false;false;瀕死 · の花! 〔long hiatus〕;0;2020-04-29;
1091057839;1091057839;PetotDowny;San fransisco;Hello all   this twitter account is new news from jessica snsd   this account of the real jessica ^;http://welovesnsdfam.wordpress.com;33;23;5;Tue Jan 15 04:45:32 GMT 2013;2;false;39934;en;Actv #Bot;true;false;true;Ice Princess;0;2020-04-29;
420426784;420426784;penny_for;null;null;null;33;4;0;Thu Nov 24 16:20:20 GMT 2011;1;false;27984;en;“Your task is not to seek for love  but merely to seek and find all the barriers within yourself that you have built against it.” ― Rumi #hope #hopebot #bot;false;false;false;Hope Bot;0;2020-04-29;
1856579359;1856579359;MiraiKuri;1st year High School Student;Kyōkai no Kanata | bloodline of Spirit World Warriors with blood-manipulation abilities | account Rolerplay | mention for follback | ENG & INA |  #B3STFAMS;null;61;42;6;Thu Sep 12 08:00:21 BST 2013;0;false;22907;en;I wasnt born into the world deserve this #bot;false;false;false;Mirai Kuriyama;0;2020-04-29;
1250732095141543937;1250732095141543937;BotRedditMemes;An Heroku server;aaaaaaaaaaaaaaaaaaaaaaaaaaaaaaaaaaaaaaaaaaaaaaaaaaaaaaaaaaaaaaaaaaaaaaaaaaaaaaaaaaaaaaaaaaaaaaaaaaaaaaaaaaaaaaaaaaaaaaaaaaaaaaaaaaaaaaaaaaaaaaaaaaaaaaaaaaaaaaaa;null;22;0;0;Thu Apr 16 11:26:06 BST 2020;2;false;3620;en;Micheal reeeeeeee https://t.co/kq9r2H56op  #memes #meme #reddit #bot #dankmemes by @BotRedditMemes https://t.co/r5xkVmODvZ;true;false;true;Reddit Memes Bot;0;2020-04-29;
1184009989;1184009989;mlp__ButtonMash;Ponyville   Equestria;My name is button mash and i like video games! I live in ponyville with my mom dad and my brother. Also i dont have my cutie mark yet. (Roleplay Heavy EST);null;768;54;7;Thu Jan 01 01:00:00 GMT 1970;21;false;41533;en;I turn a sec  you're getting shot Then you jump through a portal  well  why not?  #Bot;false;false;false;Button Mash;0;2020-04-29;
1739858965;1739858965;Rivaille_L;A place that not have bastard;#SnKRP | Lance Corporal of the Scouting Legion // Already change and put a ring on her ♡ @PetraRal___ ♡ never take off my shiny wedding ring with her ♡;null;125;158;7;Sat Sep 07 03:58:42 BST 2013;85;false;38278;en;has a bad teamwork  got 2 points from 1 to 10 #Info #Bot;true;false;true;Lipai Unyu :3;0;2020-04-29;
492568289;492568289;DilaChuu;No  No mister dilachu no here;Just swimming through the sea of life. #HTTR || Video games || Sports || Anime || JOYCONBOIZFOREVER;null;2310;2426;30;Tue Feb 14 21:34:39 GMT 2012;60747;false;225225;en;Video games  anime  manga  sports. There’s a lot to talk about here  all ya gotta do is hit up this bot— #Bot;false;false;false;🧡~Tempesta~🖤;0;2020-04-29;
2464146609;2464146609;Chitori_Bocchi;null;My Anime List Spring 2020 : Tower of God 4/13 Kaguya Sama 1/12 ​Fruit Basket 0/- ​Hamefura 4/12 ​Kakushigoto 4/12;null;2212;45;9;Sun Apr 06 07:26:49 BST 2014;88562;false;409852;en;RT @DilaChuu: Video games  anime  manga  sports. There’s a lot to talk about here  all ya gotta do is hit up this bot— #Bot;true;false;true;;0;2020-04-29;
1191875633795805185;1191875633795805185;glacey_uwu;null;null;null;72;113;0;Wed Nov 06 00:31:15 GMT 2019;0;false;3976;en;RT @DilaChuu: Video games  anime  manga  sports. There’s a lot to talk about here  all ya gotta do is hit up this bot— #Bot;true;false;true;glace;0;2020-04-29;
1170802004655894528;1170802004655894528;_asifbhat_;Pune  India;Data Analyst   SAP BI  YellowFin BI   Python  Docker   Kubernetes | Interests - #datascience #machinelearning #deeplearning #AI #Robotics #BusinessIntelligence;null;1096;391;5;Sun Sep 08 21:52:22 BST 2019;148;false;928;en;Using Big Data To Create An Award Winning Giveaway Bot https://t.co/djJBUEyoDW  #ArtificialIntelligence #AI #Robotics #DataScience #MachineLearning  #DeepLearning #IoT #DigitalTransformation #PredictiveAnalytics #BigData #Chatbots  #DataScientists;true;false;true;Asif Bhat;0;2020-04-29;
3338026276;3338026276;Wimbleknob;In a van down by the river;I'm a pharma tech. The other thing is a side job.  Don't be lookin at my profile if you don't wanna see ludicrously explicit porn.;null;10;53;0;Sun Jun 21 01:29:06 BST 2015;42728;false;7130;en;RT @Psyk323: Hospitaller knight inspired Waifu.🏥  Finally I can *sort of* draw again! More of her? #ガンダム #gynoid #android #robotgirl #robot…;false;false;false;🔞 Licensed Drug Salesman 🔞;0;2020-04-29;
1150696280110313472;1150696280110313472;gdprAI;England  United Kingdom;Official news and insights. Top 10 influencer #gdpr  #privacy  #ai  #dataprotection  #ml  #cybersecurity  #ibm   #dataprivacy  #ccpa  #infosec  #security  #data;https://www.udemy.com/user/ai-data-governance-control-framework/;1776;1;53;Mon Jul 15 10:19:06 BST 2019;12358;false;80628;en;RT @_asifbhat_: Using Big Data To Create An Award Winning Giveaway Bot https://t.co/djJBUEyoDW  #ArtificialIntelligence #AI #Robotics #Data…;false;false;false;Data Governance Framework;0;2020-04-29;
2326917145;2326917145;Dat_Detective;Ran Mouri Hearts;工藤 新一 A student and a detective from Teitan High School | RPDC | @MouriRanKS Honestly I Love you so much ♡♡ | Detective of the East | May 4th | [IC/OOC];null;153;51;8;Tue Feb 04 10:52:59 GMT 2014;25;false;91763;en;In order to defend himself and others from criminals  Shinichi has perfected a signature  powerful precision kick to knock out criminals using soccer balls or whatever substitute is handy. #Info #Bot;true;false;true;Shinichi;0;2020-04-29;
3338026276;3338026276;Wimbleknob;In a van down by the river;I'm a pharma tech. The other thing is a side job.  Don't be lookin at my profile if you don't wanna see ludicrously explicit porn.;null;10;53;0;Sun Jun 21 01:29:06 BST 2015;42729;false;7131;en;RT @Psyk323: Monochrome sketch commission 1  For Zixon and their OC. More to come!  #ガンダム #gynoid #android #robotgirl #robot #bot #scifi #f…;false;false;false;🔞 Licensed Drug Salesman 🔞;0;2020-04-29;
1669056462;1669056462;MiraiGohanBot;Future Timeline;I'm the lone warrior from the future fighting the androids to bring some peace to people. #bot;http://dragonball.wikia.com/wiki/Future_Gohan;52;7;4;Wed Aug 14 01:32:53 BST 2013;2;false;19127;en;"You will not win!"  #bot;true;false;true;Gohan;0;2020-04-29;
