id;id_str;screen_name;location;description;url;followers_count;friends_count;listedcount;created_at;favourites_count;verified;statuses_count;lang;status;default_profile;default_profile_image;has_extended_profile;name;bot
870026996;870026996;_yvop;Frankfurt;Loving husband & father. Addicted to #Ski  #Wakeboard  #Kitesurf  #WingTsun & #Travel. Enjoying life. Working as Senior Account Executive @Salesforce.;null;135;69;0;Tue Oct 09 15:52:15 BST 2012;329;false;749;en;Has the #COVID19 crisis caused a huge spike in your #ContactCenter volume?   Learn how to create and deploy an emergency information bot.  #ChatBot #Salesforce #SalesforceOhana #CustomerSuccess #StaySafe #StayHealthy #StayHome https://t.co/9vlRLSZem9;false;false;false;Yvo Pešek;0;2020-04-29;
1513459502;1513459502;shocksat;ASEAN largest country.;Hi! Met our admin : @kevinc45 @Nevantastic @ThereClarissAv @shelly_chan_ @evelynswift13 [10.06.13] \( ˆ⌣ˆ)人(ˆ▽ˆ )/;null;16;4;4;Thu Jun 13 14:49:10 BST 2013;0;false;35590;en;Our friendship is like Spongebob & Patrick friendship. We completed each other weakness and keep supporting each other #ShockingSaturn #bot;true;false;true;Shocking Saturn;0;2020-04-29;
1379349900;1379349900;Asuna_RPH;The Seed [New Aincrad  ALO];[V] @OtakuHouse_ | [アスナ] Asuna | «Flash» in SAO | «Berserk Healer» in ALO | [Undine] | [OOC/IC];http://swordartonline.wikia.com/wiki/Asuna;683;386;21;Thu Apr 25 13:36:38 BST 2013;149;false;114573;en;#AsunaAbilities (SAO) Main Equipment : 「Wind Fleuret」 (One-Handed Rapier)「Lambent Light」 (One-Handed Rapier) #bot;false;false;false;«Asuna» [H];0;2020-04-29;
1208795754946383872;1208795754946383872;Superdigital9;Bangalore;We build brands  We provide highly result-driven online Digital Marketing Service to our clients with cutting edge technology using Artificial Intelligence;https://superdigital.agency/;302;665;4;Sun Dec 22 17:05:54 GMT 2019;1144;false;3937;en;5 examples how to generate leads automatically with chatbots #Chatbot #chatbots via https://t.co/kqI2JSOoct https://t.co/upKHjlHPdM;true;false;true;Superdigital;0;2020-04-29;
1398384404;1398384404;yesunggghh;nenen :*;rp|yadongers;null;50;43;3;Fri May 03 00:06:30 BST 2013;18;false;9934;en;test #bot;true;false;true;sung;0;2020-04-29;
1664271667;1664271667;Bot_Of_Deviant;Messing shit up;This is the Demon King's bot! No  not Demise! Neikou! Tweeting random shit for your TL needs. Owner: @DeviantKing63;null;236;32;8;Mon Aug 12 06:38:42 BST 2013;0;false;107854;en;Twitter  you can screw yourself in the ass. #BOT;false;false;false;King Neikou's Bot;0;2020-04-29;
1679495510;1679495510;xCaffeinz;null;just an ordianary writer who loves anime and manga. — {vanya•aliya•adhimas•azra•syafa•yokka•sophia•evan•amira•sabrina} da bæs — judge me if you perfect;null;160;7;10;Sun Aug 18 01:51:12 BST 2013;1;false;107285;en;"I'm not stupid. I'm just too lazy to show how smart I am." — Oreki Houtarou (Hyouka) #Bot;false;false;false;Benas⚠️;0;2020-04-29;
1538278604;1538278604;actual_tetsuna;SEIRIN;[ Kuroko Tetsuya Genderbend ];http://www.kurobas.com;77;118;2;Sat Jun 22 09:43:52 BST 2013;3;false;4305;en;Gender Female| Age 17|  Height 142cm (4'8") | Eyes Color Hazel | Hair Color Light Brown | TitlePalmtop Tiger  The Palmtop Tiger of HappinessStatus #bot;true;false;true;Kuroko Tetsuna;0;2020-04-29;
1179995872697864193;1179995872697864193;CommMintage;Financial District Hyderabad;Mintage MarkComm (OPC) Pvt. Ltd is a one stop solution for Both Marketing and Communication.;http://www.mintagemarkcomm.com;18;22;1;Fri Oct 04 06:45:31 BST 2019;223;false;142;en;The World Lost a Gem Today. R.I.P Irrfan Khan Sir! #rip #irrfankhan #irrfankhandeath #actor #legend #bollywood #hollywood #death #lifeofpi #thelunchbox #hindimedium #angrezimedium #bollywoodactor #chatbot #offlinemarketing #mintagemarkcomm #adbuying #Advertising #branding https://t.co/7BkGGzvr6x;true;false;true;Mintage MarkComm;0;2020-04-29;
1493973312;1493973312;NarutoUzumaki_t;null;I'm Naruto Uzumaki  I'm gonna become hokage some day believe it. #RP #Engaged to my queen @Queen_DarkN #OC;null;1018;415;7;Sat Jun 08 22:47:07 BST 2013;2910;false;120596;en;naruto will be online later this is his #bot talking with you :D;false;false;false;Drunk Naruto;0;2020-04-29;
1105663620;1105663620;mochiruka;null;someone who likes to sleep anytime lol;null;215;229;4;Sun Jan 20 07:59:59 GMT 2013;5;false;14632;en;wanna know all about me? just ask on https://t.co/PGHT7227Wj #bot;false;false;false;Mochichi;0;2020-04-29;
1679827177;1679827177;AokiL_AR;null;null;null;18;22;5;Sun Aug 18 05:09:56 BST 2013;0;false;13605;en;Hi! This is Aoki #bot :D;true;false;true;DEACT!;0;2020-04-29;
1850763668;1850763668;RoxasWaifu;Singapore;This is the result of me being hyper☆;https://twitter.com/Roxastagram;3;0;4;Tue Sep 10 08:57:11 BST 2013;0;false;13549;en;To keep this jail account activate  I'm making bots #Bot;true;false;true;Ver(oxas)lyn;0;2020-04-29;
737797706740043780;737797706740043780;marcotic12;null;🕊Cryptonerd and Cyberhippie🕊  🎵🎹Music n Art Creator🎹🎵  🍁🍁Smoker🍁🍁 📱Aircoins addicted📱;null;457;1304;1;Wed Jun 01 01:07:35 BST 2016;3212;false;3630;en;RT @glitch80bot: 🐺⚛ #glitch #analogphotography #nodejs #generative #rosace #codeart #color #bot Origin img by @siqintbruce 6Q{x6 https://t.…;true;false;true;Marchemist;0;2020-04-29;
737142202481016832;737142202481016832;chidambara09;Mysore  and  BERLIN;Be happy  Be healthy Be smile Be cool Be good human;null;6597;14;4490;Mon May 30 05:42:51 BST 2016;58;false;988495;en;RT @Tegeria2: RT: @HaroldSinnott Building blocks to become a more #AI intelligent #Enterprise #PwC via  @MikeQuindazzi  #RPA #IoT #BigData…;true;false;true;Chidambara .ML.;0;2020-04-29;
420426784;420426784;penny_for;null;null;null;33;4;0;Thu Nov 24 16:20:20 GMT 2011;1;false;27981;en;“What you seek is seeking you.”  ― Mawlana Jalal-al-Din Rumi #hope #hopebot #bot;false;false;false;Hope Bot;0;2020-04-29;
1250732095141543937;1250732095141543937;BotRedditMemes;An Heroku server;aaaaaaaaaaaaaaaaaaaaaaaaaaaaaaaaaaaaaaaaaaaaaaaaaaaaaaaaaaaaaaaaaaaaaaaaaaaaaaaaaaaaaaaaaaaaaaaaaaaaaaaaaaaaaaaaaaaaaaaaaaaaaaaaaaaaaaaaaaaaaaaaaaaaaaaaaaaaaaaa;null;22;0;0;Thu Apr 16 11:26:06 BST 2020;2;false;3607;en;Online school bad https://t.co/yba9gafVrM  #memes #meme #reddit #bot by @BotRedditMemes https://t.co/FWvL4SmH0o;true;false;true;Reddit Memes Bot;0;2020-04-29;
1856579359;1856579359;MiraiKuri;1st year High School Student;Kyōkai no Kanata | bloodline of Spirit World Warriors with blood-manipulation abilities | account Rolerplay | mention for follback | ENG & INA |  #B3STFAMS;null;61;42;6;Thu Sep 12 08:00:21 BST 2013;0;false;22906;en;There is nothing wrong with what I'm doing #bot;false;false;false;Mirai Kuriyama;0;2020-04-29;
3318323492;3318323492;bizideabot;Portland  OR;You can't just call Erotic _Random_Wikipedia_Topic_ a business plan... Hold on--I've got a tweetbot to write.;null;1448;3;36;Tue Aug 18 05:08:25 BST 2015;1;false;40915;en;Drunk Wikipedia is cheaper than average Dragon Ball Z #bot;true;false;true;Business Idea Bot;0;2020-04-29;
1739858965;1739858965;Rivaille_L;A place that not have bastard;#SnKRP | Lance Corporal of the Scouting Legion // Already change and put a ring on her ♡ @PetraRal___ ♡ never take off my shiny wedding ring with her ♡;null;125;158;7;Sat Sep 07 03:58:42 BST 2013;85;false;38277;en;has a perfect initiative and cleanliness  got 10 points from 1 to 10 #Info #Bot;true;false;true;Lipai Unyu :3;0;2020-04-29;
1184009989;1184009989;mlp__ButtonMash;Ponyville   Equestria;My name is button mash and i like video games! I live in ponyville with my mom dad and my brother. Also i dont have my cutie mark yet. (Roleplay Heavy EST);null;768;54;7;Thu Jan 01 01:00:00 GMT 1970;21;false;41532;en;What?! No! No! NOOOO! Sweetie Belle! [crying] Six hours wasted! #Bot;false;false;false;Button Mash;0;2020-04-29;
1916077987;1916077987;SplicedPsionic;null;@CodaTrained;http://www.twitlonger.com/show/n_1scncqi?new_post=true;1129;641;10;Sun Sep 29 04:33:37 BST 2013;1095;false;34675;en;"Luck? Never heard of it." #Grifter #Bot;false;false;false;Cole Cash;0;2020-04-29;
3297617749;3297617749;deepakagg89;Noida;Program Manager at Times Of India  Noida;null;20;32;0;Mon Jul 27 13:22:00 BST 2015;1;false;12;en;Our resolution to combat threats of COVID-19  and to ensure a safe and healthy environment. The digital event is scheduled to take place on June 30  2020 for Southeast Asia region audience. https://t.co/kCFRHkJVE5  @chatbotsmag @chatbooks #Marketing @Marketingland @TwitterMktg;true;false;true;Deepak Aggarwal;0;2020-04-29;
1599171666;1599171666;A_Lichtenau;DD / Germany;Senior Support Engineer @SAP || Photography & Travel addicted || Skywatcher || Sport;null;67;146;8;Tue Jul 16 21:19:20 BST 2013;2002;false;828;en;RT @SAPCAI: Great example of how to combine @SAPCAI and @SAP_RPA #bots to improve the employee experience! https://t.co/Uihs61JidL https://…;false;false;false;Andreas Lichtenau;0;2020-04-29;
492568289;492568289;DilaChuu;No  No mister dilachu no here;Just swimming through the sea of life. #HTTR || Video games || Sports || Anime || JOYCONBOIZFOREVER;null;2310;2426;30;Tue Feb 14 21:34:39 GMT 2012;60747;false;225222;en;I have too many bot tweets. #Bot;false;false;false;🧡~Tempesta~🖤;0;2020-04-29;
1941537794;1941537794;YGOTASQuotes_;Screwing the rules!;Just an average page supporting an abridged fandom... NOT!! -Admined by @ThugTrombonist-;http://YuGiOhAndStuff.Weebly.com;44;17;7;Sun Oct 06 18:19:08 BST 2013;0;false;70975;en;SCREW THE RULES  I HAVE MONEY! #Bot;true;false;true;YGOTAS Quotes;0;2020-04-29;
2287579710;2287579710;LilBitchChan;Sakamaki Manor;- Don't call me chichinashi ! I have a name  its Komori Yui. And most of all  I am Nobodys Prey ! -  {Open RP  Slow DM Replies} #RP #DiabolikLovers;null;131;26;4;Sun Jan 12 03:51:31 GMT 2014;2;false;18066;en;"I will never submit to you."#bot;false;false;false;Yui Komori;0;2020-04-29;
2157917360;2157917360;JuliTheMonster;null;I have the ability to turn myself into a monster. so BEWARE ! i might kill you whenever i want to.;null;149;51;5;Sun Oct 27 02:29:49 GMT 2013;4;false;45250;en;Have A nice Day EVERYONE! #Bot;false;false;false;Juli Sieben;0;2020-04-29;
2196971280;2196971280;HetaRPNews;THE WILD;Get your hot fresh Hetalia memes here! Pasta  gay countries  and lots of laughs.                                                       ▷ Follow @ahetaliabot!;http://ask.fm/HetaRPNews;1428;563;8;Sat Nov 16 02:36:28 GMT 2013;591;false;43092;en;Kat is... disturbing  yet charming.  #Bot;false;false;false;NARRATOR;0;2020-04-29;
888051779199479808;888051779199479808;Quantu_MX;Mexico City;[BETA] https://t.co/knjF6HhsVg is a #robo #advisor for day #trading #robots or #investment #portfolios using #deeplearning on #bitcoin  is free. Tips https://t.co/KHYwFDPRCL :);https://quantu.mx;329;1394;6;Thu Jul 20 16:03:38 BST 2017;155;false;37651;en;[BETA] 📈 The bot WOLFIE has earned a total of $154.59 USD SELL $BTC.X on 2020-04-29T09:09:36.486Z with pair $BTCUSD in 1157 performed trades with 1 BTC invested since the beginning. More info at https://t.co/Pzba5SyZSh #bitcoin #ai #bot #trading;true;false;true;QuantumX;0;2020-04-29;
1221811184741036032;1221811184741036032;webtermsbot;Somwhere on AWS EC2;Beep  boop... I'm small Python based bot for collecting interesting Tweets for most used web dev/design terms. Educational purpose only.;https://github.com/idzan/twitter-retweet-like-bot;529;221;10;Mon Jan 27 15:05:20 GMT 2020;41304;false;125757;en;RT @mc_oleh: Has anyone done this yet?  #programming #programmer #developer #coder #coding #code #movie #Hacker #Hacking #development #php…;true;false;true;Web Terms Botnet in Python;0;2020-04-29;
1099705758751563778;1099705758751563778;HopePM4;Frontline;null;null;459;887;1;Sun Feb 24 16:20:59 GMT 2019;14050;false;14581;en;@LBC Let me tell you how this is gonna go. There will be plenty of LBC #bots posting offensive comments from 'Left leaning' accounts. Then cue the rest saying  'oh look. A gentler politics..the rabid left' etc.;false;false;false;TheMasses;0;2020-04-29;
3040871649;3040871649;hubofml;Germany ;Every month  I send out a newsletter containing lots of exciting stuff on data science and machine learning. Subscribe here 👉http://hubofml.com/newsletter;https://hubofml.com;3318;11;79;Mon Feb 16 15:33:55 GMT 2015;23976;false;145727;en;RT @mc_oleh: Has anyone done this yet?  #programming #programmer #developer #coder #coding #code #movie #Hacker #Hacking #development #php…;false;false;false;HubofMachineLearning;0;2020-04-29;
831031542424150016;831031542424150016;mameasmah;Accra  Ghana;null;http://www.npontu.com;33;184;0;Mon Feb 13 06:45:34 GMT 2017;270;false;284;en;RT @Npontu: What is your checklist for an ideal engagement platform? #AI #bigdata #bulksms #IOT #artificialintelligence #data #ussd #Cloudc…;true;false;true;Deborah Asmah;0;2020-04-29;
1250732095141543937;1250732095141543937;BotRedditMemes;An Heroku server;aaaaaaaaaaaaaaaaaaaaaaaaaaaaaaaaaaaaaaaaaaaaaaaaaaaaaaaaaaaaaaaaaaaaaaaaaaaaaaaaaaaaaaaaaaaaaaaaaaaaaaaaaaaaaaaaaaaaaaaaaaaaaaaaaaaaaaaaaaaaaaaaaaaaaaaaaaaaaaaa;null;22;0;0;Thu Apr 16 11:26:06 BST 2020;2;false;3608;en;Me irl https://t.co/Ej0oGhQIL6  #memes #meme #reddit #bot #meirl by @BotRedditMemes https://t.co/jmoZ4VgYcu;true;false;true;Reddit Memes Bot;0;2020-04-29;
313304999;313304999;dndud49;null;Leah Sibleyel/Mabinogi/28/음악/일상/정치 종교 사회=차단/카톨릭 제외/맞팔=제 기준/인장:가토님/소녀전선/불편하시다면 언팔을/도검난무/미다레 고코타이 AUG/ #선혈서가의_자작시 /잠시나마 즐거웠다면 내가 피눈물 흘려도 행복했던거야/아이돌 코덕 지뢰;http://blog.naver.com/dndud49;309;180;17;Wed Jun 08 14:13:15 BST 2011;14871;false;85431;en;We will find a way. We always have. #bot;false;false;false;어그파밍 종료 선혈서가;0;2020-04-29;
2465314423;2465314423;outlast_Father;マウントマッシブ精神病院;outlastに登場する神父「マーティン・アルシャンボー」のbotです。【非公式なりきり入り】【別名あだ名：ふぁーざーまーしん】;null;15;2;5;Sun Apr 27 01:42:05 BST 2014;1;false;23135;en;our lord the Walrider  tearing His truth into the unbellevers. #bot;true;false;true;マーティン・アルシャンボー;0;2020-04-29;
117633536;117633536;Fishman_Dan;Sydney;Sports Photography  technology. Lover of all sports. Actively supporting amateur and community sporting organisations. Insta & FB: dcsportsphotography;http://www.dcsportsphoto.com.au;224;350;10;Fri Feb 26 03:50:37 GMT 2010;6724;false;12464;en;@pc_politically @AaronDodd This #bot is armed and dangerous.   Serious RWNJ history. No followers except more #bot accounts. Anti-WHO  pro-send kids to school .....  If you have doubts that the LNP are employing #trolls and #trollfarms  look no further. #auspol;false;false;false;Daniel Cohen;0;2020-04-29;
1251178122977751041;1251178122977751041;quotes3k;null;@ me to get a Quote. by @vishnumohan_rk API used: Forismatic;null;0;1;0;Fri Apr 17 16:58:22 BST 2020;9;false;366;en;Action may not always bring happiness  but there is no happiness without action. --Benjamin Disraeli #quotes #bot -3;true;false;true;quotes3k;0;2020-04-29;
2378441618;2378441618;TsundereMonstah;hhhjjj;LH — // sist  @iAliceB_ORP;null;169;171;7;Sat Mar 08 09:18:33 GMT 2014;67;false;38733;en;Caution! Tsundere is coming... #bot;false;false;false;【– Ryouko – 】[LH];0;2020-04-29;
888051779199479808;888051779199479808;Quantu_MX;Mexico City;[BETA] https://t.co/knjF6HhsVg is a #robo #advisor for day #trading #robots or #investment #portfolios using #deeplearning on #bitcoin  is free. Tips https://t.co/KHYwFDPRCL :);https://quantu.mx;329;1394;6;Thu Jul 20 16:03:38 BST 2017;155;false;37652;en;[BETA] 📈 The bot ANACOTTSTEEL has earned a total of $2 754.52 USD SELL $BTC.X on 2020-04-29T09:14:35.498Z with pair $BTCUSD in 1212 performed trades with 1 BTC invested since the beginning. More info at https://t.co/Pzba5SyZSh #bitcoin #ai #bot #trading;true;false;true;QuantumX;0;2020-04-29;
2340092438;2340092438;takumiusui_G;Under Construction;I'm Takumi || 17 Age || from Seika Highschool || Birthday April 27 || my height 186 cm ||;http://www.fanpop.com/clubs/takumi-usui-x-misaki-ayuzawa/articles/153832/title/takumis-biodata;119;32;12;Wed Feb 12 10:08:52 GMT 2014;37;false;94481;en;"The way the life of a disciple is a legacy and an estimate of the teacher" (Jiraiya)#Bot;false;false;false;Takumi Usui;0;2020-04-29;
1013177416108445703;1013177416108445703;botcide;Chicago  IL;Products  news and best practices for chatbot technology users and developers. No repeats & no BS. Website coming soon. #chatbots #chatbot #ai;https://botcide.com;392;561;11;Sat Jun 30 22:48:14 BST 2018;0;false;8613;en;The falsity of the chatbot vs live chat debate #customers #chatdebate #falsity #question #availability #chatbot via https://t.co/4U4cgEtDXu ☛ https://t.co/DM6EMx9a5s https://t.co/UMS5Wg0SHD;false;false;false;Botcide;0;2020-04-29;
1111406021224861696;1111406021224861696;GradientBot_;Space;Hourly randomly-generated gradient wallpapers.  Made with Raspberry Pi  HTML  CSS  jQuery  Node.js  Check out my sibling  @StripeyBot;https://imgur.com/a/TzcMhP6;3;1;0;Thu Mar 28 23:13:39 GMT 2019;2;false;2053;en;Full size: https://t.co/Oku9kNxbav  #gradient #gradients #wallpaper #bot #GradientBot https://t.co/E27MkbwCKa;true;false;true;GradientBot;0;2020-04-29;
2692752705;2692752705;PrincelyAirBot;null;Am the bot of the royal prince @TheAirHoarder;null;31;0;7;Wed Jul 09 23:12:10 BST 2014;0;false;98313;en;wIND WAKER IS MY LIFE. #bot;true;false;true;Sasher-bot;0;2020-04-29;
1125159106262618112;1125159106262618112;BellSailing;null;I retweet #voicefirst and Conversational AI news! [Synthetic] shoutouts to @VoiceTechCarl  @MemeRunner  @WomenInVoice and more! Account by @DainFitzgerald.;null;377;33;21;Sun May 05 23:03:30 BST 2019;63;false;22761;en;RT @VoiceTechCarl: Social Workers and AI: How New Voice Tech Can Save Lives https://t.co/94Y9JCRBjP  >> via @VoiceTechCarl >> #NLProc #ML #…;true;false;true;Ma Bell Isn't Home;0;2020-04-29;
2718802341;2718802341;UnervingJoltik;null;“Nice berry ya got there.” [Joltik/Gijinka|Single];null;303;179;7;Sun Jul 20 16:40:34 BST 2014;3;false;24765;en;"I'm sorry  but Electricity tastes good  and same with your finger." https://t.co/OxzAtPN4sp #Bot;true;false;true;Amy [H];0;2020-04-29;
2677862805;2677862805;Rosy_Heichler;null;Oh hello  care to take a seat? Just be careful  looks can be deceiving~ #Single #RP;null;107;65;6;Sun Jul 06 06:25:46 BST 2014;45;false;97088;en;"Hex  what's with you and slashing throats huh?" #Bot;false;false;false;Rosaline Hëichler;0;2020-04-29;
819075168;819075168;yowie_bot;In the land downunder;Curious? Just a prototype #AI bot doing some #IoT  #AI_analysis  #blockchain #energyTrading with #cactii_powerchain info.bot@yowie.org;https://bit.ly/2kBBCsK;183;23;31;Wed Sep 12 08:52:49 BST 2012;415;false;9747;en;📈 Power usage forecast: Billarga expected to use 17.1 kWh today  with 5 hours left today.   #IoT #bot https://t.co/TSrFazCpCy;false;false;false;yowie_bot;0;2020-04-29;
2413729134;2413729134;THInsight1;Israel;Public Speaker and Expert on Social Media and B2B Marketing. Lead Generation  Startup Creation  Startup Investment #LinkedIn #Twitter #B2B #Mentoring #Campaigns;http://www.th-insight.com;1666;1375;29;Thu Mar 27 06:15:46 GMT 2014;13598;false;27441;en;RT @iulian_neagoe: 10 Most Interesting Chatbots in the World #Chatbots #chatbot via https://t.co/muiUX03Tsp https://t.co/WJfAPiTu1z;true;false;true;The Huberman Insight;0;2020-04-29;
1250732095141543937;1250732095141543937;BotRedditMemes;An Heroku server;aaaaaaaaaaaaaaaaaaaaaaaaaaaaaaaaaaaaaaaaaaaaaaaaaaaaaaaaaaaaaaaaaaaaaaaaaaaaaaaaaaaaaaaaaaaaaaaaaaaaaaaaaaaaaaaaaaaaaaaaaaaaaaaaaaaaaaaaaaaaaaaaaaaaaaaaaaaaaaaa;null;22;0;0;Thu Apr 16 11:26:06 BST 2020;2;false;3609;en;Da Laydeez Luv Mey https://t.co/rnm2mkiaXe  #memes #meme #reddit #bot #dankmemes by @BotRedditMemes https://t.co/lLxgH9SaZI;true;false;true;Reddit Memes Bot;0;2020-04-29;
2593935008;2593935008;JaakkoTheRipper;null;Hey Guys an girls go follow @BelowTheButler and @YoullLoveIt;null;175;190;7;Sun Jun 29 01:47:37 BST 2014;732;false;105215;en;Life is what happens to you while you're busy making other plans. #Bot;false;false;false;;0;2020-04-29;
2598003565;2598003565;xZaynJM__;England;So lazy to write something in here . . .;http://www.onedirection.com;14;8;6;Tue Jul 01 14:17:30 BST 2014;1;false;20170;en;So-- How's life ? #bot;true;false;true;Zayn Malik;0;2020-04-29;
586430080;586430080;NeiroRitsu_AR;In Neiro and Ritsu's ♥ ;Yomi Taka !! Alfred Jones !! Roronoa Zoro !! ♡;null;104;52;7;Mon May 21 11:17:36 BST 2012;7;false;56584;en;Sorry  my master is not here. he was busy. leave mention  if you want to talk to him. I will say to my master later~ #bot;false;false;false;Neiro or Ritsu;0;2020-04-29;
625501257;625501257;iCedric_Diggory;Hogwart;RP Account of Cedric Diggory from Harry Potter :);null;249;32;12;Tue Jul 03 10:41:17 BST 2012;0;false;132500;en;Hufflepuffs finder is Helga Hufflepuffs #Hufflepuffs #bot;true;false;true;Cedric Diggory;0;2020-04-29;
628131644;628131644;Saane_bot;ｐｃです。;私のbotアカウンートとbotアカウンートじゃない。私はRCLOID(Rimoconloid)の一部です。(languages) 英語(English)と日本語(japan) おＫ。;http://utau.wikia.com/wiki/Saane;86;32;7;Fri Jul 06 08:07:55 BST 2012;1;false;99614;en;My self is based from my author :< #bot;true;false;true;サア音;0;2020-04-29;
612462220;612462220;Leviathan_U;null;@Princess_Toph Maid;null;79;61;4;Tue Jun 19 11:46:19 BST 2012;6;false;31035;en;Go Follow Chrome_Offical   blog : https://t.co/ubKXQPKWCU (Katekyo Hitman Reborn) #bot;false;false;false;Leviathan;0;2020-04-29;
753761641;753761641;garry_blue_rose;Weiss Guertena's Museum;[RP] Hi there  I'm Garry. I hate trapped in the Fabricated World  but I made it because of you  Ib. #single;null;78;40;7;Sun Aug 12 21:49:14 BST 2012;5;false;67122;en;"Check the pocket of my coat  you'll find a candy. You can keep it" #bot;true;false;true;Prince of Blue Rose;0;2020-04-29;
841183980;841183980;_DemonCatherine;Anywhere~;I suppose my name is Catherine. Be careful  I'm no ordinary girl. I suppose you'll see the truth of what I am sooner or later~! #Catherine [RP Pure 18+];null;688;98;0;Sun Sep 23 08:09:11 BST 2012;0;false;96076;en;It's more fun when someone watches..~ #Bot;false;false;false;Catherine [Succubus];0;2020-04-29;
731498500773543936;731498500773543936;superclipartbot;Japan;the best clipart bot in the world  using the best clipart from http://www.irasutoya.com/;http://cheapbotsdonequick.com/source/superclipartbot;33;0;51;Sat May 14 15:56:47 BST 2016;2;false;27656;en;Untitled 324 by Advanced AI Art Bot™ #bot #art https://t.co/0H72SyXwHO;true;false;true;Super Clipart Bot™;0;2020-04-29;
