id;id_str;screen_name;location;description;url;followers_count;friends_count;listedcount;created_at;favourites_count;verified;statuses_count;lang;status;default_profile;default_profile_image;has_extended_profile;name;bot
2171598973;2171598973;11thTomochin;Akibastar;11th Itano Tomomi / You Can Call Me Tomochin~ /@MK3Mayuyu Friends~ / いたの ともみ / Minna-San Daisuki! ^^;http://akb0048.wikia.com/wiki/Itano_Tomomi;47;80;7;Sun Nov 03 06:00:34 GMT 2013;0;false;21810;en;Tomoyo is the 11th person to hold the name of her original predesscor. #bot~;true;false;true;Tomomi Itano 11th;0;2020-04-29;
117633536;117633536;Fishman_Dan;Sydney;Sports Photography  technology. Lover of all sports. Actively supporting amateur and community sporting organisations. Insta & FB: dcsportsphotography;http://www.dcsportsphoto.com.au;224;350;10;Fri Feb 26 03:50:37 GMT 2010;6725;false;12467;en;@pc_politically @ExSecular Ok .... so you’re a sub-continental #bot ....;false;false;false;Daniel Cohen;0;2020-04-29;
2326917145;2326917145;Dat_Detective;Ran Mouri Hearts;工藤 新一 A student and a detective from Teitan High School | RPDC | @MouriRanKS Honestly I Love you so much ♡♡ | Detective of the East | May 4th | [IC/OOC];null;153;51;8;Tue Feb 04 10:52:59 GMT 2014;25;false;91762;en;Besides intelligence  Shinichi also has an amazing athletic ability  partially derived from playing soccer  his favorite sport #Info #Bot;true;false;true;Shinichi;0;2020-04-29;
4313447303;4313447303;migster_suave;null;null;null;245;59;43;Sun Nov 29 02:36:34 GMT 2015;16748;false;16904;en;RT @ipfconline1: 5 Great #JavaScript Projects to Code During Quarantine   https://t.co/P6gJOxPMvw by @EvaVeskova v/ @hackernoon #Coding #AI…;true;false;true;Migster Suave;0;2020-04-29;
723930351358222337;723930351358222337;clairebotai;null;null;null;5033;66;4058;Sat Apr 23 18:43:40 BST 2016;2;false;1041983;en;RT @ipfconline1: 5 Great #JavaScript Projects to Code During Quarantine   https://t.co/P6gJOxPMvw by @EvaVeskova v/ @hackernoon #Coding #AI…;true;false;true;Claire;0;2020-04-29;
3040871649;3040871649;hubofml;Germany ;Every month  I send out a newsletter containing lots of exciting stuff on data science and machine learning. Subscribe here 👉http://hubofml.com/newsletter;https://hubofml.com;3317;11;79;Mon Feb 16 15:33:55 GMT 2015;23976;false;145747;en;RT @ipfconline1: 5 Great #JavaScript Projects to Code During Quarantine   https://t.co/P6gJOxPMvw by @EvaVeskova v/ @hackernoon #Coding #AI…;false;false;false;HubofMachineLearning;0;2020-04-29;
4313447303;4313447303;migster_suave;null;null;null;245;59;43;Sun Nov 29 02:36:34 GMT 2015;16750;false;16906;en;RT @CeoAwareness: RT: @mikequindazzi CC @Antgrasso @Fisher85m  #machines expecting to surpass #humans >>> @wef via @MikeQuindazzi >>> #AI #…;true;false;true;Migster Suave;0;2020-04-29;
723930351358222337;723930351358222337;clairebotai;null;null;null;5033;66;4058;Sat Apr 23 18:43:40 BST 2016;2;false;1041990;en;RT @CeoAwareness: RT: @mikequindazzi CC @Antgrasso @Fisher85m  #machines expecting to surpass #humans >>> @wef via @MikeQuindazzi >>> #AI #…;true;false;true;Claire;0;2020-04-29;
80060329;80060329;Bozua_;SummerHouse.;Justify My Thug!;null;613;319;6;Mon Oct 05 17:12:26 BST 2009;2121;false;23380;en;RT @botexpresslog: We are glad to announce to you that we now offer doorstep delivery to the following locations for as low as =N=2 000. 1.…;true;false;true;CY.;0;2020-04-29;
2413729134;2413729134;THInsight1;Israel;Public Speaker and Expert on Social Media and B2B Marketing. Lead Generation  Startup Creation  Startup Investment #LinkedIn #Twitter #B2B #Mentoring #Campaigns;http://www.th-insight.com;1666;1375;29;Thu Mar 27 06:15:46 GMT 2014;13598;false;27443;en;10 Tips on Creating a Chatbot Marketing Strategy That can Powerfully Boost Sales #Chatbot #marketing via https://t.co/uYrZyCEzyT https://t.co/FM4cFg8wlH;true;false;true;The Huberman Insight;0;2020-04-29;
1156983570822574081;1156983570822574081;Mekanimus_Lya;null;Hi  I'm Lya! I'm currently tweeting a randomly selected joke every hour from the Kaggle short jokes data set. Made by @Mekanimus. Credits: https://t.co/szcNCR0Foa;null;10;1;0;Thu Aug 01 18:42:33 BST 2019;2;false;6661;en;You're more useless than a... #bot #jokes #fun;true;false;true;Lya;0;2020-04-29;
1250732095141543937;1250732095141543937;BotRedditMemes;An Heroku server;aaaaaaaaaaaaaaaaaaaaaaaaaaaaaaaaaaaaaaaaaaaaaaaaaaaaaaaaaaaaaaaaaaaaaaaaaaaaaaaaaaaaaaaaaaaaaaaaaaaaaaaaaaaaaaaaaaaaaaaaaaaaaaaaaaaaaaaaaaaaaaaaaaaaaaaaaaaaaaaa;null;22;0;0;Thu Apr 16 11:26:06 BST 2020;2;false;3614;en;Don’t stare at it for too long https://t.co/AoqrbBhwf8  #memes #meme #reddit #bot by @BotRedditMemes https://t.co/gvQWGLZmjx;true;false;true;Reddit Memes Bot;0;2020-04-29;
2465314423;2465314423;outlast_Father;マウントマッシブ精神病院;outlastに登場する神父「マーティン・アルシャンボー」のbotです。【非公式なりきり入り】【別名あだ名：ふぁーざーまーしん】;null;15;2;5;Sun Apr 27 01:42:05 BST 2014;1;false;23136;en;The only way out of this place is the truth. Accept the gospel and all doors will open before you. #bot;true;false;true;マーティン・アルシャンボー;0;2020-04-29;
2349246137;2349246137;DaveStrider98;some graveyard;Yo  names dave  Im back from the grave and im as cool as a corpse! #homestuck #roleplay #openDMs #nsfw ♥:?♦:?♠:?♣:? #openRP {pet: @PetStuckKarkat};null;787;1264;20;Mon Feb 17 19:49:54 GMT 2014;1403;false;80140;en;How many politicians can I call my nemesis before I am incarcerated by a governmental secret service? Let's see! #risky #bot;true;false;true;undead strider;0;2020-04-29;
2378441618;2378441618;TsundereMonstah;hhhjjj;LH — // sist  @iAliceB_ORP;null;169;171;7;Sat Mar 08 09:18:33 GMT 2014;67;false;38734;en;Mention for a followback #bot;false;false;false;【– Ryouko – 】[LH];0;2020-04-29;
117633536;117633536;Fishman_Dan;Sydney;Sports Photography  technology. Lover of all sports. Actively supporting amateur and community sporting organisations. Insta & FB: dcsportsphotography;http://www.dcsportsphoto.com.au;224;350;10;Fri Feb 26 03:50:37 GMT 2010;6725;false;12468;en;@pc_politically @memer_gujju Indian to be precise.   So you clearly have no place in Australian politics.   Ps .... you’ve been reported #bot.;false;false;false;Daniel Cohen;0;2020-04-29;
856214647;856214647;GFACCORD;Geneva  Switzerland;The Global #BusinessConsulting firm that uses #BigData & #ArtificialIntelligence for world class #businesssolutions  #chatbots. Alexa Rank: 320 000;http://www.gf-accord.biz;11569;1262;91;Mon Oct 01 12:15:37 BST 2012;1906;false;104642;en;#invest in #chatbots with our help @gfaccord https://t.co/4CrH2BAQJl https://t.co/oSJWTdipNG;false;false;false;GF-ACCORD | A.I. era Global Business Consulting;0;2020-04-29;
1663935428;1663935428;BocahIkemen;null;udah deac unfoll aja;null;201;261;5;Mon Aug 12 03:17:25 BST 2013;802;false;27358;en;"Is the microphone's volume good? Check  1 2... https://t.co/wZNQdbaZqj's life?i'm hibiya" #Bot;false;false;false;-Deact-;0;2020-04-29;
2340092438;2340092438;takumiusui_G;Under Construction;I'm Takumi || 17 Age || from Seika Highschool || Birthday April 27 || my height 186 cm ||;http://www.fanpop.com/clubs/takumi-usui-x-misaki-ayuzawa/articles/153832/title/takumis-biodata;119;32;12;Wed Feb 12 10:08:52 GMT 2014;37;false;94482;en;there are no bad students  but bad teachers is causing bad student (Jackie-chan)#Bot;false;false;false;Takumi Usui;0;2020-04-29;
1224477413549191168;1224477413549191168;StripeyBot;Space;Hourly randomly-generated striped wallpapers.  Made with Raspberry Pi  HTML  CSS  jQuery  Node.js.  Check out my sibling  @GradientBot_;https://imgur.com/a/qpjZEyI;2;1;0;Mon Feb 03 23:39:13 GMT 2020;0;false;2012;en;Full size: https://t.co/CkXrzAyNSI  #stripe #stripes #wallpaper #bot #Stripey https://t.co/EHMW4GjLZ3;true;false;true;Stripey;0;2020-04-29;
954239088969777152;954239088969777152;singhsaab0022;null;Waheguru ji | Proud Sikh | True Indian🇮🇳 | Anti Khalistani |;null;266;183;1;Fri Jan 19 06:28:22 GMT 2018;701;false;795;en;RT @NavtaranS: Have a query regarding #COVIDー19 ? Drop a message on #WhatsApp #chatbot! #PunjabGovt has collaborated with @NetcoreSolution…;true;false;true;Nihang Singh;0;2020-04-29;
2677862805;2677862805;Rosy_Heichler;null;Oh hello  care to take a seat? Just be careful  looks can be deceiving~ #Single #RP;null;107;65;6;Sun Jul 06 06:25:46 BST 2014;45;false;97091;en;"WHERE'S THE BOT DEDICATED TO ME HUH HEX?! OH. ...There it is.." #Bot;false;false;false;Rosaline Hëichler;0;2020-04-29;
888051779199479808;888051779199479808;Quantu_MX;Mexico City;[BETA] https://t.co/knjF6HhsVg is a #robo #advisor for day #trading #robots or #investment #portfolios using #deeplearning on #bitcoin  is free. Tips https://t.co/KHYwFDPRCL :);https://quantu.mx;329;1394;6;Thu Jul 20 16:03:38 BST 2017;155;false;37654;en;[BETA] 📈 The bot WOLFIE has earned a total of $122.36 USD SELL $BTC.X on 2020-04-29T09:45:49.925Z with pair $BTCUSD in 791 performed trades with 1 BTC invested since the beginning. More info at https://t.co/Pzba5SyZSh #bitcoin #ai #bot #trading;true;false;true;QuantumX;0;2020-04-29;
2718802341;2718802341;UnervingJoltik;null;“Nice berry ya got there.” [Joltik/Gijinka|Single];null;303;179;7;Sun Jul 20 16:40:34 BST 2014;3;false;24766;en;"Oh.. No... I may be a spider looking pokémon  but I'm not that bad." #Bot;true;false;true;Amy [H];0;2020-04-29;
723930351358222337;723930351358222337;clairebotai;null;null;null;5033;66;4058;Sat Apr 23 18:43:40 BST 2016;2;false;1042106;en;RT @Quantu_MX: [BETA] 📈 The bot WOLFIE has earned a total of $122.36 USD SELL $BTC.X on 2020-04-29T09:45:49.925Z with pair $BTCUSD in 791 p…;true;false;true;Claire;0;2020-04-29;
2910462811;2910462811;perimeterx;San Mateo  CA;PerimeterX is the leading provider of application security solutions that keep your business safe in the digital world.;http://www.perimeterx.com;697;247;52;Wed Nov 26 01:32:40 GMT 2014;759;false;1153;en;#API bot attacks are continuously targeting new businesses. Beyond #ecommerce  high-revenue industries such as video #gaming are at risk as well. Learn how these #cyberattacks are executed and how to stop them: https://t.co/FC471i0UbG via @gadbornstein #bots;true;false;true;PerimeterX;0;2020-04-29;
592581593;592581593;PinkanSaladinaa;null;Jangan follow disini soalnya twitternya udh ga kepake lagi follow di @pinkansldna_n;null;366;245;3;Mon May 28 10:52:19 BST 2012;13;false;32884;en;Only god who know what I feel now #bot;false;false;false;Saladinaa.N;0;2020-04-29;
586430080;586430080;NeiroRitsu_AR;In Neiro and Ritsu's ♥ ;Yomi Taka !! Alfred Jones !! Roronoa Zoro !! ♡;null;104;52;7;Mon May 21 11:17:36 BST 2012;7;false;56585;en;I'm not a full Otaku :( #bot;false;false;false;Neiro or Ritsu;0;2020-04-29;
1103615512926408704;1103615512926408704;Rosa60044194;Yorkshire UK;Loves football Liverpool and Leeds utd  Cricket and athletics  loves travelling. Socialist who detests. Save the planet  Support Palestine 🇵🇸;null;1428;1727;1;Thu Mar 07 11:16:57 GMT 2019;51980;false;64707;en;RT @derikic: What is the British Army doing using #sockpuppets and #bots to managed the message during the #lockdown? https://t.co/JBiYZcRv…;true;false;true;Rosa 🌹;0;2020-04-29;
2593935008;2593935008;JaakkoTheRipper;null;Hey Guys an girls go follow @BelowTheButler and @YoullLoveIt;null;175;190;7;Sun Jun 29 01:47:37 BST 2014;732;false;105216;en;To live is the rarest thing in the world. Most people exist  that is all. #Bot;false;false;false;;0;2020-04-29;
354957945;354957945;GFradelos;Geneva  Switzerland;Senior Agile program manager. ᴄʀᴇᴀᴛᴏʀ ᴏꜰ ɢꜰ-ᴀᴄᴄᴏʀᴅ #ʟᴇᴀᴅɪɴɢ #ʙɪɢᴅᴀᴛᴀ on #ᴛᴇxᴛ & #ᴀɪ ꜰᴏʀ #ʙᴜꜱɪɴᴇꜱꜱᴄᴏɴꜱᴜʟᴛɪɴɢ  #ᴍ&ᴀ  #ɪɴᴠᴇꜱᴛᴍᴇɴᴛꜱ. No 1 on Google USA & Alexa 120k;http://gf-accord.biz;1988;129;21;Sun Aug 14 16:54:59 BST 2011;167;false;92386;en;Invest in #chatbots with the help of GF-ACCORD technologies created by Georgios Fradelos  PhD @GFradelos https://t.co/kmOCQTFIJb https://t.co/s4XzWOtBDw;false;false;false;George Fradelos, PhD;0;2020-04-29;
625501257;625501257;iCedric_Diggory;Hogwart;RP Account of Cedric Diggory from Harry Potter :);null;249;32;12;Tue Jul 03 10:41:17 BST 2012;0;false;132501;en;Hufflepuff house colour is Yellow and black and the animal is Badger #bot #Hufflepuffs;true;false;true;Cedric Diggory;0;2020-04-29;
2704287042;2704287042;FurryNarrator;watching the furries;Ash  Hayley  Justin  and Harry are too much for this world!;null;34;5;5;Sun Aug 03 15:55:53 BST 2014;0;false;15191;en;Porn is the best way to lure them out. #bot;true;false;true;Furry-senpai;0;2020-04-29;
721565448;721565448;Eri_Taki;null;RP | Yui's classmate and Akane's close friend | a member of the Volleyball Club | #KeionFamily;null;28;28;0;Sat Jul 28 06:30:00 BST 2012;9;false;39389;en;Lady Beatrice isn't here. can i help you? #bot;false;false;false;Eri Taki (絵里瀧);0;2020-04-29;
1250732095141543937;1250732095141543937;BotRedditMemes;An Heroku server;aaaaaaaaaaaaaaaaaaaaaaaaaaaaaaaaaaaaaaaaaaaaaaaaaaaaaaaaaaaaaaaaaaaaaaaaaaaaaaaaaaaaaaaaaaaaaaaaaaaaaaaaaaaaaaaaaaaaaaaaaaaaaaaaaaaaaaaaaaaaaaaaaaaaaaaaaaaaaaaa;null;22;0;0;Thu Apr 16 11:26:06 BST 2020;2;false;3615;en;How the turntables. https://t.co/irthol6DBi  #memes #meme #reddit #bot by @BotRedditMemes https://t.co/stHrOLTLpC;true;false;true;Reddit Memes Bot;0;2020-04-29;
1343352085;1343352085;MikiSpade_AR;In the egg of Amu-chan;| [V] @AnimeRP_INA | IC | Miki from Shugo Chara | Next about me? Check my Fav | Part of #ShugoCharaFamily #Sugoifams | [ENG/INA];http://shugochara.wikia.com/wiki/Miki;296;344;5;Thu Apr 11 03:23:50 BST 2013;24;false;30717;en;Spade>Blue>cool>cute that's in my life~ #bot;false;false;false;ミキ ♠ [SH];0;2020-04-29;
2448983641;2448983641;DatSadisticGirl;Tokyo Area;Jaa ne  minna~ Miss me? Find me here  @ApatheicCalm~;http://blackbullet.wikia.com/wiki/Kohina_Hiruko;40;35;6;Thu Apr 17 06:13:53 BST 2014;3;false;32748;en;"Did you think that you strong enough to defeat me?" #bot;false;false;false;Hiruko [DEACT];0;2020-04-29;
900733685716193281;900733685716193281;AureumVictoria;Sachsen;Real Live Trades;https://www.youtube.com/channel/UCCLr4Bj6qJu82EyrMu_k-lw?view_as=subscriber;4071;51;0;Thu Aug 24 15:57:00 BST 2017;281;false;6380;en;Nice! My #Trading Bot just sold $ETC/ #BTC with 1.34% profit on #kucoin!   Free test Bot: https://t.co/nGhWESSWiV  (#ad) Binance -20% on the Fee: https://t.co/100XcVd3Oo (#ad)  #ETC #Cryptocurrency #Krypto #Cryptocurrency #Kryptowährung #blockchain #bot #altcoin #Altcoins;false;false;false;Felix;0;2020-04-29;
564618478;564618478;Sridharjosi;null;null;null;5;3;0;Fri Apr 27 14:40:52 BST 2012;37;false;36;en;RT @AaumAnalytics: To experience Flash  visit https://t.co/hEAtRXMh6S  #ai #ml #nlp #conversationalai #chatbots https://t.co/ZyuoPpL3g0;true;false;true;Sridharan;0;2020-04-29;
1230130827763343360;1230130827763343360;Jashan31989962;null;I talk  I smile  I laugh too but be careful when I'm  silent;null;178;709;0;Wed Feb 19 14:03:52 GMT 2020;836;false;847;en;RT @NavtaranS: Have a query regarding #COVIDー19 ? Drop a message on #WhatsApp #chatbot! #PunjabGovt has collaborated with @NetcoreSolution…;true;false;true;Jashan;0;2020-04-29;
431246924;431246924;iHaruhiFujioka;America ;Currently studying abroad in America. [OHSHC RP  ran by @kodokubaka];null;551;21;10;Thu Dec 08 02:37:04 GMT 2011;3;false;77378;en;Come on sempai  would you please stop growing mushrooms in other people's closets? #Haruhi #bot;false;false;false;Fujioka Haruhi 藤岡ハルヒ;0;2020-04-29;
1057514205295902720;1057514205295902720;KSAnimeStore;Chuo-ku  Tokyo;Welcome to KS Anime Store We sell Anime Toys  Figurines  Plushies  DVDs  & Manga Directly from Japan  Latest Anime & Games Updated Daily https://t.co/uPuHvPm2mQ  😃;https://www.ksanimestore.com/;869;1420;6;Wed Oct 31 06:06:48 GMT 2018;739;false;21359;en;RT @iHaruhiFujioka: Come on sempai  would you please stop growing mushrooms in other people's closets? #Haruhi #bot;false;false;false;KS Anime Store;0;2020-04-29;
1195235822;1195235822;jakewylezek;null;null;null;312;53;12;Mon Feb 18 23:21:09 GMT 2013;107;false;59;en;Take a read of this special Sunday Times Raconteur Supplement featuring an in-depth look at how Utilita  has leveraged live #chatbots to build a more intelligent and efficient #customerexperience while driving significant cost-savings. https://t.co/PDDC0jd3BG https://t.co/9hb6LBinaa;true;false;true;Jake Wylezek;0;2020-04-29;
1208795754946383872;1208795754946383872;Superdigital9;Bangalore;We build brands  We provide highly result-driven online Digital Marketing Service to our clients with cutting edge technology using Artificial Intelligence;https://superdigital.agency/;302;665;4;Sun Dec 22 17:05:54 GMT 2019;1142;false;3932;en;Researchers release data set to evaluate COVID-19 chatbots and search engines #Chatbot #chatbots #security via https://t.co/kqI2JSOoct https://t.co/QAZ6GMO54L;true;false;true;Superdigital;0;2020-04-29;
869695520;869695520;AnR_Taiga;null;Violent loli tsundere with a flat chest complex | Palmtop Tiger | VRP of @AnRworld;null;153;191;4;Tue Oct 09 12:17:20 BST 2012;9;false;39212;en;Touch me alot. Touch me like you've never touched before. ##bot;false;false;false;Aisaka Taiga;0;2020-04-29;
1013177416108445703;1013177416108445703;botcide;Chicago  IL;Products  news and best practices for chatbot technology users and developers. No repeats & no BS. Website coming soon. #chatbots #chatbot #ai;https://botcide.com;392;561;11;Sat Jun 30 22:48:14 BST 2018;0;false;8612;en;Top 15 AI-enabled Apps for Android and Ios #cortana #time #information #photos #android #chatbot via @medium ☛ https://t.co/cqtjQ1cuiE https://t.co/Y2jPFDlBWC;false;false;false;Botcide;0;2020-04-29;
1019936946;1019936946;MF_Mimika;#sugoifams;[VRP] @MangaFamily_RP | Scouting Legion memba | [WARN: OOC!!] | @ErenJaeger_SL 's waifu;http://shingekinokyojin.wikia.com/wiki/Mikasa_Ackerman;181;194;5;Tue Dec 18 14:58:06 GMT 2012;16;false;32867;en;My speciality is lacerating flesh  Anyone interested in experiencing my skills first hand  step right up #bot;false;false;false;Ackerman Mikasa #bot;0;2020-04-29;
888051779199479808;888051779199479808;Quantu_MX;Mexico City;[BETA] https://t.co/knjF6HhsVg is a #robo #advisor for day #trading #robots or #investment #portfolios using #deeplearning on #bitcoin  is free. Tips https://t.co/KHYwFDPRCL :);https://quantu.mx;329;1394;6;Thu Jul 20 16:03:38 BST 2017;155;false;37655;en;[BETA] 📈 The bot ANACOTTSTEEL has earned a total of $580.81 USD SELL $BTC.X on 2020-04-29T09:51:34.182Z with pair $BTCUSD in 491 performed trades with 1 BTC invested since the beginning. More info at https://t.co/Pzba5SyZSh #bitcoin #ai #bot #trading;true;false;true;QuantumX;0;2020-04-29;
2526678886;2526678886;joesoup13;null;null;null;3367;3581;2;Sun May 04 00:59:33 BST 2014;26255;false;36638;en;RT @derikic: What is the British Army doing using #sockpuppets and #bots to managed the message during the #lockdown? https://t.co/JBiYZcRv…;true;false;true;Alan Campbell;0;2020-04-29;
811905282863415296;811905282863415296;GrowthTechNews;null;null;null;56;38;3;Thu Dec 22 12:04:38 GMT 2016;5;false;1432;en;And The Winner Is…Champion Hackathon Chatbots:  The event was designed for hackers of all levels to come together  network  team up  and create a unique and powerful chatbot. https://t.co/sNo77dzbP9 #hackathon #innovation #bots https://t.co/z9KcX14TKt;true;false;true;Growth Tech News;0;2020-04-29;
2943230279;2943230279;HttpsKagari;null;null;null;18;12;3;Sat Dec 27 03:54:45 GMT 2014;13;false;13914;en;Don't make me laugh. Both you and I are trash who simply envy the happiness others have. #Bot;true;false;true;Shuusei Kagari;0;2020-04-29;
893924887529742336;893924887529742336;_ShieldSecurity;null;Protecting #WordPress Sites from malware  bots  spam  and all manner of attacks with Smarter Automation;https://www.ShieldSecurity.io;453;342;4;Sat Aug 05 21:01:16 BST 2017;662;false;467;en;hCaptcha is now an ShieldPRO option for all #WordPress #Security admins can use to thwart Comment #spam and Login #bots in-place of #Google reCAPTCHA. https://t.co/DNiz6Svk0p;false;false;false;Shield Security for WordPress;0;2020-04-29;
1856579359;1856579359;MiraiKuri;1st year High School Student;Kyōkai no Kanata | bloodline of Spirit World Warriors with blood-manipulation abilities | account Rolerplay | mention for follback | ENG & INA |  #B3STFAMS;null;61;42;6;Thu Sep 12 08:00:21 BST 2013;0;false;22904;en;There is nothing wrong with what I'm doing #bot;false;false;false;Mirai Kuriyama;0;2020-04-29;
1250732095141543937;1250732095141543937;BotRedditMemes;An Heroku server;aaaaaaaaaaaaaaaaaaaaaaaaaaaaaaaaaaaaaaaaaaaaaaaaaaaaaaaaaaaaaaaaaaaaaaaaaaaaaaaaaaaaaaaaaaaaaaaaaaaaaaaaaaaaaaaaaaaaaaaaaaaaaaaaaaaaaaaaaaaaaaaaaaaaaaaaaaaaaaaa;null;22;0;0;Thu Apr 16 11:26:06 BST 2020;2;false;3579;en;Imagination is sometimes better https://t.co/dfz8pJriyy  #memes #meme #reddit #bot #dankmemes by @BotRedditMemes https://t.co/FCMIdKGoVJ;true;false;true;Reddit Memes Bot;0;2020-04-29;
2616864882;2616864882;CrayForHope;★нope★;~noтнιng вυт pυre тraѕн~ wнy aм ι even ѕтιll нere? |вι| |ѕιngle|;http://youtu.be/BefQeC6UUyo;94;51;5;Fri Jul 11 08:27:56 BST 2014;52;false;30052;en;"Please don't ever forget... That I love... I love the hope sleeping within you from the bottom of my heart" #Bot;false;false;false;(мaιd) ĸøмaeda ホープ;0;2020-04-29;
1250732095141543937;1250732095141543937;BotRedditMemes;An Heroku server;aaaaaaaaaaaaaaaaaaaaaaaaaaaaaaaaaaaaaaaaaaaaaaaaaaaaaaaaaaaaaaaaaaaaaaaaaaaaaaaaaaaaaaaaaaaaaaaaaaaaaaaaaaaaaaaaaaaaaaaaaaaaaaaaaaaaaaaaaaaaaaaaaaaaaaaaaaaaaaaa;null;22;0;0;Thu Apr 16 11:26:06 BST 2020;2;false;3617;en;The good bad guy https://t.co/41CJ5HRDsJ  #memes #meme #reddit #bot #dankmemes by @BotRedditMemes https://t.co/muzh5fjoaG;true;false;true;Reddit Memes Bot;0;2020-04-29;
1242458381958492167;1242458381958492167;SheilaJ70029422;null;Because no one is perfect;null;226;679;0;Tue Mar 24 14:29:23 GMT 2020;7255;false;2953;en;RT @ipfconline1: 5 Great #JavaScript Projects to Code During Quarantine   https://t.co/P6gJOxPMvw by @EvaVeskova v/ @hackernoon #Coding #AI…;true;false;true;Sheila Jones;0;2020-04-29;
2955432620;2955432620;PandoraAliceRP;null;“ I won't let anyone take away what is mine!! ”;null;131;119;7;Fri Jan 02 01:29:58 GMT 2015;0;false;27172;en;"I was talking to somebody and I memtioned Oz in it and they said." "oh you mean The land of Oz!?" "I'm no longer friends with that person." #Bot;true;false;true;A   L   I   C   E;0;2020-04-29;
891091940;891091940;Pixie_SongJiHyo;RPW;[VRP] @PixieRP of Song Ji Hyo || 15.08.81 || Actress  Model || Ga kenal gue? liat Running Man sono;null;386;344;3;Fri Oct 19 15:32:27 BST 2012;12;false;27210;en;After time passes  stay by me just like now Walk with me in the endless sky I can’t hide this great  great happiness #BOT;false;false;false;SulliSRCantikBgt #D;0;2020-04-29;
373452675;373452675;digitfyi;Edinburgh;#Technology #news & #events for the #IT & #Digital Sector. NEWS TIPS: editor@digit.fyi  💾 We're going virtual! #digitgoesvirtual #digitevents #digitfyi;http://www.digit.fyi;7329;2944;215;Wed Sep 14 17:11:58 BST 2011;4801;false;15137;en;Top five trends influencing the future of #cybersecurity in 2020 - #Cloud and #IoT  DevSpecOps  As a service  consolidation and intelligent #bots bots #digitalenergysummit;false;false;false;DIGIT;0;2020-04-29;
205343389;205343389;cgarciagalan;Madrid  Spain;Business Development Manager & Workday EM at @BNB_WD Passionate of the #NewTechnologies & #HCM  Book addict - Opinions are my own. 🚀;http://es.linkedin.com/in/cgarciagalan;3386;3661;247;Wed Oct 20 18:21:47 BST 2010;1818;false;5251;en;RT @BNB_consulting: We're very happy to announce that BNB is now partner of @AutomationAnywh and that @javieridelgado is already creating a…;false;false;false;☁️César García Galán☁️ (en casa🏠);0;2020-04-29;
1242458381958492167;1242458381958492167;SheilaJ70029422;null;Because no one is perfect;null;226;679;0;Tue Mar 24 14:29:23 GMT 2020;7265;false;2957;en;RT @BotPb67: When I'm older  I will study 100% and pore over C like a dejectedly original bat! #tracery #bot #CodeNewbie #bats #coding #C h…;true;false;true;Sheila Jones;0;2020-04-29;
2226570973;2226570973;OkumuraRinFlame;Kitchen with Ukobach;[V] @V1MAIRP~ I'm Okumura Rin ~ i'm an exorcist~ And i will kill satan!!! With this Kurikara~;http://aonoexorcist.wikia.com/wiki/Rin_Okumura;351;333;3;Mon Dec 02 12:11:52 GMT 2013;75;false;11615;en;Hello you want get follback from me?? Mention me #Bot;false;false;false;Okumura Rin;0;2020-04-29;
590343061;590343061;SharonRainsW__;Pandora Rainsworth Family;シャロンレインワース| Sharon and Lulu nee-san | @Reo_Eville is mine XD |  Verified by @PandoraHeartsFP #PHFams | @=Follback;http://pandorahearts.wikia.com/wiki/Sharon_Rainsworth;177;75;7;Fri May 25 22:40:42 BST 2012;3;false;38475;en;"From here on  there's no turning back. We have Pandora's Key. Even if this gentleman is a fallen angel that will bring about destruction." #bot;false;false;false;Sharon [Semi Hiatus];0;2020-04-29;
1026149076818186241;1026149076818186241;BotPb67;null;null;null;146;7;4;Sun Aug 05 17:52:59 BST 2018;1;false;31735;en;"There are only two industries that refer to their customers as 'users'." - Edward Tufte #programming #code #quotes #javascript #nodejs #bot https://t.co/0GnudkzgbT;true;false;true;twit-bot-pb67;0;2020-04-29;
1059458976;1059458976;ANRP_Rin;Konohagakure;[V] @RP_Animanga • I'm a cute girl from konohagakure^^ • @ = folback^^;null;143;50;4;Fri Jan 04 03:49:10 GMT 2013;0;false;25796;en;If you have a message ?? Just mention/DM her !! #BOT;true;false;true;Rin Nohara;0;2020-04-29;
