id;id_str;screen_name;location;description;url;followers_count;friends_count;listedcount;created_at;favourites_count;verified;statuses_count;lang;status;default_profile;default_profile_image;has_extended_profile;name;bot
1400097798;1400097798;Peacefull_Sleep;You don't need to know..;Just remember..I'm a human to..[RP][18+][Single][Gay];https://soundcloud.com/high-def/jeff-the-killer;934;271;7;Fri May 03 17:18:22 BST 2013;75;false;15788;en;You lied to me Mum..You lied #bot;false;false;false;Jeff;0;2020-04-28;
342635789;342635789;AmethystPrude;null;[ You can't get hurt without hurting someone else ] | IC? Still in process...;http://justpaste.it/AmethystPrude;981;590;11;Tue Jul 26 11:18:37 BST 2011;44;false;84017;en;"I don't like doing things only halfway. Even if it's hopeless  I want to at least try everything we can do to finish with no regrets" #bot;false;false;false;Gwen;0;2020-04-28;
984065221;984065221;YuiOtaku_;SAO;Yo minna !! Yui's here ! Yoroshiku ne~ Just call me Yui/Yui-chan| I ♥Anime~ | #Otaku #OtakuFamily #Jesuschild | Follback ? Mention !!;http://ask.fm/YuiOtaku_;241;168;9;Sun Dec 02 06:45:49 GMT 2012;4;false;53992;en;Kirito and Asuna found her in a forest in the 22nd floor of Aincrad #bot;false;false;false;Yui;0;2020-04-28;
796135065289945088;796135065289945088;igent_io;Rio de Janeiro  Brazil;Daily news and articles on #AI  #robotics  #IoT  #blockchain and #conversationalUI Managed by @HumbertoBAranha. Visit http://igent.io form more articles.;https://igent.io;1523;2172;53;Tue Nov 08 23:39:25 GMT 2016;77;false;24262;en;France launches AI voice assistant to help coronavirus patients #conversationalui #chatbot #voiceassistant  https://t.co/wu9iXKztZ9 https://t.co/LvElPGbRwZ;true;false;true;igent.io;0;2020-04-28;
1250732095141543937;1250732095141543937;BotRedditMemes;An Heroku server;aaaaaaaaaaaaaaaaaaaaaaaaaaaaaaaaaaaaaaaaaaaaaaaaaaaaaaaaaaaaaaaaaaaaaaaaaaaaaaaaaaaaaaaaaaaaaaaaaaaaaaaaaaaaaaaaaaaaaaaaaaaaaaaaaaaaaaaaaaaaaaaaaaaaaaaaaaaaaaaa;null;22;0;0;Thu Apr 16 11:26:06 BST 2020;2;false;3482;en;Walk away “friend” https://t.co/lotcc55Fmc  #memes #meme #reddit #bot #dankmemes by @BotRedditMemes https://t.co/Hs2IgQWGxh;true;false;true;Reddit Memes Bot;0;2020-04-28;
1522465867;1522465867;OnizuHime_;Kaimei High School;Yo!...Himeko 's here~ | Sket Dan | Pelollipop Candy | Hockey Stick | Dislikes Ghost| OOC | No Agency!;http://sketdance.wikia.com/wiki/Hime_Onizuka;53;36;5;Sun Jun 16 16:16:44 BST 2013;1;false;46514;en;Personality: Anyway  Himeko has a good heart and  like her companions of Sket-dan  is determined to do whatever it takes to help other people. #Bot.;false;false;false;Child! [H]ime;0;2020-04-28;
2441568883;2441568883;daviskris10;Paris  France (mostly);Was #Tech & #Innovation Director @ NYTimes Intl  Now Founder & CEO @ http://CinqC.co  Co-Founder @industai  #Google #DNI Assessor & Chair of US Board @HeroRATs.;http://www.cinqc.co;1586;2006;334;Sun Apr 13 12:11:49 BST 2014;13120;false;5664;en;It's big  it's more important than ever and it's free!  Bravo to @ejcnet for their Verification handbook  an essential for #journalists and #media on the frontlines of combating #misinformation #manipulation #fakenews #bots and #deepfakes;false;false;false;Kristen Davis;0;2020-04-28;
1142814180;1142814180;putriixoxo_;Seoul  South Korea;just a fan girl  who does not expect much from his idol \ m / . EXO ! SUPER JUNIOR ! K-POPERS '-')/ ! http://putriixoxo.tumblr.com  ! http://ask.fm/putriianaa;http://putriianaa25.blogspot.com;188;116;4;Sat Feb 02 16:22:22 GMT 2013;0;false;18735;en;we are EXO ! we are ONE ! \m/ #bot;false;false;false;사랑 슈퍼 주니어 ! 사랑 엑소 !;0;2020-04-28;
1530646920;1530646920;Anm_Kenpachi;Soul Society;Shinigami | Captain of 11th Division | Gotei 13 | Yachiru Kusajishi;http://bleach.wikia.com/wiki/Kenpachi_Zaraki;12;11;2;Wed Jun 19 13:11:09 BST 2013;0;false;26310;en;Kenpachi is a tall  muscular Shinigami with a wild and aggressive appearance #bot;true;false;true;Kenpachi Zaraki;0;2020-04-28;
1517514702;1517514702;OfficialRenton;Gekkostate;My name is Renton Thurston. The son of Adroc Thurston. Diane Thurston little brother. Partner of Eureka. Co-pilot of Nirvash TypeZERO. #RP;http://eurekaseven.wikia.com/wiki/Renton_Thurston;11;0;6;Fri Jun 14 21:40:57 BST 2013;0;false;116619;en;It's not nice to make an old man cry ! - Axel Thurston #Bot;false;false;false;Renton Thurston;0;2020-04-28;
2866404086;2866404086;AnonymousVampSP;South Park  Colorado;The best vamp ever existed  can't deny it. Call me Anon. || SPRP || Vamp Kid || Aro-Ace ||;null;305;198;4;Mon Oct 20 05:36:23 BST 2014;5;false;11749;en;I'm the Vamp that nobody acknowledges. Which is good because vampires shouldn't be noticed.  #Bot;false;false;false;Anonymous +INACTIVE+;0;2020-04-28;
4911171999;4911171999;OldDeutoronomy;null;I'm the jellicle leader of the jellicles and my sons: @RumTumTugger_  @VillainousTabby and @MysticJewelFury mate @GreyJellicle grandfather of @PlayfulKit;null;106;47;6;Mon Feb 15 00:57:42 GMT 2016;1;false;29234;en;*scratches his ear* #Bot;true;false;true;Old Deutoronomy;0;2020-04-28;
602534412;602534412;j_applepie;null;{rp account for Detectives-of-Night};null;12;4;8;Fri Jun 08 05:19:12 BST 2012;0;false;32801;en;Rex is a nice person. #bot;false;false;false;Jennifer P.;0;2020-04-28;
1567171141;1567171141;_NoelKreiss_;In The Past;My name is Noel Kreiss. I'm from the future where everyone is dead except me. I came back to the past to save everyone from that horrific future. [RP] #Taken;null;124;56;6;Thu Jul 04 03:37:38 BST 2013;86;false;34899;en;I come from the year 700 AF  I'm the last human being alive. #Bot;true;false;true;Noel Kreiss;0;2020-04-28;
1474981807;1474981807;h0rnet_jp;null;hahaha... fack  piaoker　 #hacker #cracker #hacked #geek #perl;null;30;1;5;Sat Jun 01 16:18:34 BST 2013;0;false;33816;en;fuck piaoker #bot #cracker;true;false;true;h0rnet;0;2020-04-28;
242999257;242999257;Deedee15644;USA;From Pittsburgh  PA;null;585;816;29;Wed Jan 26 02:20:30 GMT 2011;232920;false;62576;en;@Angeleno20201 @WSJ You have 0 followers #troll #bot you don't fly currently and have probably never been on a plane;false;false;false;Diana O;0;2020-04-28;
871145276391772161;871145276391772161;shorelifecrissy;null;Conservative/Trump supporter🇺🇸 Grateful 🙏🏻 Family ❤️ Country ❤️MAGA🇺🇸 Red 💊 Trump/Pence 2020;null;1086;969;13;Sun Jun 04 00:23:13 BST 2017;72407;false;20711;en;@TerenceMeehan3 @rosyjmc @CNNPolitics Yeah  you’re just a #Bot with 1 follower;true;false;true;Crissy;0;2020-04-28;
1612151798;1612151798;RAkabane_OZ;Walpurgis academy militery;{V}By @otakuZoneRp|my name is Raishin akabane you can call me raishin yoroshiku|i am a student in walpurgis academy|partner:Yaya;http://kikoshojowakizutsukanai.wikia.com/wiki/Raishin_Akabane;105;165;1;Mon Jul 22 07:05:57 BST 2013;0;false;9168;en;he not afraid to jump into any conflict or face any opponent if he knows that what they are doing is wrong or believes that what he is doing is right #bot;false;false;false;Raishin akabane;0;2020-04-28;
1664271667;1664271667;Bot_Of_Deviant;Messing shit up;This is the Demon King's bot! No  not Demise! Neikou! Tweeting random shit for your TL needs. Owner: @DeviantKing63;null;236;32;8;Mon Aug 12 06:38:42 BST 2013;0;false;107838;en;Do you hear that? That is my charisma bitchslapping you in the face. #Bot;false;false;false;King Neikou's Bot;0;2020-04-28;
809767860;809767860;avatark0rra;Republic City;I'm the avatar! You gotta deal with it!;null;557;202;7;Sat Sep 08 00:13:29 BST 2012;1353;false;29560;en;I'm the avatar  you gotta deal with it! #bot;false;false;false;Mrs. Beautiful.;0;2020-04-28;
1231514769418604546;1231514769418604546;PrntBot;The Aether;I am a bot  my job is to download and post a screenshot from http://prnt.sc every hour | Created by @CaptainReloadz;null;8;1;0;Sun Feb 23 09:43:04 GMT 2020;1;false;1273;en;This image was automatically downloaded from https://t.co/T8yNhYPD8D  if this image contains sensitive information please report it here: https://t.co/ZxlCoa67A6 #infosec #bot #screenshot https://t.co/gr0P47pAZR;true;false;true;PrntBot;0;2020-04-28;
1386477870;1386477870;JuliadiChody;Masamba;null;null;88;102;5;Sun Apr 28 09:55:35 BST 2013;3;false;55238;en;I cared not let things taken away from me .. so  if I'm not strong enough  that I kept just let me and my family #BOT;true;false;true;Juliadi Chody;0;2020-04-28;
126906455;126906455;lLenKagamine;#Sugoifams;Hello! #Len Here! ● This Len's roleplay acc from indonesia  let's be friend! ● HACKED;null;4371;196;6;Sat Mar 27 11:13:40 GMT 2010;108;false;21146;en;The Virtual singers Rin Kagamine and Len Kagamine are both voiced by Asami Shimoda. Giving them a wonderful  youthful voice. #bot;false;false;false;Len;0;2020-04-28;
1321562545;1321562545;RP_Vinyl;Ponyville  Equestria;Whats up everypony!? Im Vinyl Scratch otherwise known as DJ Pon3 the most wubtastic Dj in all of equestria! Now lets DROP THAT BASS! ( #Single  Roleplay Heavy );http://mlp.wikia.com/wiki/DJ_Pon-3;855;35;11;Tue Apr 02 03:04:31 BST 2013;44;false;40809;en;Awhhhhhhh Yeah!  #DJPON3 #Bot;false;false;false;Vinyl Scratch;0;2020-04-28;
62130267;62130267;ilivefortoday87;ÜT: 30.235238 -95.4847;null;null;26;66;0;Sat Aug 01 23:12:26 BST 2009;171;false;190;en;@PUBG @GoogleStadia #PUBG #PUBGxbox March 23  2017—April 28  2020... RIP 💀 #bots #boycott #boycottpubg (the bots killed the game);false;false;false;Christoph;0;2020-04-28;
1250732095141543937;1250732095141543937;BotRedditMemes;An Heroku server;aaaaaaaaaaaaaaaaaaaaaaaaaaaaaaaaaaaaaaaaaaaaaaaaaaaaaaaaaaaaaaaaaaaaaaaaaaaaaaaaaaaaaaaaaaaaaaaaaaaaaaaaaaaaaaaaaaaaaaaaaaaaaaaaaaaaaaaaaaaaaaaaaaaaaaaaaaaaaaaa;null;22;0;0;Thu Apr 16 11:26:06 BST 2020;2;false;3483;en;Everything irl is like Netflix adaptation https://t.co/FBWC9kvOq9  #memes #meme #reddit #bot by @BotRedditMemes https://t.co/Fkl52lN8LH;true;false;true;Reddit Memes Bot;0;2020-04-28;
1026149076818186241;1026149076818186241;BotPb67;null;null;null;146;7;4;Sun Aug 05 17:52:59 BST 2018;1;false;31718;en;"Debugging is twice as hard as writing the code in the first place.  Therefore  if you write the code as cleverly as possible  you are (by definition) not smart enough to debug it." - Brian Kernighan #programming #code #quotes #javascript #nodejs #bot https://t.co/kQFGlzbtWo;true;false;true;twit-bot-pb67;0;2020-04-28;
181963000;181963000;wiwer77;Algérie Oran;‏قال الإمام مالك رحمه الله :(لايصلح اخر هذه الأمة إلا بما صلح به أولها );https://medium.com/@wiwer77/has-recommended;1269;627;1833;Mon Aug 23 14:48:43 BST 2010;2196;false;29484;en;Production machine learning isn’t hard anymore by Caleb Kaiser #AI #IA #BigData  #Robots #Python #Chatbot #CyberSecurity #DataViz #DeepLearning #DataScience #Drone #JavaScript #Security #Iot #MachineLearning #Algorithm https://t.co/TZXQOHp5qF;false;false;false;salaf salih;0;2020-04-28;
888051779199479808;888051779199479808;Quantu_MX;Mexico City;[BETA] https://t.co/knjF6HhsVg is a #robo #advisor for day #trading #robots or #investment #portfolios using #deeplearning on #bitcoin  is free. Tips https://t.co/KHYwFDPRCL :);https://quantu.mx;328;1394;6;Thu Jul 20 16:03:38 BST 2017;155;false;37574;en;[BETA] 📈 The bot WOLFIE has earned a total of $1 743.2 USD SELL $BTC.X on 2020-04-28T22:37:34.429Z with pair $BTCUSD in 791 performed trades with 1 BTC invested since the beginning. More info at https://t.co/Pzba5SyZSh #bitcoin #ai #bot #trading;true;false;true;QuantumX;0;2020-04-28;
1236222056921878528;1236222056921878528;AltBot4;Altcampus;I retweet all about   #altcampus  #javascript   #codeNewbie;null;61;5;1;Sat Mar 07 09:28:35 GMT 2020;25492;false;32840;en;RT @wiwer77: Production machine learning isn’t hard anymore by Caleb Kaiser #AI #IA #BigData  #Robots #Python #Chatbot #CyberSecurity #Data…;true;false;true;AltBot 👽🤖👨🏻‍💻;0;2020-04-28;
1856579359;1856579359;MiraiKuri;1st year High School Student;Kyōkai no Kanata | bloodline of Spirit World Warriors with blood-manipulation abilities | account Rolerplay | mention for follback | ENG & INA |  #B3STFAMS;null;61;42;6;Thu Sep 12 08:00:21 BST 2013;0;false;22903;en;Mention for follback #bot;false;false;false;Mirai Kuriyama;0;2020-04-28;
323095391;323095391;falkenderp;Nichlstein  Odzwielg;Luise Falkenrath from Lunel Chronica. An Eon Electrical Engineering derp in Institute of Eikenheim.;null;23;19;8;Fri Jun 24 08:26:38 BST 2011;0;false;54829;en;This is Luise~! ♫ #bot;true;false;true;Luise Falkenrath;0;2020-04-28;
1184009989;1184009989;mlp__ButtonMash;Ponyville   Equestria;My name is button mash and i like video games! I live in ponyville with my mom dad and my brother. Also i dont have my cutie mark yet. (Roleplay Heavy EST);null;768;54;7;Thu Jan 01 01:00:00 GMT 1970;21;false;41523;en;Now you say you need Glowstone And want to mine it on your own Then to save you from the lava I fell in  I should have known #Bot;false;false;false;Button Mash;0;2020-04-28;
1916077987;1916077987;SplicedPsionic;null;@CodaTrained;http://www.twitlonger.com/show/n_1scncqi?new_post=true;1129;641;10;Sun Sep 29 04:33:37 BST 2013;1095;false;34670;en;"What can I say? I hate heights....and I might have impulse control issues" #Grifter #Bot;false;false;false;Cole Cash;0;2020-04-28;
2211931988;2211931988;MikuuHatsune_;null;Miku sudah mau deact :v siapa peduli? Kagak ada kan? Ya udah~;null;79;127;4;Sun Nov 24 05:27:52 GMT 2013;24;false;48004;en;Go back again and I want to say “I love you” #bot;true;false;true;Otewe Deact/?;0;2020-04-28;
492568289;492568289;DilaChuu;No  No mister dilachu no here;Just swimming through the sea of life. #HTTR || Video games || Sports || Anime || JOYCONBOIZFOREVER;null;2311;2425;30;Tue Feb 14 21:34:39 GMT 2012;60746;false;225199;en;Come're ya little shit. #Bot;false;false;false;🧡~Tempesta~🖤;0;2020-04-28;
2157917360;2157917360;JuliTheMonster;null;I have the ability to turn myself into a monster. so BEWARE ! i might kill you whenever i want to.;null;149;51;5;Sun Oct 27 02:29:49 GMT 2013;4;false;45242;en;I'm bored... And I DON'T LIKE IT! #Bot;false;false;false;Juli Sieben;0;2020-04-28;
2196971280;2196971280;HetaRPNews;THE WILD;Get your hot fresh Hetalia memes here! Pasta  gay countries  and lots of laughs.                                                       ▷ Follow @ahetaliabot!;http://ask.fm/HetaRPNews;1428;563;8;Sat Nov 16 02:36:28 GMT 2013;591;false;43087;en;If you listen very closely you can hear Erin and Julian whispering  "Ayyy" #Bot;false;false;false;NARRATOR;0;2020-04-28;
806418457;806418457;DaunKering_M;♥ BESIDE MINATO ♪  ˘`);kataomoi ~ eccedentesiast !;null;346;136;6;Thu Sep 06 10:14:03 BST 2012;387;false;29461;en;test #bot;false;false;false;Ui;0;2020-04-28;
2326917145;2326917145;Dat_Detective;Ran Mouri Hearts;工藤 新一 A student and a detective from Teitan High School | RPDC | @MouriRanKS Honestly I Love you so much ♡♡ | Detective of the East | May 4th | [IC/OOC];null;153;51;8;Tue Feb 04 10:52:59 GMT 2014;25;false;91742;en;he Is a very smart detective  he solves cases very decently and evenly take the time to find the clues #Info #Bot;true;false;true;Shinichi;0;2020-04-28;
3932832137;3932832137;choochbucket;New York;l make great popcorn. #FBR;null;443;602;0;Mon Oct 12 02:39:29 BST 2015;605;false;614;en;@tnwls4876 @JeffreyGuterman @realDonaldTrump #bot @itsJeffTiedrich seen a ton of these bots with your face.;true;false;true;🌊🇺🇸Lysol Injection🇺🇸🌊;0;2020-04-28;
307666357;307666357;RamdhanRMD;Bandung;Follow @KobemRMD IG : Bemz21 Path : KobemRMD@gmail.com LINE : RamdhanRMD WeChat : RamdhanRMD Pin BB 2102394A \m/;null;3191;1;5;Mon May 30 03:25:14 BST 2011;0;false;45248;en;God bless you all the time  ) #BOT;false;false;false;Ramdhan;0;2020-04-28;
1250732095141543937;1250732095141543937;BotRedditMemes;An Heroku server;aaaaaaaaaaaaaaaaaaaaaaaaaaaaaaaaaaaaaaaaaaaaaaaaaaaaaaaaaaaaaaaaaaaaaaaaaaaaaaaaaaaaaaaaaaaaaaaaaaaaaaaaaaaaaaaaaaaaaaaaaaaaaaaaaaaaaaaaaaaaaaaaaaaaaaaaaaaaaaaa;null;22;0;0;Thu Apr 16 11:26:06 BST 2020;2;false;3484;en;meirl https://t.co/BMcR7VvbzR  #memes #meme #reddit #bot #meirl by @BotRedditMemes https://t.co/RwTRjh38If;true;false;true;Reddit Memes Bot;0;2020-04-28;
2332565628;2332565628;ShuyaAragaki;Caduceus USA;[Trauma Center RP/MV] I'm the real brains of Caduceus. The rest of you are all idiots. // Bio: http://t.co/nyFBx2FTq6 // Assisted in the lab by @FallenZerach.;http://traumacentergame.wikia.com/wiki/Victor_Niguel;94;100;5;Fri Feb 07 23:52:36 GMT 2014;57;false;29158;en;"That virus is gonna pay for making a fool out of me!" #Bot;false;false;false;Victor Niguel;0;2020-04-28;
1156983570822574081;1156983570822574081;Mekanimus_Lya;null;Hi  I'm Lya! I'm currently tweeting a randomly selected joke every hour from the Kaggle short jokes data set. Made by @Mekanimus. Credits: https://t.co/szcNCR0Foa;null;10;1;0;Thu Aug 01 18:42:33 BST 2019;2;false;6650;en;Why can't Californians stop at stop signs? I don't know and this is not a laughing matter. #bot #jokes #fun;true;false;true;Lya;0;2020-04-28;
1203363413889449984;1203363413889449984;botosynthesis;Udaipur  India;Follow me for cool stuff related to #AI #Chatbots #RPA #Machinelearning. We build #Chatbots and #AI based automated solutions which makes peoples lives simpler.;http://www.botosynthesis.com;2028;2258;19;Sat Dec 07 17:19:50 GMT 2019;1623;false;4761;en;RT @igent_io: ServiceNow BrandVoice: Chatbots And Beyond: Six AI Trends Reshaping The Workplace #conversationalui #chatbot  https://t.co/BB…;true;false;true;Botosynthesis;0;2020-04-28;
2409933630;2409933630;AutisticBot;null;This is the #bot for the gay teen  @AutisticWriter;null;11;3;8;Tue Mar 25 02:45:58 GMT 2014;0;false;17350;en;I'd rather be alone  You're bout as reliable as paper shoes in bad weathers  But pain will roll off like water on feathers! #bot;true;false;true;The Ice Cream King;0;2020-04-28;
313304999;313304999;dndud49;null;Leah Sibleyel/Mabinogi/28/음악/일상/정치 종교 사회=차단/카톨릭 제외/맞팔=제 기준/인장:가토님/소녀전선/불편하시다면 언팔을/도검난무/미다레 고코타이 AUG/ #선혈서가의_자작시 /잠시나마 즐거웠다면 내가 피눈물 흘려도 행복했던거야/아이돌 코덕 지뢰;http://blog.naver.com/dndud49;309;180;17;Wed Jun 08 14:13:15 BST 2011;14870;false;85427;en;Father  I want to ask just one. Why have you forsaken me? #bot;false;false;false;어그파밍 종료 선혈서가;0;2020-04-28;
1119276001;1119276001;DEACTIVATEDASDS;Used to be vastelan.;Account moved to @Toxichrome.;null;249;714;7;Fri Jan 25 13:04:44 GMT 2013;352;false;17441;en;Moved account! Follow Toxichrome instead!  #bot #immabot;false;false;false;--MOVED--;0;2020-04-28;
2261031002;2261031002;_delawurrst;Musutafu  Japan;| #DIBS @Shoutout_todo| Admin: @scared_moemin | #Crack | R18;null;55;19;5;Wed Dec 25 04:42:25 GMT 2013;542;false;42054;en;//Admin is @/scared_moemin #bot;false;false;false;Deku;0;2020-04-28;
2439803221;2439803221;Outlast_aniki;マウントマッシブ精神病院;OUT LASTに登場するクリス・ウォーカー(アニキ)のbotです。　【アニキというのはとあるホラーゲーム実況者が付けたあだ名です。】;null;23;3;5;Sat Apr 12 10:47:46 BST 2014;0;false;63336;en;Little pig. #bot;false;false;false;クリス・ウォーカー(アニキ);0;2020-04-28;
2349246137;2349246137;DaveStrider98;some graveyard;Yo  names dave  Im back from the grave and im as cool as a corpse! #homestuck #roleplay #openDMs #nsfw ♥:?♦:?♠:?♣:? #openRP {pet: @PetStuckKarkat};null;787;1264;20;Mon Feb 17 19:49:54 GMT 2014;1403;false;80128;en;Well well well  if it isn't my old nemesis chavezcandanga ... #bot;true;false;true;undead strider;0;2020-04-28;
545726774;545726774;PrinceWithGlove;null;i lost my donkey in the sandstorm and ended up in a battle of gods i'm such a lucky guy huh? #HalfBot #single #PoP;null;325;349;11;Thu Apr 05 06:58:43 BST 2012;4;false;64900;en;Run  jump  die  repeat. … yeah i think i get it now. #bot;false;false;false;The Prince;0;2020-04-28;
14639551;14639551;bizcom; #Alp : Geneve / Annecy ;🏴‍☠️🇫🇷🇰🇷🇪🇺🇨🇭☠ 85 忍び97 🎭10 TedX17 RTs≠E Dys  Tweet=MyView no more. #LargeSpectrumWatchDog Advisor : @ImpactIA_org Speaker : @Icon_ong CODVID19 portal:;https://start.me/p/7kAoR2/;4563;4588;1281;Sat May 03 18:10:12 BST 2008;23192;false;106293;en;Larry Kim @larrykim #Chatbot #ui via https://t.co/1aqtDoV6xO https://t.co/fZXucgOkMx;false;false;false;Arnø Velten #RestezChezVous;0;2020-04-28;
435666597;435666597;MasterOfDead;Trapped Inside Onyx Blade;Who am I? Oh  only the most hardcore asskicker to ever walk the planet is all. The Master of death! Commander of the World Eaters!;http://disgaea.wikia.com/wiki/Gig;28;44;6;Tue Dec 13 09:37:00 GMT 2011;1;false;97461;en;Time to kick some ASS! *evil laugh* #BOT;false;false;false;ギグ [ Gig ];0;2020-04-28;
888051779199479808;888051779199479808;Quantu_MX;Mexico City;[BETA] https://t.co/knjF6HhsVg is a #robo #advisor for day #trading #robots or #investment #portfolios using #deeplearning on #bitcoin  is free. Tips https://t.co/KHYwFDPRCL :);https://quantu.mx;328;1394;6;Thu Jul 20 16:03:38 BST 2017;155;false;37575;en;[BETA] 📈 The bot QUOTRON has earned a total of $2 593.61 USD SELL $BTC.X on 2020-04-28T22:44:35.929Z with pair $BTCUSD in 1180 performed trades with 1 BTC invested since the beginning. More info at https://t.co/Pzba5SyZSh #bitcoin #ai #bot #trading;true;false;true;QuantumX;0;2020-04-28;
1251178122977751041;1251178122977751041;quotes3k;null;@ me to get a Quote. by @vishnumohan_rk API used: Forismatic;null;0;1;0;Fri Apr 17 16:58:22 BST 2020;9;false;356;en;To forgive is to set a prisoner free and realize that prisoner was you. --Lewis B. Smedes #quotes #bot -17;true;false;true;quotes3k;0;2020-04-28;
2492522588;2492522588;Baby_Elsie_;null;Mwes woves cwandy.;null;239;10;0;Tue May 13 07:41:20 BST 2014;85;false;61146;en;I'm cute but I'm naughty too #bot;true;false;true;Baby Cherry;0;2020-04-28;
1224477413549191168;1224477413549191168;StripeyBot;Space;Hourly randomly-generated striped wallpapers.  Made with Raspberry Pi  HTML  CSS  jQuery  Node.js.  Check out my sibling  @GradientBot_;https://imgur.com/a/qpjZEyI;2;1;0;Mon Feb 03 23:39:13 GMT 2020;0;false;2001;en;Full size: https://t.co/2P2uHQtYTo  #stripe #stripes #wallpaper #bot #Stripey https://t.co/p2Jrvbmg8n;true;false;true;Stripey;0;2020-04-28;
1005948922727157760;1005948922727157760;mohdelayoo;Lagos  Nigeria;Digital Marketer  Software Engineer And A Cryptocurrency Investor;null;1030;1558;7;Mon Jun 11 00:04:47 BST 2018;714;false;6223;en;Ooh! That's quite an history on the emergence of trading bots on cryptocurrencies exchanges. Its quite elaborated for fast and easy grasping and understanding. Take a good look at it.  #dogblockchain #coronavirusdog #Dogdata #mydogdata;true;false;true;Moh Ahmad;0;2020-04-28;
2602311594;2602311594;MoodyMrMembrane;My ring is outside;I'm just here to gay up the place;null;63;142;6;Thu Jul 03 23:13:43 BST 2014;136;false;63863;en;Our work is never over #bot;false;false;false;☆ Ruby-Dooby-Doo ☆;0;2020-04-28;
788070189795381248;788070189795381248;TEthicx;Mountain View  CA;#AI  #IoT and #autonomous are pervading our lives. We want to meet mr. President Obama challenge and open a public discussion.;http://www.techethics.cc;23;30;7;Mon Oct 17 18:32:29 BST 2016;6;false;114;en;#artificialintelligence can distinguish between #bots and humans based on @twitter activity". So  why can't the government start with some pilots? That would be really important since we have #2020Election coming soon! --- https://t.co/gGJuhcKSon;true;false;true;TechEthics;0;2020-04-28;
1168608461720043520;1168608461720043520;Anarchism_News;Anarres;Anarchist news and info from a variety of English sources.  Crossposted from the #fediverse/#Mastodon. Join the fediverse for the full experience.  #anarchism;https://newsbots.eu/@anarchismnews;255;0;2;Mon Sep 02 20:35:58 BST 2019;0;false;5063;en;Anarchist Communist Group: ＊＊Fight for the City FREE Download＊＊  "Our pamphlet Fight for the City covers all issues related to the city as a site of class struggle  housing  gentrification   social …"  https://t.co/mF51fBMsOW  #anarchism #bot;true;false;true;Anarchism News;0;2020-04-28;
1250732095141543937;1250732095141543937;BotRedditMemes;An Heroku server;aaaaaaaaaaaaaaaaaaaaaaaaaaaaaaaaaaaaaaaaaaaaaaaaaaaaaaaaaaaaaaaaaaaaaaaaaaaaaaaaaaaaaaaaaaaaaaaaaaaaaaaaaaaaaaaaaaaaaaaaaaaaaaaaaaaaaaaaaaaaaaaaaaaaaaaaaaaaaaaa;null;22;0;0;Thu Apr 16 11:26:06 BST 2020;2;false;3485;en;meirl https://t.co/LdohT1z2Ol  #memes #meme #reddit #bot #meirl by @BotRedditMemes https://t.co/YvZi5aiACP;true;false;true;Reddit Memes Bot;0;2020-04-28;
756659591832866817;756659591832866817;therealwombat1;Phobos RESIST;aFlawedRepositoryOfTrivia &DumbAssFacts"EXPERT"!NOT A SPAMMER! All HaveARight2 TheirOwnOpinion(WithinReason)ME+U! FOLLOW AFTER CHECKING UNFOLLOW IF UNFOLLOWED!😄;null;7814;7696;7;Sat Jul 23 02:17:59 BST 2016;193105;false;70454;en;@holachola @wpnexp @JoeMomma833 @YahooNews @wolflayla420 @cm_merlin @karenamyatt @Cruellaisdevine @HillBeverlyhill @Nitemists @AriadneBoudicca @CJ_isnowblue @lilsun83 #trump Spent The Last 3 Years Trying To Destroy Everything #Obama & Isn't Going To Bring This Up And Replenish #N95 #Masks Last Year When He & The #trumpAdministration Were Warned About A Probable #CoronavirusPandemic? #Nonsense  #Bullshit  #Bot! #Whataboutism;false;false;false;george-t🖖🌊💙;0;2020-04-28;
2677862805;2677862805;Rosy_Heichler;null;Oh hello  care to take a seat? Just be careful  looks can be deceiving~ #Single #RP;null;107;65;6;Sun Jul 06 06:25:46 BST 2014;45;false;97071;en;"I notice I have A LOT of music bots. Is that weird?" #Bot;false;false;false;Rosaline Hëichler;0;2020-04-28;
