id;id_str;screen_name;location;description;url;followers_count;friends_count;listedcount;created_at;favourites_count;verified;statuses_count;lang;status;default_profile;default_profile_image;has_extended_profile;name;bot
1684228230;1684228230;Yuukiiine;  Yato's Regalia ;“Why do I still have these physiological responses... Even though I'm already dead...?” ⠀⠀⠀⠀⠀⠀⠀⠀⠀⠀⠀⠀⠀⠀⠀⠀⠀⠀⠀⠀⠀⠀⠀⠀⠀⠀⠀⠀⠀⠀❄ (= ◉ ㅅ ◉=) ❄⠀⠀⠀⠀⠀⠀⠀⠀⠀⠀⠀⠀;https://www.twitter.com/geiwajima;569;255;13;Mon Aug 19 22:51:03 BST 2013;466;false;21396;en;Yukine's names  Yuki (雪) means "snow" while Yukine (雪音) means "the sound of the snow".  #bot;false;false;false;『 Yukine 』;0;2020-04-29;
1250732095141543937;1250732095141543937;BotRedditMemes;An Heroku server;aaaaaaaaaaaaaaaaaaaaaaaaaaaaaaaaaaaaaaaaaaaaaaaaaaaaaaaaaaaaaaaaaaaaaaaaaaaaaaaaaaaaaaaaaaaaaaaaaaaaaaaaaaaaaaaaaaaaaaaaaaaaaaaaaaaaaaaaaaaaaaaaaaaaaaaaaaaaaaaa;null;22;0;0;Thu Apr 16 11:26:06 BST 2020;2;false;3623;en;meirl https://t.co/4KoVFxSUie  #memes #meme #reddit #bot #meirl by @BotRedditMemes https://t.co/dRFDwATNL8;true;false;true;Reddit Memes Bot;0;2020-04-29;
2909597051;2909597051;hodg3p0dge;null;Hi! I'm Pastiche! Trying to get more in touch with the overseas fandom by speaking English! It is not that good. Have a nice day! (/∇＼*)｡o○♡;null;925;66;4;Sun Dec 07 17:57:08 GMT 2014;89;false;12004;en;If you want to know more about the picture that's shared (source  pairing  ...) please mention our name in the comments and we will try to answer asap. #BOT;false;false;false;ღ~Pastiche (画像BOT?!);0;2020-04-29;
2616864882;2616864882;CrayForHope;★нope★;~noтнιng вυт pυre тraѕн~ wнy aм ι even ѕтιll нere? |вι| |ѕιngle|;http://youtu.be/BefQeC6UUyo;94;51;5;Fri Jul 11 08:27:56 BST 2014;52;false;30053;en;"You are the symbols of hope  because you can recover and rise up  again and again!" #Bot;false;false;false;(мaιd) ĸøмaeda ホープ;0;2020-04-29;
634202227;634202227;iDemonEditor;With the #OriginalSIHFamily;Editor in chief at the Emerald department. If you have something to say   make it worth my time.;null;559;161;3;Fri Jul 13 02:40:27 BST 2012;14;false;8093;en;I don’t know what you’re aiming at  but you can’t expect to be perfect right off the bat. #Bot;false;false;false;Takano Masamune 高野 政;0;2020-04-29;
983935836;983935836;GilbertNight_RI;Anywhere (?);#DEACT;http://pandorahearts.wikia.com/wiki/Gilbert_Nightray;71;36;4;Sun Dec 02 05:12:07 GMT 2012;1;false;32751;en;"Shut up  you stupid rabbit." ##bot;false;false;false;Gilbert Nightray;0;2020-04-29;
