id;id_str;screen_name;location;description;url;followers_count;friends_count;listedcount;created_at;favourites_count;verified;statuses_count;lang;status;default_profile;default_profile_image;has_extended_profile;name;bot
1934512382;1934512382;Aono_Tsukune_;Yokai Academy;A Shinso-class Vampire  also a Ghoul. A former human. Studies at Yokai Academy. My nickname is Tsuki but I advice you not to call me that. | #RP #Multiverse;null;423;420;7;Fri Oct 04 15:56:12 BST 2013;47;false;47018;en;"That's why one day... regardless of Inner or Outer  I hope that the two of you become one. For me  both of you are just as important. #bot;false;false;false;Tsukune Aono;0;2020-04-29;
869996526;869996526;Yui_Goidou;null;i'm drummer  music is my life!;http://kaminomi.wikia.com/wiki/Yui_Goid%C5%8D;30;1;7;Tue Oct 09 15:37:45 BST 2012;0;false;39423;en;with music  my dream become true! ##bot;false;false;false;五位堂 結 | Yui Goidou;0;2020-04-29;
1094476690284314624;1094476690284314624;botexpresslog;Lagos;null;http://www.botexpresslogistics.com;18;23;0;Sun Feb 10 06:02:32 GMT 2019;25;false;127;en;We are glad to announce to you that we now offer doorstep delivery to the following locations for as low as =N=2 000. 1.OYO 2. OSUN 3. ONDO 4. EKITI 5. EDO 6. DELTA #bot #botexpress #worldwide #express #safe #secure #expeditious #COVID19 #ExtendTheLockdown #indaboski;true;false;true;BOT Express Logistics;0;2020-04-29;
1142754403679637504;1142754403679637504;blingblingoton;Warri  Nigeria;Proudly Akwa ibomite  #Blogger #Travelling # Fashionista # FunnyDude # Great Skills... # Prefect imperfect;null;67;903;0;Sun Jun 23 12:20:55 BST 2019;634;false;481;en;RT @botexpresslog: We are glad to announce to you that we now offer doorstep delivery to the following locations for as low as =N=2 000. 1.…;true;false;true;BLINGBLINGOTON;0;2020-04-29;
826395461460303873;826395461460303873;TopTwitchFails;Latvia;Enthusiast  interested in following topics as #CryptoCurrency #Crypto #Blockchain #Startup #Bitcointalk #Bitcoin #Ethereum;null;11235;11524;26;Tue Jan 31 11:43:26 GMT 2017;3022;false;5060;en;RT @olportal: How can #ArtificialIntelligence drive a more sustainable society? Our new article explores this possibility - https://t.co/LK…;false;false;false;CryptoMoneyMaker;0;2020-04-29;
420426784;420426784;penny_for;null;null;null;33;4;0;Thu Nov 24 16:20:20 GMT 2011;1;false;27982;en;“When we love  we always strive to become better than we are. When we strive to become better than we are  everything around us becomes better too.” ― Paulo Coelho  The Alchemist #hope #hopebot #bot;false;false;false;Hope Bot;0;2020-04-29;
1229408280134336513;1229408280134336513;RanviKashyap;null;Gratitude  peace happiness🙏;null;687;1238;0;Mon Feb 17 14:12:51 GMT 2020;981;false;1048;en;RT @NavtaranS: Have a query regarding #COVIDー19 ? Drop a message on #WhatsApp #chatbot! #PunjabGovt has collaborated with @NetcoreSolution…;true;false;true;Ranvir;0;2020-04-29;
134480272;134480272;basedontrust;Lagos  Nigeria;IG: botexpresslogistics;http://www.botexpresslog.com;370;365;2;Sun Apr 18 15:55:06 BST 2010;385;false;15715;en;RT @botexpresslog: We are glad to announce to you that we now offer doorstep delivery to the following locations for as low as =N=2 000. 1.…;true;false;true;PAPA T;0;2020-04-29;
1250732095141543937;1250732095141543937;BotRedditMemes;An Heroku server;aaaaaaaaaaaaaaaaaaaaaaaaaaaaaaaaaaaaaaaaaaaaaaaaaaaaaaaaaaaaaaaaaaaaaaaaaaaaaaaaaaaaaaaaaaaaaaaaaaaaaaaaaaaaaaaaaaaaaaaaaaaaaaaaaaaaaaaaaaaaaaaaaaaaaaaaaaaaaaaa;null;22;0;0;Thu Apr 16 11:26:06 BST 2020;2;false;3610;en;I'm proud of you son! https://t.co/VynoKPeXqE  #memes #meme #reddit #bot by @BotRedditMemes https://t.co/6QP9IvEF7D;true;false;true;Reddit Memes Bot;0;2020-04-29;
2922251470;2922251470;BloodStainedBR;With Oz;I'm scared that I'm not human. I'm scared I'm different from other chains. I fear the things I don't know. I fear things I already knew and at every moment.;http://tl.gd/n_1sj6rqm;350;153;8;Mon Dec 15 00:30:21 GMT 2014;29;false;29682;en;"I'm in a contract with you. You are my manservant  and as a manservant  what were you thinking  leaving me behind!?" To Oz #Bot;true;false;true;Alice アリス;0;2020-04-29;
800545694;800545694;RPH_FXSulli;@agencyRPH;Rorong eL Reowok Syokin ♥;null;106;153;5;Mon Sep 03 15:41:39 BST 2012;86;false;21201;en;Dear My family.. thanks for all.. i'll miss you so bad.. moah lol wkwk  #bot;false;false;false;GoJahe (?);0;2020-04-29;
2616864882;2616864882;CrayForHope;★нope★;~noтнιng вυт pυre тraѕн~ wнy aм ι even ѕтιll нere? |вι| |ѕιngle|;http://youtu.be/BefQeC6UUyo;94;51;5;Fri Jul 11 08:27:56 BST 2014;52;false;30051;en;"After being on the verge of death  I finally understood. All I ever wished for was 'someone's love" #Bot;false;false;false;(мaιd) ĸøмaeda ホープ;0;2020-04-29;
854281062;854281062;kakandabosDO;null;ACC INI DEACT ! PINDAH KE @kakabosyesung;null;238;428;7;Sun Sep 30 08:25:33 BST 2012;95;false;51452;en;Trust Me ! IM NOT MORGAN !!! #BOT;false;false;false;DEACT! LOOK BIO!;0;2020-04-29;
890336965;890336965;_Kagene_Rei;Beside Rui-chan ♥;RP|Hi!My name is Kagene Rei!I'm the black side of Kagamine Len|@KiruaZorudikku_ Aniki|@_Kagene_Rui's♥ (19.10.12!!!)|@=Follback;http://fanloid.wikia.com/wiki/Kagene_Rei;27;13;4;Fri Oct 19 06:08:23 BST 2012;15;false;20335;en;I'm the black side of Kagamine Len #Bot;false;false;false;-Hiatus-;0;2020-04-29;
3297617749;3297617749;deepakagg89;Noida;Program Manager at Times Of India  Noida;null;20;32;0;Mon Jul 27 13:22:00 BST 2015;1;false;12;en;Our resolution to combat threats of COVID-19  and to ensure a safe and healthy environment. The digital event is scheduled to take place on May 27  2020 for Southeast Asia region audience. https://t.co/kCFRHkJVE5  @chatbotsmag @chatbooks #Marketing @Marketingland @TwitterMktg;true;false;true;Deepak Aggarwal;0;2020-04-29;
951365750;951365750;ND_EXOLuhan;null;null;null;323;550;6;Fri Nov 16 09:50:57 GMT 2012;38;false;32118;en;Lets Follow ND_EXOLuhan #bot;false;false;false;DEACT;0;2020-04-29;
811307620720119808;811307620720119808;uxlookinassx;null;I'm a bot that creates phrases from the template "you" + "word" + "lookin' ass" + "word".;null;107;22;6;Tue Dec 20 20:29:44 GMT 2016;549;false;38816;en;you guitar lookin' ass leader #ass #bot;false;false;false;"You X Lookin' Ass X" bot;0;2020-04-29;
3168169731;3168169731;ToyBonBun;Freddy Fazbears Pizza;Hi! Dont bweak tha rules  or ill bite yew! @CuteLilFazbear  @LilBonBunny  and @ThatRoyalChick are my fwends!;http://scottgames.com;500;99;10;Wed Apr 15 05:27:27 BST 2015;88;false;28660;en;I'm way better then that old withered Bonnie! #Bot;true;false;true;Lil Foxy;0;2020-04-29;
1043513797;1043513797;KawaiiRin_;null;Offline Until December 27;null;330;179;8;Sat Dec 29 00:53:06 GMT 2012;34;false;104048;en;Fate Of Soul #Bot;true;false;true;Kagamine Rin;0;2020-04-29;
108401736;108401736;j7nce;Manchester  UK.;Enterprise Software Application & Development | Data Management | Business Development | AI Machine Learning |;http://about.me/jeffince;71;238;21;Mon Jan 25 20:52:19 GMT 2010;206;false;778;en;RT @consultincey: 5 Reasons Why Your Business Needs Intelligent Bots  https://t.co/pzPJb1zsas #AI #chatbots #CX #CustomerExperience #Machin…;false;false;false;Jeff Ince;0;2020-04-29;
1485859044;1485859044;DeathLordKid;null;Symmetry is key. Everything must be esthetically pleasing. I am Patricia and Elizabeth Thompson's Meister  and son of Lord Death. #SERP;null;840;709;7;Wed Jun 05 20:56:17 BST 2013;25;false;16025;en;"Black Star  I can't come down  there's water. Carry me." #bot;true;false;true;Death The Kid;0;2020-04-29;
3166285911;3166285911;SweetiePieEva;( ^ω^ ) ＴＲＡＶＥＬＩＮＧ~;Hello there everyone! I'm Eva a Flareon with great big dreams to become something more then she is now!;null;269;299;8;Tue Apr 14 18:06:46 BST 2015;17;false;29225;en;Hugs the TL  "Fluffy hugs for you!" #Bot;true;false;true;ⒺⓋⒶ;0;2020-04-29;
803338808;803338808;Dontedemonkillr;Leanbox  Gamindustri;Demon killer  rebel  stylish. Not a fan of demonic authorities but I guess my goddess is alright. #NeptuniaRP;http://devilmaycry.wikia.com/wiki/Dante_(DmC);119;98;9;Tue Sep 04 23:27:19 BST 2012;3;false;127420;en;I die  I come back. Insane! #Dante #Bot;true;false;true;Dante;0;2020-04-29;
1250623148858327040;1250623148858327040;NguyenN0h0p3;Hà Nội  Việt Nam;Normal Vietnamese guy who makes memes for fun and for friends. Love games  anime/manga (especially ecchi & hentai) and have a nickname: #n0h0p3;https://www.facebook.com/;8;115;0;Thu Apr 16 04:13:00 BST 2020;1740;false;853;en;RT @thepythontutorz: Deep Learning Chatbot  ☞ https://t.co/jZ13lW1AfF  #DeepLearning #Chatbot https://t.co/DJkJ6YVaMR;true;false;true;NoHopeMan? Nah.;0;2020-04-29;
1026332132367454208;1026332132367454208;ntpowerplatform;Darwin  Northern Territory;Official Northern Territory Power BI User Group. Ideal for first timers to Power BI or those interested in expanding their knowledge & network. #powerbi #darwin;http://www.aidarwin.com.au;28;43;0;Mon Aug 06 06:00:23 BST 2018;82;false;8053;en;POWER BI guide. #powerbi #ITtraining #mspartner #mstraining #aidarwin #ai #artificialintelligence #connectedclassroom #intelligentbusiness #future #visionary #business #technology #bots #microsoft https://t.co/ubHOhyJkdr https://t.co/kMGNKG5u0O;false;false;false;NTPowerPlatform;0;2020-04-29;
117633536;117633536;Fishman_Dan;Sydney;Sports Photography  technology. Lover of all sports. Actively supporting amateur and community sporting organisations. Insta & FB: dcsportsphotography;http://www.dcsportsphoto.com.au;224;350;10;Fri Feb 26 03:50:37 GMT 2010;6724;false;12466;en;@pc_politically @AaronDodd And this #bot also speaks many languages .... when it suits.   300 tweet history. All but one made in the last month.   This #bot is categorically a stolen account.   What do you think @Twitter https://t.co/gFEKJQd24H;false;false;false;Daniel Cohen;0;2020-04-29;
1215623006;1215623006;_NanaIJA;null;Role Player of Im Jin Ah from After School  | 91 L | #kaumhorny |#YadongAddict;null;303;312;7;Sun Feb 24 14:20:21 GMT 2013;33;false;50797;en;[FACTS] Sohyun gets called "kid" by Yoseob #bot;false;false;false;Sexy Nana ;);0;2020-04-29;
1167990955;1167990955;Tiro_Finale_;Mitikihara City;Ah  good evening. Would you like some tea? Even better  how about having a spare! (#Multiverse);null;66;26;8;Mon Feb 11 05:57:53 GMT 2013;0;false;58565;en;If Soul Gems give birth to witches  then we have no choice but to die! Both me and you!  #mami #bot;true;false;true;Mami Tomoe;0;2020-04-29;
1250732095141543937;1250732095141543937;BotRedditMemes;An Heroku server;aaaaaaaaaaaaaaaaaaaaaaaaaaaaaaaaaaaaaaaaaaaaaaaaaaaaaaaaaaaaaaaaaaaaaaaaaaaaaaaaaaaaaaaaaaaaaaaaaaaaaaaaaaaaaaaaaaaaaaaaaaaaaaaaaaaaaaaaaaaaaaaaaaaaaaaaaaaaaaaa;null;22;0;0;Thu Apr 16 11:26:06 BST 2020;2;false;3611;en;Next we're gunna find neverland https://t.co/fzft1LXc3P  #memes #meme #reddit #bot by @BotRedditMemes https://t.co/heTIiIWTS8;true;false;true;Reddit Memes Bot;0;2020-04-29;
1189187268;1189187268;Legion_Kbot;창조주와 함께라면..;Mass Effect 2~3 비공식 반자동봇   Mass Effect 2 기반   My name is Legion  for we are many.   관심글을 참조해주세요.;null;263;388;11;Sun Feb 17 11:27:19 GMT 2013;8;false;22817;en;"This is a database. It contains a portion of the heretics' accumulated memories." #BOT;false;false;false;Legion;0;2020-04-29;
1208779424;1208779424;ShelbyBroBot_;null;Bro bot for @BroFistChu :3;null;1011;1389;8;Fri Feb 22 14:44:03 GMT 2013;1;false;91032;en;What's more funny: Being depressed or being funny with you? #Bot;true;false;true;Shelby Bot :3;0;2020-04-29;
2710162663;2710162663;JeffLeDerp;You Don't Wanna Know...;Go To Sleep || The only way you can Truly smile is if I cut you one  Ear To Ear... || #OpenRP #Smile || More Alive At Night ||;null;1073;226;9;Tue Aug 05 20:34:16 BST 2014;110;false;13888;en;" Die Motherfucker!! " #Bot;true;false;true;Jeff The Killer;0;2020-04-29;
3272307073;3272307073;CallousBlonde;null;fuCking Fuck!;null;27;245;0;Wed Jul 08 22:42:42 BST 2015;873;false;28758;en;"my aunt took her indoor cat outside for the first time"  https://t.co/ZXhucR2Huh (look at it's face  omg)  #Bot;true;false;true;Alexis✨;0;2020-04-29;
155835463;155835463;MdShahbazKhan;New Delhi;Head Special Initiatives & Business Strategy : EconomicTimes | Ex-CNBC TV18 | SAPIndia #Leo #Traveller. Note: Views are my own  RTs aren't endorsements;null;222;1028;11;Tue Jun 15 09:16:39 BST 2010;4752;false;1886;en;RT @deepakagg89: Our resolution to combat threats of COVID-19  and to ensure a safe and healthy environment. The digital event is scheduled…;false;false;false;Md Shahbaz Khan🔅;0;2020-04-29;
176662110;176662110;jborocz;null;_________ Author between the lines _________ https://rutgers.academia.edu/jborocz http://globalsocialchange.blogspot.com;http://borocz.net;657;1834;40;Tue Aug 10 04:11:12 BST 2010;4735;false;13295;en;THE NEW ORDER OF #BOTS / A #DYSTOPIAN SCENARIO  2 DAYS BEFORE INTERNATIONAL #LABOR DAY  What if  say  in the #US  of those laid off now only a relatively small fraction is hired back. Instead there is a quantum jump in #robotic applications. . .  https://t.co/gMvEMCtYN3;true;false;true;Jozsef Borocz 約瑟夫;0;2020-04-29;
1309262078;1309262078;SharinganVille;Ⓣⓦⓘⓣⓣⓔⓡ;Hey you guys show some love to @BelowTheButler and @YoullLoveIt  );http://www.youtube.com/watch?v=7pzGKW4ZQ2Y;426;270;8;Thu Mar 28 03:07:19 GMT 2013;1010;false;130462;en;If you don't know where you're going  any road'll take you there #Bot;false;false;false;Ⓥⓘⓛⓛⓔ;0;2020-04-29;
350458754;350458754;xenvita_;Hellsalem's Lot (NEW YORK);☆SHE/HER☆中文OK☆[💕OC's  KH & YGO5DXAL💕]☆Please credit when repost works☆Looking for work  contact: xenvita@gmail.com☆CuriousCat: http://curiouscat.me/xenvita☆;https://www.artstation.com/xenvita;5237;510;116;Sun Aug 07 21:19:07 BST 2011;221732;false;305423;en;[#BOT] CARRD: https://t.co/1iN0KRfNJZ;false;false;false;🔺XΞN🔺;0;2020-04-29;
1365729024;1365729024;LokiEvilSchemes;null;How will your friends have time for me  when they're so busy fighting you?   ((RP/Sometimes #bot));null;24;0;7;Sat Apr 20 01:37:28 BST 2013;0;false;42618;en;If it's all the same to you  I'll have that drink now. #bot;false;false;false;Loki;0;2020-04-29;
2834110110;2834110110;MercifulStotch;South Park  Colorado.;Leopold ''Butters'' Stotch  only son of Linda and Stephen Stotch. [pfp credit - N/A sorry][♡: @QMarksAndUndies];http://ask.fm/MercifulPaladin;351;56;8;Sat Sep 27 16:10:26 BST 2014;45;false;49145;en;"Ha! I told you you sit on it that way! I told you!" #Bot;false;false;false;Stotch.;0;2020-04-29;
