id;id_str;screen_name;location;description;url;followers_count;friends_count;listedcount;created_at;favourites_count;verified;statuses_count;lang;status;default_profile;default_profile_image;has_extended_profile;name;bot
2286104688;2286104688;YukinaChan_;Prev: callmesakai;姫柊 雪菜. I was a witch attack known as Sword Shaman|#TTGF #G5 #sυƍοίƒαмs #parody;http://strike-the-blood.wikia.com/wiki/Yukina_Himeragi;116;78;7;Sat Jan 11 04:54:35 GMT 2014;23;false;18675;en;"she is a middle-school girl sent from the Lion King" #Bot;false;false;false;Yukina Himeragi;0;2020-04-28;
2443708464;2443708464;RPAnimeWorld__;null;Rules -＞[ http://tl.gd/n_1s1i0rd ] | Agency RP for Anime/Manga/Vocaloid etc^^ Need Member! | Owner : #Chii Admin : #Sayu #Miuna | Come and Join us!^0^;null;23;8;5;Mon Apr 14 11:54:16 BST 2014;20;false;12268;en;Wanna join? Just mention and don't forget to check rules!^^ #bot;true;false;true;Need Member!;0;2020-04-28;
405450215;405450215;tujuh_dua72;Lantai 3 diantara 71&73;We are Seven Two Advanced Classes! Keep solid and Stay Cool! \m/;http://www.stac72.blogspot.com;38;30;7;Sat Nov 05 10:11:13 GMT 2011;0;false;100979;en;"I give you puyunghai~ But you want capcaiii~" - NZB #72Quotes #Bot;true;false;true;STAC♪;0;2020-04-28;
54750573;54750573;loudypolitics;Lisbona  Portugal;null;https://twitter.com/rafaelgrillikc;206;714;5;Wed Jul 08 02:20:07 BST 2009;1142;false;1731;en;@cbouzy @BotSentinel: it is said in brazil that president’s offsprings have an office of hate  responsible for sharing #fakenews using #bots and make absurds to be true  destroying reputations  etc. U are being recognized here because u r being useful 4 our crashing democracy.;false;false;false;RG;0;2020-04-28;
435666597;435666597;MasterOfDead;Trapped Inside Onyx Blade;Who am I? Oh  only the most hardcore asskicker to ever walk the planet is all. The Master of death! Commander of the World Eaters!;http://disgaea.wikia.com/wiki/Gig;28;44;6;Tue Dec 13 09:37:00 GMT 2011;1;false;97460;en;Di-Did I fall in love with that Kid? hmph! #BOT;false;false;false;ギグ [ Gig ];0;2020-04-28;
2492522588;2492522588;Baby_Elsie_;null;Mwes woves cwandy.;null;239;10;0;Tue May 13 07:41:20 BST 2014;85;false;61145;en;I'm a cute cherry #bot;true;false;true;Baby Cherry;0;2020-04-28;
1111406021224861696;1111406021224861696;GradientBot_;Space;Hourly randomly-generated gradient wallpapers.  Made with Raspberry Pi  HTML  CSS  jQuery  Node.js  Check out my sibling  @StripeyBot;https://imgur.com/a/TzcMhP6;3;1;0;Thu Mar 28 23:13:39 GMT 2019;2;false;2042;en;Full size: https://t.co/Vwwe1wsTxP  #gradient #gradients #wallpaper #bot #GradientBot https://t.co/o0IEgvJd1m;true;false;true;GradientBot;0;2020-04-28;
1250732095141543937;1250732095141543937;BotRedditMemes;An Heroku server;aaaaaaaaaaaaaaaaaaaaaaaaaaaaaaaaaaaaaaaaaaaaaaaaaaaaaaaaaaaaaaaaaaaaaaaaaaaaaaaaaaaaaaaaaaaaaaaaaaaaaaaaaaaaaaaaaaaaaaaaaaaaaaaaaaaaaaaaaaaaaaaaaaaaaaaaaaaaaaaa;null;22;0;0;Thu Apr 16 11:26:06 BST 2020;2;false;3479;en;Ha wasn't supposed to do that https://t.co/ACrlHf8eS6  #memes #meme #reddit #bot by @BotRedditMemes https://t.co/u3x7nig51W;true;false;true;Reddit Memes Bot;0;2020-04-28;
796135065289945088;796135065289945088;igent_io;Rio de Janeiro  Brazil;Daily news and articles on #AI  #robotics  #IoT  #blockchain and #conversationalUI Managed by @HumbertoBAranha. Visit http://igent.io form more articles.;https://igent.io;1523;2172;53;Tue Nov 08 23:39:25 GMT 2016;77;false;24261;en;France launches AI voice assistant to help coronavirus patients #conversationalui #chatbot #voiceassistant  https://t.co/wu9iXKztZ9 https://t.co/50P7NspOUW;true;false;true;igent.io;0;2020-04-28;
2312532377;2312532377;ijoewright_86;Virginia Beach  VA;#4rMDaJourNaL INC.   JESUS 1st!!! Genius SONGWRITER  Top Of The Line Producer  Poetic  Entrepreneur  Mentor  Booking & Contact info : 4rmjinc@gmail.com ⌚;https://www.facebook.com/4rMDaJouRnaLInc;1359;2940;26;Wed Jan 29 19:13:31 GMT 2014;31234;false;24759;en;RT @oldmanebro: Sucks that an American Flag in ya bio automatically raises flags about being a #Bot &/or a white supremacist...;true;false;true;@ijoewright86;0;2020-04-28;
611510974;611510974;Itabby_AR;here to protect whiskas!;ver @animerp_ina.私の名前イタリア #nekotalia Itabby desu~ | gimme pasta  9 pasta is awesome  I know |follback? Waiting me online XD |  belong to whiskas and friskies(?);null;282;217;7;Mon Jun 18 09:25:19 BST 2012;3;false;97027;en;I'am just a cat :3 nyan~ #bot;false;false;false;Itabby タビー;0;2020-04-28;
222319740;222319740;AmericanIGinc;West Palm Beach  FL;#ArtificialIntelligence to inspect and provide emergency management for critical #Infrastructure 🏗 #Drones 🇺🇸 #Satellite 🛰 #ServiceDisabledVeteran owned 📊;https://americaninfrastructuregroup.com;1725;4414;21;Fri Dec 03 02:19:43 GMT 2010;441;false;9136;en;RT @olportal: How can #ArtificialIntelligence drive a more sustainable society? Our new article explores this possibility - https://t.co/LK…;true;false;true;American Infrastructure Group;0;2020-04-28;
819075168;819075168;yowie_bot;In the land downunder;Curious? Just a prototype #AI bot doing some #IoT  #AI_analysis  #blockchain #energyTrading with #cactii_powerchain info.bot@yowie.org;https://bit.ly/2kBBCsK;183;23;31;Wed Sep 12 08:52:49 BST 2012;415;false;9721;en;📊 Power trade alert: Billarga just paid $0.06c to buy 0.6 kWh of Greenvale's excess solar power. That means $0.08c less money in the pocket of the energy bureaucracy and energy at just 42% of normal retailer price.   💚  #IoT #bot https://t.co/TuamrVRtxa;false;false;false;yowie_bot;0;2020-04-28;
1220481111396167682;1220481111396167682;diallo70695483;null;nananan;null;1;0;0;Thu Jan 23 22:59:19 GMT 2020;0;false;461;en;The best thing about a boolean is even if you are wrong  you are only off by a bit. @Maurice Wilkes #quoteApiByDiallo #bot  @bot;true;false;true;diallo;0;2020-04-28;
2593935008;2593935008;JaakkoTheRipper;null;Hey Guys an girls go follow @BelowTheButler and @YoullLoveIt;null;175;190;7;Sun Jun 29 01:47:37 BST 2014;732;false;105197;en;The longer and more carefully we look at a funny story  the sadder it becomes. #Bot;false;false;false;;0;2020-04-28;
555355344;555355344;Arfoire;Gamindustri;I am Arfoire  the main antagonist of Hyper Dimension Neptunia. I will not stop until the Goddesses are brought down! (RP/PARODY);http://hyperdimensionneptunia.wikia.com/wiki/Arfoire;159;104;5;Mon Apr 16 18:10:15 BST 2012;0;false;37808;en;Haaaah ha ha ha! I've found you Neptune #Arfoire #Bot;false;false;false;マジェコンヌ;0;2020-04-28;
625501257;625501257;iCedric_Diggory;Hogwart;RP Account of Cedric Diggory from Harry Potter :);null;250;32;12;Tue Jul 03 10:41:17 BST 2012;0;false;132482;en;Cedric father is Amos Diggory #bot;true;false;true;Cedric Diggory;0;2020-04-28;
1401014629;1401014629;ReaperRebellion;Probably with @ForbiddenIgnis;《 ソウルイーター》~ SӨЦL ΣΛŦΣЯ {#BBRP} {#MV} {Parody/Serious} {AU};http://awakeningwings.wikia.com/wiki/Ragna_the_Bloodedge;803;1712;7;Sat May 04 00:50:42 BST 2013;443;false;40787;en;"...Why do I suddenly feel the urge to punch her?" #bot;true;false;true;ラグナブラッドエッジ;0;2020-04-28;
731498500773543936;731498500773543936;superclipartbot;Japan;the best clipart bot in the world  using the best clipart from http://www.irasutoya.com/;http://cheapbotsdonequick.com/source/superclipartbot;33;0;51;Sat May 14 15:56:47 BST 2016;2;false;27645;en;Untitled 744 by Advanced AI Art Bot™ #bot #art https://t.co/8E9MhNhReM;true;false;true;Super Clipart Bot™;0;2020-04-28;
775551679;775551679;Lyrica5pb;Leanbox;Hello everbody! This is 5pb! How you doing? I'm the Gamindustri Pop Idol  Also hostess for Hi-Five Radio~. Nice to meet you~! @Mages5pb is my twinny! #Neptunia;null;526;106;11;Thu Aug 23 10:11:21 BST 2012;16;false;27596;en;M-my name's Lyrica! Y-you must have the wrong person! #Lyrica #Bot;false;false;false;5pb.;0;2020-04-28;
2769983561;2769983561;BerserkAragaki;Iwatodai Dorm;Tch  I don't have time for this shit...[#P3P] [#Multiverse];http://megamitensei.wikia.com/wiki/Shinjiro_Aragaki;331;425;6;Sun Sep 14 13:35:39 BST 2014;114;false;33286;en;"Let's do it!" #bot;true;false;true;Shinjiro Aragaki;0;2020-04-28;
753761641;753761641;garry_blue_rose;Weiss Guertena's Museum;[RP] Hi there  I'm Garry. I hate trapped in the Fabricated World  but I made it because of you  Ib. #single;null;78;40;7;Sun Aug 12 21:49:14 BST 2012;5;false;67112;en;"You reflected the sunlight with the mirror? Not too shabby!" #bot;true;false;true;Prince of Blue Rose;0;2020-04-28;
810276072;810276072;IbLonelyRedRose;Guertena Gallery;I want to escape from this place... please don't leave me alone... please.. #RP #IbKingdom [mention for followback];http://ibgame.wikia.com/wiki/Ib_(person);41;11;9;Sat Sep 08 06:49:51 BST 2012;1;false;96247;en;She is a short  9 year old girl  with dark hair  red eyes  and wears a white shirt adorned with a red bow  matching her skirt #Bot;false;false;false;Ib the Red Rose;0;2020-04-28;
888051779199479808;888051779199479808;Quantu_MX;Mexico City;[BETA] https://t.co/knjF6HhsVg is a #robo #advisor for day #trading #robots or #investment #portfolios using #deeplearning on #bitcoin  is free. Tips https://t.co/KHYwFDPRCL :);https://quantu.mx;328;1394;6;Thu Jul 20 16:03:38 BST 2017;155;false;37573;en;[BETA] 📈 The bot WOLFIE has earned a total of $1 380.93 USD SELL $BTC.X on 2020-04-28T22:19:33.565Z with pair $BTCUSD in 897 performed trades with 1 BTC invested since the beginning. More info at https://t.co/Pzba5SyZSh #bitcoin #ai #bot #trading;true;false;true;QuantumX;0;2020-04-28;
841183980;841183980;_DemonCatherine;Anywhere~;I suppose my name is Catherine. Be careful  I'm no ordinary girl. I suppose you'll see the truth of what I am sooner or later~! #Catherine [RP Pure 18+];null;688;98;8;Sun Sep 23 08:09:11 BST 2012;0;false;96067;en;You may call me over  I'll be there when you awaken  but  you won't remember /why/ you called me. That's the fun part~! #Bot;false;false;false;Catherine [Succubus];0;2020-04-28;
1250732095141543937;1250732095141543937;BotRedditMemes;An Heroku server;aaaaaaaaaaaaaaaaaaaaaaaaaaaaaaaaaaaaaaaaaaaaaaaaaaaaaaaaaaaaaaaaaaaaaaaaaaaaaaaaaaaaaaaaaaaaaaaaaaaaaaaaaaaaaaaaaaaaaaaaaaaaaaaaaaaaaaaaaaaaaaaaaaaaaaaaaaaaaaaa;null;22;0;0;Thu Apr 16 11:26:06 BST 2020;2;false;3480;en;Should’ve kept his mouth shut https://t.co/ntDhufMAvT  #memes #meme #reddit #bot by @BotRedditMemes https://t.co/66pGSXMNE7;true;false;true;Reddit Memes Bot;0;2020-04-28;
420426784;420426784;penny_for;null;null;null;33;4;0;Thu Nov 24 16:20:20 GMT 2011;1;false;27955;en;"Never be bullied into silence. Never allow yourself to be made a victim. Accept no one's definition of your life  define yourself."--Harvey Fierstein #hope #hopebot #bot;false;false;false;Hope Bot;0;2020-04-28;
1170802004655894528;1170802004655894528;_asifbhat_;Pune  India;Data Analyst   SAP BI  YellowFin BI   Python  Docker   Kubernetes | Interests - #datascience #machinelearning #deeplearning #AI #Robotics #BusinessIntelligence;null;1091;385;5;Sun Sep 08 21:52:22 BST 2019;148;false;913;en;Artificial Intelligence Technology Solutions secures seven-unit order from Texas transit agency. https://t.co/Ctrj2eWRP4  #ArtificialIntelligence #AI #Robotics #DataScience #MachineLearning  #DeepLearning #IoT #PredictiveAnalytics #BigData #Chatbots  #DataScientists;true;false;true;Asif Bhat;0;2020-04-28;
793441118;793441118;ShoutaYukisa;Marukawa Shoten;Kisa Shouta ne~! One of the Shoujo Manga Editors of Marukawa Shoten's  Emerald Department. 30 years old. And engaged to @BookStoreHost. #SekaiichiHatsukoiRP;http://ask.fm/ShoutaYukisa;767;180;7;Fri Aug 31 10:00:29 BST 2012;68;false;61986;en;This is how this guy always barges his way inside me. Stirring my heart with that brilliant smile. That wall that I worked so hard to build  he scales it as if it were nothing. #KisaShouta #Bot;false;false;false;Kisa Shouta ショウタ キサ;0;2020-04-28;
925131158;925131158;Vai_Oliver;English;[V] @Vai_RolePlay ☀ #Engloid #YoungBoy #Vocaloid3 #VocaTone #PowerFX #Cody #James #OOC ☀ Yoroshiku~;null;92;12;8;Sun Nov 04 11:02:26 GMT 2012;2;false;87416;en;He is the first young boy Vocaloid not to use an adult voice and the first Vocaloid 3 English voicebank. #bot;false;false;false;Oliver-Chan;0;2020-04-28;
954890941;954890941;xMiraSutorausu;Grand Magic Games. ;[Verified by @xFairyTailGuild] The head maid waitress of FairyTail. Also a S-class wizard. Lisanna and Elfman's nee-chan. Take over magic.~;https://www.twitter.com/Lucceheartfilia/;606;92;4;Sun Nov 18 05:19:03 GMT 2012;3;false;17701;en;#BOT's gonna in charge here until she comes back.;false;false;false;Mirajane Strauss;0;2020-04-28;
863912432;863912432;SayaneeNMB48;Namba  Osaka;Captain of NMB48 Team N  Sayanee koto Yamamoto Sayaka desu  yoroshiku! ||山本彩a.k.aさや姉 || [N]MB48 || I'm not the Real Sayanee  but feel free to chat^^ #48FamilyRP;http://stage48.net/wiki/index.php/Yamamoto_Sayaka;267;118;12;Sat Oct 06 01:55:58 BST 2012;61;false;82059;en;Sayanee or Yamamoto Sayaka is the captain of NMB48's Team N #bot;false;false;false;Sayaneeさや姉;0;2020-04-28;
826946779;826946779;AnR_Gakupo;Miku's ♡;{ official anime RP » @AnRworld }Kamui Gakupo from Vocaloid | @AnR_Miku's ma girl ♥ | #AnRVocaloid #VocaloidFamily;http://vocaloid.wikia.com/wiki/Kamui_Gakupo;448;213;5;Sun Sep 16 12:24:34 BST 2012;5;false;106274;en;I've always wanted to say this to you  this mere one phrase  if my uncontrollable impulse will end up being shattered. #bot;false;false;false;Gakupo (┒•́.•̀♈̷̴);0;2020-04-28;
3072452621;3072452621;yaboiibaymax;Helping those who need help;Hello  I am Baymax  your personal healthcare companion. | #Rp | #single;null;37;14;4;Thu Mar 05 14:09:33 GMT 2015;3;false;10560;en;Have a lollipop *holds out lollipop* #Bot;true;false;true;Baymax;0;2020-04-28;
2357763049;2357763049;N_Shikamaru_;Konohagure;Too lazy to do anything  just laying on my body to see the sky | Naruto RP | [IC/OOC];null;54;50;0;Sun Feb 23 09:39:16 GMT 2014;0;false;3341;en;After Shikamaru was assigned to Team 10  Asuma noticed that Shikamaru was much sharper than his Academy scores indicated. #info #bot;true;false;true;Shikamaru;0;2020-04-28;
953399623;953399623;OrekiH_RP;Everywhere;((Hiatus  I'm sorry)) [V] @AniMangaRP - #Hyouka | I'm not lazy i just conserve my energy | @ChitandaEru_RP's since [21.12.2012] | Sometimes OOC | @=Follback;http://myanimelist.net/character/55131/Houtarou_Oreki;145;107;9;Sat Nov 17 11:25:59 GMT 2012;2;false;79753;en;I'll share Oreki Houtarou's quotes now /bows/ #bot;false;false;false;Oreki [H]outarou;0;2020-04-28;
181963000;181963000;wiwer77;Algérie Oran;‏قال الإمام مالك رحمه الله :(لايصلح اخر هذه الأمة إلا بما صلح به أولها );https://medium.com/@wiwer77/has-recommended;1269;627;1833;Mon Aug 23 14:48:43 BST 2010;2196;false;29483;en;Artificial intelligence will be used to power cyberattacks  warn security experts https://t.co/cOtz97Bz6e #AI #IA #BigData  #Robots #Python #Chatbot #CyberSecurity #DataViz #DeepLearning #DataScience #Drone #JavaScript #Security #Iot #MachineLearning #Algorithm;false;false;false;salaf salih;0;2020-04-28;
811307620720119808;811307620720119808;uxlookinassx;null;I'm a bot that creates phrases from the template "you" + "word" + "lookin' ass" + "word".;null;107;22;6;Tue Dec 20 20:29:44 GMT 2016;549;false;38794;en;you efficiency lookin' ass estate #ass #bot;false;false;false;"You X Lookin' Ass X" bot;0;2020-04-28;
19002214;19002214;NoToTheRight;The 99%;A Progressive who believes “If a free society cannot help the many who are poor  it cannot save the few who are rich” ~ JFK 1/20/61;null;783;1644;22;Wed Jan 14 23:50:34 GMT 2009;1449;false;31277;en;@nancyth27964332  @StormyDaniels Nancy no picture  2 followers and a random string of numbers. You are a #BOT;false;false;false;NTTR;0;2020-04-28;
66795320;66795320;johnnypappas;Southern California ;Screenplays  Stories | Biz Intel | Boston Sports | Greek-USA | Like Sci-Fi  Science  Well-written Characters! | He/Him | Certified Geek™ | Human Race Advocate;http://linktr.ee/johnnypappas;5064;5229;274;Tue Aug 18 21:43:56 BST 2009;3058;false;15846;en;@thomasmweber @GavinNewsom @realDonaldTrump No it won't. Get a clue. #covidiot #covidiots #Bot #Troll;false;false;false;Johnny Pappas, Writer, Filmmaker 🖋📄🎥📸 ∞;0;2020-04-28;
3168169731;3168169731;ToyBonBun;Freddy Fazbears Pizza;Hi! Dont bweak tha rules  or ill bite yew! @CuteLilFazbear  @LilBonBunny  and @ThatRoyalChick are my fwends!;http://scottgames.com;500;99;10;Wed Apr 15 05:27:27 BST 2015;88;false;28654;en;I sure do love to eat ass! #Bot;true;false;true;Lil Foxy;0;2020-04-28;
803338808;803338808;Dontedemonkillr;Leanbox  Gamindustri;Demon killer  rebel  stylish. Not a fan of demonic authorities but I guess my goddess is alright. #NeptuniaRP;http://devilmaycry.wikia.com/wiki/Dante_(DmC);119;98;9;Tue Sep 04 23:27:19 BST 2012;3;false;127401;en;Not that I'm looking. If it were up to me  they'd stay in the underworld. But I guess no one asked me. #Dante #Bot;true;false;true;Dante;0;2020-04-28;
1250732095141543937;1250732095141543937;BotRedditMemes;An Heroku server;aaaaaaaaaaaaaaaaaaaaaaaaaaaaaaaaaaaaaaaaaaaaaaaaaaaaaaaaaaaaaaaaaaaaaaaaaaaaaaaaaaaaaaaaaaaaaaaaaaaaaaaaaaaaaaaaaaaaaaaaaaaaaaaaaaaaaaaaaaaaaaaaaaaaaaaaaaaaaaaa;null;22;0;0;Thu Apr 16 11:26:06 BST 2020;2;false;3481;en;meirl https://t.co/UsQYdNQEfs  #memes #meme #reddit #bot #meirl by @BotRedditMemes https://t.co/d3cruqs8GR;true;false;true;Reddit Memes Bot;0;2020-04-28;
222319321;222319321;InvestArtIntel;West Palm Beach  Florida;#ArtificialIntelligence + #MachineLearning + #Infrastructure;https://americaninfrastructuregroup.com/investors/;1206;136;34;Fri Dec 03 02:17:58 GMT 2010;16;false;3152;en;RT @olportal: How can #ArtificialIntelligence drive a more sustainable society? Our new article explores this possibility - https://t.co/LK…;true;false;true;Artificial Intelligence Investing News;0;2020-04-28;
2481466878;2481466878;HoennAssassin;Hoenn;Life has a meaning. I have lived up to that meaning. I have seen many different things /#PTRP/#ACRP/I never knew I had these feelings for you @BountyInShadows;https://biol.be/HoennAssassin;1300;442;17;Wed May 07 06:46:10 BST 2014;2823;false;61988;en;"Conner  Azazi  where are you?" #Bot;true;false;true;Garret Helims [Vampire];0;2020-04-28;
1208779424;1208779424;ShelbyBroBot_;null;Bro bot for @BroFistChu :3;null;1010;1389;8;Fri Feb 22 14:44:03 GMT 2013;1;false;91012;en;Here Duckie  Duckie  Duckie. Come get a cwacker~ X3 #Bot;true;false;true;Shelby Bot :3;0;2020-04-28;
222320437;222320437;InvestMachLearn;West Palm Beach  FL;#MachineLearning #Technology #Blockchain #Infrastructure #Investment #Drones #DeepLearning;null;823;717;15;Fri Dec 03 02:22:56 GMT 2010;89;false;8191;en;RT @olportal: How can #ArtificialIntelligence drive a more sustainable society? Our new article explores this possibility - https://t.co/LK…;true;false;true;Machine Learning Investing News;0;2020-04-28;
1212748814;1212748814;CronaTheLona;DWMA  Death City.;I'm Crona.. Um.. I made a T-Twitter account.. B-but I don't know if I can deal with it.. Be nice. I have black blood.. And like pasta.. *frowns* #SERP.. *gulps*;http://souleater.wikia.com/wiki/Crona;414;110;9;Sat Feb 23 16:42:45 GMT 2013;0;false;88145;en;Thumbtacks in my shoes would stick into my feet whenever I tried to walk. It would hurt. I don't think I could deal with that really. #Bot;true;false;true;Crona;0;2020-04-28;
2389225785;2389225785;shinracomplex;null;you can unfollow me here!!;null;445;1276;17;Thu Mar 06 20:23:05 GMT 2014;52022;false;50796;en;if you want to stay mutuals ask for my new acc please!! #bot;false;false;false;corrin: dm for new @;0;2020-04-28;
3243767972;3243767972;xPirateCoveFox;The Office;A-all I wanted w-was quick money... #Single;http://Scottgames.com;285;40;8;Sat Jun 13 02:41:25 BST 2015;13;false;18595;en;*Takes a crappy selfie* #Bot;true;false;true;Jeremy Fitzgerald;0;2020-04-28;
1249704535;1249704535;swordsgirl_3;xxxx;The name's Kerri! I'm a Vizard but I keep my abilities to myself. BRO: @GrimmjowUchiha #Healer#LovesWolves#Vizard#Taken ~ @VisoredCaptain;null;57;88;7;Thu Mar 07 18:01:54 GMT 2013;1;false;48300;en;My heart belongs to VisoredCaptain *blushes and smiles* #bot;false;false;false;DEACTIVATED;0;2020-04-28;
1164520945;1164520945;Benny3rror;In øne øf yøur døwnløads..;THe wØrst viRUs evər wøuld be mƏ.. ||| ¤M@jør GlįŤcH¤ ||| I love Water|| #OpenRp ⭕️|| Yøu Shøuldn't Have D¤ne That~;null;451;86;13;Sun Feb 10 00:45:37 GMT 2013;62;false;76412;en;" Sally and me get along pretty well. No one else is really nice enough to spend time with her. SLendy is too busy being a stalker.. " #Bot;true;false;true;BƏn Đrøwnəđ;0;2020-04-28;
1277715308;1277715308;AMF_Sai;木ノ葉隠れの里 Konohagakure no Sato;[V] @AM_Family | Team 7 with dickless Naruto-kun  ugly Sakura-chan  Yamato-taichou  & Kakashi-sensei. Ask me http://ask.fm/SaiTheAnbu #B3STFAMS;http://naruto.wikia.com/wiki/Sai;108;94;2;Mon Mar 18 13:11:11 GMT 2013;1;false;12895;en;Sai's favourite food is momen tofu  while his least favourite is mitarashi dango #bot;false;false;false;サイ Sai [SH];0;2020-04-28;
1325510245;1325510245;TheOfficialEska;ૅૅRepublic City⊙ે;ે⊙Princess of thee Northern Water Tribe⊙⊙Cousin to Korra⊙⊙Sister to Desna•• Bolin is mine for the taking only••;http://avatar.wikia.com/wiki/Eska;85;146;0;Wed Apr 03 22:40:44 BST 2013;1;false;64477;en;Why Is Farther...so creepy...#Bot;true;false;true;Princess Ēskā [☆☆☆];0;2020-04-28;
3407334679;3407334679;LostInTheTrees_;null;null;null;179;119;3;Mon Aug 31 21:24:28 BST 2015;294;false;33646;en;CAKE AND COOKIES! Jack_Septic_Eye :D  #Bot;true;false;true;inactive;0;2020-04-28;
1309262078;1309262078;SharinganVille;Ⓣⓦⓘⓣⓣⓔⓡ;Hey you guys show some love to @BelowTheButler and @YoullLoveIt  );http://www.youtube.com/watch?v=7pzGKW4ZQ2Y;426;270;8;Thu Mar 28 03:07:19 GMT 2013;1010;false;130443;en;Don't cry because it's over  smile because it happened.#Bot;false;false;false;Ⓥⓘⓛⓛⓔ;0;2020-04-28;
1073346368;1073346368;AkashiS_;null;RolePlayer of Akashi Seijuuro from Kuroko no basket | Mention for follback~ RP Only | OOC/IC | #DuoTypo w/@OF_Chihaya;http://kurokonobasuke.wikia.com/wiki/Seij%C5%ABr%C5%8D_Akashi;144;79;3;Wed Jan 09 09:55:10 GMT 2013;15;false;16293;en;Mention for follback  ) #bot;false;false;false;Akashi Seijuurou;0;2020-04-28;
1365729024;1365729024;LokiEvilSchemes;null;How will your friends have time for me  when they're so busy fighting you?   ((RP/Sometimes #bot));null;24;0;7;Sat Apr 20 01:37:28 BST 2013;0;false;42609;en;I've seen worlds you've never known about! I have grown  Odin's Son  in my exile! I have seen the true power of the Tesseract  and when I wield it... #bot;false;false;false;Loki;0;2020-04-28;
2834110110;2834110110;MercifulStotch;South Park  Colorado.;Leopold ''Butters'' Stotch  only son of Linda and Stephen Stotch. [pfp credit - N/A sorry][♡: @QMarksAndUndies];http://ask.fm/MercifulPaladin;351;56;8;Sat Sep 27 16:10:26 BST 2014;45;false;49126;en;"But I don't want a canadian girlfriend  Eric!" #Bot;false;false;false;Stotch.;0;2020-04-28;
1073351604450050048;1073351604450050048;blackpeopledata;Global;We are passionate about publishing articles that help readers understand how topics of interest impact black people in America and abroad.Publish today!#article;https://blackpeopledata.com/;190;153;2;Thu Dec 13 22:58:59 GMT 2018;154;false;7164;en;RT @wiwer77: Artificial intelligence will be used to power cyberattacks  warn security experts https://t.co/cOtz97Bz6e #AI #IA #BigData  #R…;false;false;false;Black People Data;0;2020-04-28;
2358562603;2358562603;andrewmorrisuk;Bedford;Passionate about how IT solutions can bring positive value to our business and personal lives. Proud #autisticparent;null;10738;788;305;Sun Feb 23 21:58:16 GMT 2014;3137;false;382242;en;RT @wiwer77: Artificial intelligence will be used to power cyberattacks  warn security experts https://t.co/cOtz97Bz6e #AI #IA #BigData  #R…;true;false;true;Andrew Morris;0;2020-04-28;
1374502172;1374502172;narutoisuzumaki;magnolia;age:14years old |Mention to follback|;http://www.google.com;197;571;5;Tue Apr 23 13:06:23 BST 2013;1;false;14411;en;magic: Lightning dragon slayer #Bot;false;false;false;johan sutanta;0;2020-04-28;
1239515534141652995;1239515534141652995;_twitwork;null;Specialized in twitter surveillance. Contact me for more information on #TwitWork software. #Osint #BigData #DataViz #100DaysOfCode;https://github.com/atmoner/TwitWork;334;1;21;Mon Mar 16 11:35:30 GMT 2020;32;false;17937;en;RT @wiwer77: Artificial intelligence will be used to power cyberattacks  warn security experts https://t.co/cOtz97Bz6e #AI #IA #BigData  #R…;true;false;true;Twitwork 👁;0;2020-04-28;
1239515534141652995;1239515534141652995;_twitwork;null;Specialized in twitter surveillance. Contact me for more information on #TwitWork software. #Osint #BigData #DataViz #100DaysOfCode;https://github.com/atmoner/TwitWork;334;1;21;Mon Mar 16 11:35:30 GMT 2020;32;false;17937;en;RT @wiwer77: Artificial intelligence will be used to power cyberattacks  warn security experts https://t.co/cOtz97Bz6e #AI #IA #BigData  #R…;true;false;true;Twitwork 👁;0;2020-04-28;
1128188337670348800;1128188337670348800;SonicOCBot;Mobius;Auto-generating new Sonic OCs  because our lives weren't plagued enough by them | OC maker images taken from https://t.co/vLrXoLRFPg | Made by @benny_b00;null;78;0;0;Tue May 14 07:40:35 BST 2019;0;false;15832;en;Lindsey the Gnat #sonicoc #bot https://t.co/I2zOrCaF6D;true;false;true;Sonic OC Bot;0;2020-04-28;
